value,filename
his friend Lalach. The latter met,90373_0.txt
Warech in the street and asked him,90373_0.txt
why made the information. Before,90373_0.txt
he could he reply Lalach shot him twice.,90373_0.txt
"At Nowata, Okla., two negroes, accused",90374_0.txt
of being implicated in the killing,90374_0.txt
of Deputy. James Gibson during,90374_0.txt
"a jail delivery, were taken from the",90374_0.txt
jail by mob and lynched in front,90374_0.txt
of the courthouse a.,90374_0.txt
GETS AFTER LYNCHERS.,90375_0.txt
"GUTHRIE, Okla., July 18.- For the",90375_0.txt
first time in history the Oklahoma government,90375_0.txt
will prosecute lynchers.,90375_0.txt
United States Marshal John A. Bern-,90375_0.txt
athy and two assistant United States,90375_0.txt
attorneys are in Osage tonight to secure,90375_0.txt
evidence against members of the,90375_0.txt
mob that Tuesday night hanged the,90375_0.txt
"negro, Frank Bailey, for assaulting the",90375_0.txt
"brakeman, Frank Kelly. Charges of",90375_0.txt
murder will be preferred against the,90375_0.txt
men and boys. Osage is in the Indian,90375_0.txt
reservation and the authorities,90375_0.txt
have no jurisdiction territorial.,90375_0.txt
NEGROES ARE LYNCHED,90376_0.txt
.[ Republican A. P. Leased Wire],90376_0.txt
"MACON, Ga., Dec. 20.- Samuel Bla",90376_0.txt
negroes. we.,90376_0.txt
Willie Stewart.,90376_0.txt
- and,90376_0.txt
", lynched near Eastman, Ga .. tonight",90376_0.txt
"a mob, which had taken them fr",90376_0.txt
"a the Eastman jail, according to advi",90376_0.txt
here. The negroes bodies We,90376_0.txt
"received riddled with bullets, the message said",90376_0.txt
Who says the colored race is not,90377_0.txt
"Mississippi, a progress? In making",90377_0.txt
lynched a just negroes has mob of,90377_0.txt
negro.,90377_0.txt
NEGRO IS LYNCHED,90378_0.txt
[ Republican A. P. Leased Wire],90378_0.txt
"HENDERSON, Ky., Nev. 28.- Ellis",90378_0.txt
"Puckner, a negro charged with having",90378_0.txt
"attacked a young girl last night, was",90378_0.txt
taken from the county jail here today,90378_0.txt
by a mob about fifty masked men,90378_0.txt
and hanged of to a tree.,90378_0.txt
IN OKLAHOMA,90380_0.txt
NEGRO IS LYNCHED,90380_0.txt
"ADEBEL, Okla., April 3.- Oscar",90380_0.txt
"Martin, a negro, was taken from",90380_0.txt
a justice of the peace court room,90380_0.txt
here today and hanged by a mob,90380_0.txt
at the rear of the court house,90380_0.txt
from which his preliminary trial,90380_0.txt
had been in progress.,90380_0.txt
The mob overpowered the officers,90380_0.txt
"in the court room, placed a",90380_0.txt
"rope around the negro's neck,",90380_0.txt
"rushed him out onto a porch, tied",90380_0.txt
the end of a rope to a porch,90380_0.txt
railing and pushed the negro off.,90380_0.txt
He fell about 12 feet and,90380_0.txt
within a few minutes. died,90380_0.txt
DAM DYNAMITING,90381_0.txt
BRINGS ARRESTS,90381_0.txt
[ Republican A. P. Leased Wire],90381_0.txt
"OKMULGEE, Okla., June 4.- Twenty",90381_0.txt
- one arrests have been made in Ok-,90381_0.txt
gee county as a result of alleged,90381_0.txt
"revelations, said to have been made to",90381_0.txt
"officers by Will Baker, who is held in",90381_0.txt
connection with the dynamiting of the,90381_0.txt
Dewar water works Saturday night.,90381_0.txt
Eight of the men have been brought to,90381_0.txt
Okmulgee for araignment safe,90381_0.txt
keeping. and,90381_0.txt
"According to of cers, Baker was operators will live up to their agree-",90381_0.txt
"found a dazed condition near the ment, which was a formal one, and",90381_0.txt
Dewar in standpipe shortly after an ex- that the miners and the workers at,90381_0.txt
plosion had destroyed it. Attempts of other crafts will do likewise. From all,90381_0.txt
a mob to lynch Baker early Sunday appearances there will be á continu-,90381_0.txt
"are said to have caused him to make ance of the usual prosperity, even more",90381_0.txt
officers regard- augmented feeling,90381_0.txt
disclosures to by the better,90381_0.txt
alleged,90381_0.txt
an alleged organization to resist brought about by the settlement of,90381_0.txt
registration. the strike.,90381_0.txt
"Twenty United States deputy mar-"" The work of Judge McBride in the",90381_0.txt
"shals and fifty deputy sheriffs have settlement of the strike was splendid,",90381_0.txt
sent into the Dewar- Henrietta and to him is due the major portion of,90381_0.txt
smelting been and mining district for duty the credit for its accomplishment. Col-,90381_0.txt
"onel Hornbrook, the representative of tomorrow.",90381_0.txt
A Murderer Lynched.,90382_0.txt
"VINCENNES, Ind., Jan. 21.- At midnight",90382_0.txt
yesterday a well organized force of,90382_0.txt
"men, provided with sledge hammers and",90382_0.txt
"other implements, went to jail, and having",90382_0.txt
effected an entrance took Epp the,90382_0.txt
",,",90382_0.txt
"murderer of Farmer Dobson, from the",90382_0.txt
sheriff's hands and hanging him to a,90382_0.txt
"went quickly about their business,",90382_0.txt
leaving tree the body hanging.,90382_0.txt
TWO NEGROES LYNCHED,90383_0.txt
[ Republican A. P. Leased Wire],90383_0.txt
"ANDERSON, S. C., Jan. 3.-",90383_0.txt
"Johnson of Hart county, Georgia Sheriff, tele-",90383_0.txt
phoned here late today that two neg-,90383_0.txt
roes were killed on the South Carolina,90383_0.txt
"side of the Savannah river, ene of",90383_0.txt
them being shot down and the other,90383_0.txt
"bound by a mob, taken into a wood and",90383_0.txt
there lynched. The attack on the neg-,90383_0.txt
roes was said to have result from one,90383_0.txt
of them speaking to a white,90383_0.txt
who passed on a country road woman in a,90383_0.txt
buggy,90383_0.txt
A LYNCHER SHOT.,90385_0.txt
"Galveston, July 11- A News Gates-",90385_0.txt
ville special says that Louis Johnson and,90385_0.txt
four or five others went to the house of,90385_0.txt
Harriet Contnegress f the Papose,90385_0.txt
of lynching the negro Jessie Isaac. Some,90385_0.txt
went to the back door and others to the,90385_0.txt
front door and began shooting. Isaac,90385_0.txt
returned the fire and Johnson was instantly,90385_0.txt
killed. Isaac escaped.,90385_0.txt
had a handkerchief over his face. Johnson,90385_0.txt
LYNCHED BY VIGILANTES.,90385_1.txt
"Louisville, Ky., July 11 The Courier",90385_1.txt
Journal's Russellville special says A,90385_1.txt
:,90385_1.txt
inob of six armed and masked men,90385_1.txt
mounted on horseback came from Todd,90385_1.txt
county to this place last night between,90385_1.txt
"11 and 12 o'clock, took Dick Henderson",90385_1.txt
"colored, from jail and lynched him.",90385_1.txt
Henderson was charged with cutting the,90385_1.txt
"throat of young Adams, a white boy, at",90385_1.txt
"Pincheor, Todd county, last April .. He",90385_1.txt
was brought here from Elkton in the,90385_1.txt
latter part of May to escape mob violence,90385_1.txt
Adams is not dead and will,90385_1.txt
not,90385_1.txt
die from. his wounds.,90385_1.txt
Negro Is Lynched,90386_0.txt
By Oklahoma Mob,90386_0.txt
( By Review Leased Wire.),90386_0.txt
"OKLAHOMA CITY, Okla., June 16.",90386_0.txt
"-Henry Conly, a negro, was lynched",90386_0.txt
"by a mob of 1,000 men and women",90386_0.txt
"near Holdenville, Okla., late today,",90386_0.txt
"after, it is said, he had been positively",90386_0.txt
"identified by Mrs. Jesse L. Burford,",90386_0.txt
"wife of a well to do farmer, as the",90386_0.txt
man who had assaulted her one week,90386_0.txt
ago today.,90386_0.txt
Conly was taken to Holdenville,90386_0.txt
early this afternoon from the vicinity,90386_0.txt
"of Randolph, where he was captured",90386_0.txt
by a posse which had searched for,90386_0.txt
him almost continuously for a week.,90386_0.txt
The officers guarding Conly were,90386_0.txt
over- powered and the negro was,90386_0.txt
turned over to a party of men and,90386_0.txt
boys who hurried him to the Burford,90386_0.txt
"home, where Mrs. Burford",90386_0.txt
him. identified,90386_0.txt
ALLEGED MURDERER LYNCHED.,90388_0.txt
"TEXARKANA, Tex., Jan. 24.W.",90388_0.txt
"Mayfield, charged murder was reported",90388_0.txt
"lynched in with Boston, Texas.",90388_0.txt
NEGRO IS LYNCHHED,90389_0.txt
( By Review Leased Wire,90389_0.txt
"POPLARVILLE, Miss., April 18.-",90389_0.txt
"Claud Singleton, a negro convicted",90389_0.txt
last night of the murder in March of,90389_0.txt
"E. Bounds, a railroad worker was",90389_0.txt
today J. taken from the jail and lynched.,90389_0.txt
NEGRO COOK LYNCHED.,90392_0.txt
"HOUSTON, Sept. 21.- A negro cook",90392_0.txt
working for an oil contractor was,90392_0.txt
taken from the jail at Goose Creek,90392_0.txt
this afternoon and lynched by a mob,90392_0.txt
of 800 oil field warkers. The negro,90392_0.txt
was with attacking the wife,90392_0.txt
of an charged oil driller.,90392_0.txt
Posse Captures Omaha,90393_0.txt
Rifle Slayer,90393_0.txt
( Continued from Page One),90393_0.txt
ing some one in the neighborhood was,90393_0.txt
"oing it, so they wouldn't look for",90393_0.txt
"me somewhere else,"" Carter said. So",90393_0.txt
well did his ruse work that constant,90393_0.txt
patrol of the neighborhood was main--,90393_0.txt
"ained almost all week, day and night.",90393_0.txt
Carter asserted that when he fired,90393_0.txt
into the drug store window a block,90393_0.txt
"from where he had felled McDevitt,",90393_0.txt
that no one was in his line of fire.,90393_0.txt
The bullet barely missed a woman,90393_0.txt
clerk.,90393_0.txt
"Not since the search for Pat Crowe,",90393_0.txt
!,90393_0.txt
"kidnaper of Edward Cudahy, Jr., two",90393_0.txt
"decades ago, or the hunt for Fred",90393_0.txt
"Brown', Benson chainman,"" a few",90393_0.txt
"years ago, has such a man hunt occupied",90393_0.txt
authorities as that of the past,90393_0.txt
week. Even the excitement prevailing,90393_0.txt
"during the race riots here in 1919,",90393_0.txt
when a negro was lynched and sev-,90393_0.txt
"pral persons wounded, some fatally",90393_0.txt
was not more general than the nerv-,90393_0.txt
"us stress just ended, police assert.",90393_0.txt
The town of Bartlett declared a holiday,90393_0.txt
this afternoon. The$ 750 in rewards,90393_0.txt
offered by Omaha newspapers,90393_0.txt
probably will be paid to its,90393_0.txt
who made the capture. citizens,90393_0.txt
NEGGRO IS LYNCHED,90394_0.txt
"LEXINGTON, Tenn., April 22.",90394_0.txt
"Berry Noyes, the negro who shot and",90394_0.txt
killed Sheriff W. E. McBride near here,90394_0.txt
last Saturday was hanged in the court,90394_0.txt
house yard today by a mob. The sher-,90394_0.txt
sought to arrest Noyes for violat,90394_0.txt
iff ing the state prohibition law.,90394_0.txt
Texas Mob Hangs Negro,90395_0.txt
Fails Woman Sleeping,90395_0.txt
After Fiendish Attack on,90395_0.txt
( Continued on Page Four),90395_0.txt
"GROESBECK, Texas, July 27.",90395_0.txt
"Jim Brown, a negro, was lynched",90395_0.txt
today by a crowd of about 200 men,90395_0.txt
"near Ben Hur, a small place near",90395_0.txt
"Groesbeck, for an alleged attempt",90395_0.txt
attack on a young woman at Ben,90395_0.txt
Hur last night. Some one entered,90395_0.txt
the young woman's room while,90395_0.txt
she was asleep and threw a poisonous,90395_0.txt
"acid her body, the acid",90395_0.txt
having been over mistaken for a drug,90395_0.txt
that would produce unconsciousness,90395_0.txt
", according to reports.",90395_0.txt
The man ran when the young,90395_0.txt
woman screamed. A crowd was,90395_0.txt
quickly on the trail and within a,90395_0.txt
I short time Jim Brown was taken,90395_0.txt
in charge. Before the sheriff could,90395_0.txt
arrive the negro had been hanged,90395_0.txt
to a tree and the crowd had dispersed,90395_0.txt
.,90395_0.txt
young woman was not seriously,90395_0.txt
The injured.,90395_0.txt
"MOB, INTENT ON LYNCHING",90396_0.txt
NEGRO BATTLES TROOPS;,90396_0.txt
"COURTHOUSE, IS BURNED",90396_0.txt
in ruins.,90396_0.txt
""" Let's lynch the sheriff,"" yelled",90396_0.txt
the mob's leaders. Gant hurriedly,90396_0.txt
"gathered his wife, two sons and",90396_0.txt
daughter and fled.,90396_0.txt
At midnight the Negro hotel,90396_0.txt
"caught on fire, but the flames",90396_0.txt
extinguished before it was destroyed were.,90396_0.txt
battle or retiring.,90397_0.txt
"Joseph Bumpass, a negro who attacked a",90397_0.txt
"white girl at Hickman, Ky., was taken from",90397_0.txt
Jail by a mob and lynched,90397_0.txt
"Fitzgerald S. Turton,. second lieutenant in",90397_0.txt
( By Associated Press.),90398_0.txt
"Augusta, Ga., August 15.- Two ne-",90398_0.txt
"groes in jail at Statesboro, charged",90398_0.txt
"with murdering the Hodges family,",90398_0.txt
"are said to have confessed, implicating",90398_0.txt
thirteen others. A report by train is,90398_0.txt
that a mob this morning lynched the,90398_0.txt
entire thirteen. Wires from States-,90398_0.txt
boro are cut and efforts are being,90398_0.txt
made to confirm the report.,90398_0.txt
"Atlanta, August 15.- Governor Ter-",90398_0.txt
rell said at noon today that he had,90398_0.txt
not heard of any lynching at States-,90398_0.txt
boro. The wires that were cut were,90398_0.txt
repaired before noon There are,90398_0.txt
a thousand soldiers at. Statesboro.,90398_0.txt
One of the men said that all ne-,90399_0.txt
"groes were fleeing from Springfield,",90399_0.txt
as their lives were not safe there.,90399_0.txt
He stated that the greatest wrath of,90399_0.txt
the mob was directed against the,90399_0.txt
"lower and"" tougher"" negro element,",90399_0.txt
but that the colored people of all,90399_0.txt
classes were fleeing for their lives,90399_0.txt
since the mob might lynch them at,90399_0.txt
moment while in its present state,90399_0.txt
of any mind.,90399_0.txt
and when the villian returned and,90400_0.txt
erased his own name to write on the,90400_0.txt
"board the name of the hero, there",90400_0.txt
were scores of men in the house who,90400_0.txt
felt like forming a mob and lynching,90400_0.txt
"him. All ends well, of course, and",90400_0.txt
the villian is brought to justice at,90400_0.txt
last. Robert Sherman heads the company,90400_0.txt
"as Tom Howe, the ex- sheriff,",90400_0.txt
"who is unjustly accused, and the",90400_0.txt
support is adequate. The same bill,90400_0.txt
will be repeated tonight and tomorrow,90400_0.txt
night and at a matinee Wednes-,90400_0.txt
"day.( Iowa State Register, Des",90400_0.txt
"Moines, Iowa). The above play will",90400_0.txt
be seen at the New Phillips,90400_0.txt
Dec. 17. Saturday,90400_0.txt
"To lynch a man is to murder him,",90401_0.txt
federal government has the and what,90401_0.txt
to do with murder committed in a,90401_0.txt
state in violation of the laws thereof,90401_0.txt
Judge Jones of the United States?,90401_0.txt
a distinction between lynching or,90401_0.txt
other mob lawlessness inspired by a,90401_0.txt
mere felonious purpose to avenge,90401_0.txt
alleged crime and a lynching attri- an,90401_0.txt
colored citizen who was taken from,90401_0.txt
"the Huntsville jail, and lynched,",90401_0.txt
pite the resistance of the state des- au-,90401_0.txt
and virtue enough in some of its stat-,90401_0.txt
utes designed to give effect to the,90401_0.txt
civil war amendments to permit federal,90401_0.txt
action in the Maples case.,90401_0.txt
But how are jurors to determine,90401_0.txt
whether a given lynching is merely a,90401_0.txt
crime against the laws of the State,90401_0.txt
or also a crime against the laws of,90401_0.txt
the United States? Judge Jones suggests,90401_0.txt
"the following test:"" Considering",90401_0.txt
"what was said, as well as what",90401_0.txt
was done by the mob would a white,90401_0.txt
"man, under the same circumstances,",90401_0.txt
have been attacked or murdered by,90401_0.txt
the mob ?? If Mr. Maples,90401_0.txt
was,90401_0.txt
"lynched because he was a negro, and",90401_0.txt
if a white man accused of the same,90401_0.txt
crime would not have been murdered,90401_0.txt
"by a mob, the lynching was an offense",90401_0.txt
against the laws enacted to,90401_0.txt
carry into the thirteenth and,90401_0.txt
fourteenth effect amendments.,90401_0.txt
MOB THREATEN LYNCHING,90402_0.txt
Blaxham Rifles Have Been,90402_0.txt
dered to Protect. Or-,90402_0.txt
Brown has ordered the Blaxham rifles,90402_0.txt
here to hold themselves in readiness to,90402_0.txt
protect the negro who kil.ed three men,90402_0.txt
A mob threatens a lynching..,90402_0.txt
"until shot in the right arm, when he",90404_0.txt
surrendered. A mob composed of,90404_0.txt
about 300 men and boys attacked the,90404_0.txt
"Franklin jail, bent on lynching the",90404_0.txt
negro. While they were forcing an,90404_0.txt
entrance in the rear Sheriff Patterson,90404_0.txt
and two deputies took White out the,90404_0.txt
"front way, hustled him into an automobile",90404_0.txt
and made a speedy run for,90404_0.txt
"Lebanon, the county seat. The departing",90404_0.txt
automobile was fired by,90404_0.txt
members of the mob. at,90404_0.txt
Tennessee Lynching.,90404_1.txt
"Memphis, Tenn., Oct. 30.- George",90404_1.txt
"Estes, a negro who shot and killed",90404_1.txt
Deputy Sheriff Hinton Sasely and fatally,90404_1.txt
wounded Constable John Bowers,90404_1.txt
"when the officers at Hale's Point,",90404_1.txt
"Tenn., about 70 miles north of this",90404_1.txt
"city, raided a crap game in which the",90404_1.txt
"negro was participating, was taken",90404_1.txt
from a sheriff's posse by an armed,90404_1.txt
mob at that place and hanged. The,90404_1.txt
negro was in the custody of Sheriff,90404_1.txt
Pennington and a force of deputies en,90404_1.txt
"route to Ripley, the county seat, when",90404_1.txt
The sheriff,90404_1.txt
overtaken by the mob.,90404_1.txt
and his posse used every means at,90404_1.txt
"their disposal to protect the negro,",90404_1.txt
but were overpowered and the negro,90404_1.txt
secured and executed The mob then,90404_1.txt
quietly dispersed..,90404_1.txt
Mayor Shot By Negro.,90404_2.txt
"Marked Tree, Ark., Oct. 30.- Mayor",90404_2.txt
N. J. Hazel was shot and seriously,90404_2.txt
"wounded by"" Little Rock"" Norton, a",90404_2.txt
"negro, and a posse of citizens is",90404_2.txt
searching the surrounding territory in,90404_2.txt
"an effort to capture the negro, with",90404_2.txt
the avowed intention of lynching him.,90404_2.txt
A negro resident of this place had,90404_2.txt
appealed to Mayor Hazel because of,90404_2.txt
the alleged attentions of Norton to,90404_2.txt
"the complainant's wife, and when Nor-",90404_2.txt
ton saw the mayor and the negro approaching,90404_2.txt
"he opened fire, the bullet",90404_2.txt
striking Mayor Hazel and inflicting,90404_2.txt
dangerous wound. a,90404_2.txt
Two Colored Boys Lynched.,90405_0.txt
"Shelbyville, Ky., Oct. 2.- Jumbo",90405_0.txt
"Field, sixteen, and Clarence Garnett,",90405_0.txt
"both colored, were lynched at 2 a. m.",90405_0.txt
for the alleged murder of Will C.,90405_0.txt
"Hart, a printer. He was stoned to",90405_0.txt
"death Saturday night, Sept. 21. They",90405_0.txt
were taken from jail and hung to a,90405_0.txt
Chesapeake& Ohio trestle near the,90405_0.txt
"jail. The mob acted quietly, battered",90405_0.txt
"down the door, hustled the prisoners",90405_0.txt
out and dispersed before spectators,90405_0.txt
gathered. Hart murdered a man.,90405_0.txt
"He came from Lebanon, O. His",90405_0.txt
murder by the prisoners generally,90405_0.txt
conceded. is,90405_0.txt
Murderer Lynched in Cof-,90408_0.txt
"ferville, Mississippi- sal",90408_0.txt
via a stoloved,90408_0.txt
ndasy to 1oz W bes,90408_0.txt
J. W. Maper poured the contents of a,90410_0.txt
double- barreled shotgun into the body of,90410_0.txt
"Homer Kein at Augusta, Okla., without apparent",90410_0.txt
cause. Kein was fatally wounded.,90410_0.txt
"A mob organized to lynch Mapey, but could",90410_0.txt
not find the officer who took him in charge.,90410_0.txt
The coroner's jury in the case of Mrs.,90410_0.txt
"Emma Lucy Judd, wife of one of the officials",90410_0.txt
"of John Alexander's Dowie's Zion,",90410_0.txt
"has returned a verdict holding Dowie, H.",90410_0.txt
"W. Judd, husband of the woman, and Mrs.",90410_0.txt
Sprecher and Mrs. Bratsch to await,90410_0.txt
action of the grand jury. the,90410_0.txt
A Mississippi Lynching.,90410_1.txt
"West Point, Miss., May 23- Milt",90410_1.txt
"Calvert, a negro, was hanged by eiti-",90410_1.txt
"zens at Griffith, this county, for attempting",90410_1.txt
a criminal assault,90410_1.txt
upon,90410_1.txt
"Tiny Gates, a 10 year- old daughter of",90410_1.txt
Mrs. Ella Gates- at Griffith.,90410_1.txt
tain towns. It was this crowd that ran,90412_0.txt
"amuck on the night of July 26, and treated",90412_0.txt
the dead body of the lynched murderer,90412_0.txt
Arata with such sickening brutality. It,90412_0.txt
was this crowd which the citizens feared,90412_0.txt
might loot the provision stores on the following,90412_0.txt
night. Whether any of the relief,90412_0.txt
camp men were in the mob that lynched,90412_0.txt
"Arata cannot be known, for the camp was",90412_0.txt
not established until the following day:,90412_0.txt
but on the second night none of them were,90412_0.txt
in the mob that gathered and was dispersed,90412_0.txt
"by the police, for they were all in their",90412_0.txt
tents asleep,90412_0.txt
WHO. WERE,90412_0.txt
MOB LYNCHED TWO,90421_0.txt
NEGROES IN ALABAMA,90421_0.txt
"Montgomery, Ala., Sept. 29.- Two",90421_0.txt
"negroes, Miles Phifer and Robert",90421_0.txt
"Crosky, the latter a discharged soldier",90421_0.txt
", were taken from county officials",90421_0.txt
about five miles from Montgomery late,90421_0.txt
today and shot to death by a mob,90421_0.txt
about 25 masked men. Both negroes of,90421_0.txt
PROTEST AGAINST THE,90421_1.txt
LYNCHING OF A NEGRO,90421_1.txt
"Boston, Sept.",90421_1.txt
29.- A telegram protesting,90421_1.txt
against the lynching of a negro,90421_1.txt
and the attack upon Mayor at Omaha,90421_1.txt
yesterday was sent by the,90421_1.txt
Equal Rights league today to National Senator,90421_1.txt
"Omaha, Neb., Sept. 29.- With 800",90421_1.txt
"troops from Forts Omaha and Crook,",90421_1.txt
"Neb., and Camp Dodge, lowa, on rio:",90421_1.txt
duty and with 500 more soldiers due,90421_1.txt
to arrive later tonight Omaha officials,90421_1.txt
were confident there would be no further,90421_1.txt
outbreak of the race riotin,90421_1.txt
which yesterday and last night re-,90421_1.txt
"juries death of two persons, insulted",90421_1.txt
in the,90421_1.txt
to see,90421_1.txt
"tempt to lynch Mayor E. P. Smith,",90421_1.txt
partial destruction by fire of the,90421_1.txt
and County court house.,90421_1.txt
killing. Members of the mob asserted,90422_0.txt
tonight they would be held until Gor-,90422_0.txt
"don, who was captured and placed in",90422_0.txt
"jail late today by the mob, can be",90422_0.txt
taken with them to the scene. It is,90422_0.txt
the mob's intention then to lynch,90422_0.txt
six of the negroes. all,90422_0.txt
"Washington, Ga., Oct. 5.- One pe-",90422_0.txt
"shot to death tonight, two",90422_0.txt
gro was,90422_0.txt
others were whipped and five were being,90422_0.txt
"held, it was said, for lynching by",90422_0.txt
a mob that since daybreak this morning,90422_0.txt
had been scouring the swamps and,90422_0.txt
canebreakes of Lincoln for,90422_0.txt
county shot and,90422_0.txt
LYNCHED. MURDERER,90427_0.txt
"OGDEN, Utah, Dec. 13.- Negro refugees",90427_0.txt
"from Green river, Wyo., arriving",90427_0.txt
here today declared that all colored,90427_0.txt
"men, women and children had",90427_0.txt
been ordered to leave the that town,90427_0.txt
following the lynching of Edward,90427_0.txt
"Woodson, a negro charged with killing",90427_0.txt
a railroad switchman and wounding,90427_0.txt
another. Nearly all left their possessions,90427_0.txt
in Green river having been,90427_0.txt
"given only until last night, to leave.",90427_0.txt
( National News Association),90428_0.txt
"MANCHESTER, Ga., Oct. 19.- Jer",90428_0.txt
"rey Lovelace, the negro, who assaulted",90428_0.txt
Yardmaster Kerman on Saturday,90428_0.txt
night was taken from the jail early to,90428_0.txt
day by a masked mob and hanged in,90428_0.txt
the Ferndale park. No shots,90428_0.txt
fired during the lynching. were,90428_0.txt
MOB LYNCHES NEGRO,90429_0.txt
"( By Associated Press),",90429_0.txt
"VICKSBURG, Miss., May 15.- Lloyd",90429_0.txt
"Clay, 24, negro, alleged to have assaulted",90429_0.txt
"a young white woman, was",90429_0.txt
and his body burned last night,90429_0.txt
"lynched by a mob of about 1,000 persons.",90429_0.txt
""" I beg to say that I am correctly reported",90430_0.txt
to this extent: I said in my canvass two,90430_0.txt
"years ago, and I say now, that, Governor,",90430_0.txt
"as I am, I would lead a mob to lynch any",90430_0.txt
"man, white or black, who had ravished any",90430_0.txt
"woman, white or black. I am on record",90430_0.txt
as having asked the Legislature to give,90430_0.txt
me power to remove any sheriff who allowed,90430_0.txt
any prisoner to be lynched within,90430_0.txt
his custody. I have ordered out the militia,90430_0.txt
to protect prisoners whenever called on,90430_0.txt
by sheriffs. I am opposed to lynch law,90430_0.txt
for anything but rape. That is a crime,90430_0.txt
"which, in my opinion, places any man beyond",90430_0.txt
"pale of the law, and puts him below",90430_0.txt
the brutes. The Southern people are not,90430_0.txt
blameless in dealing with the lynching,90430_0.txt
"question, but all our lynchings are not of",90430_0.txt
"negroes, and but for the fact that every",90430_0.txt
outbreak of the kind is used as a text by,90430_0.txt
Republican newspapers to slander and misrepresent,90430_0.txt
"our people, they would excite",90430_0.txt
no more comment than elsewhere in the,90430_0.txt
United States. I think statistics will show,90430_0.txt
that lynchings occur as often in Western,90430_0.txt
Northern States as they do in the,90430_0.txt
"and South.""",90430_0.txt
"Roanoke, Va., March 2.-R. D.",90431_0.txt
