value,filename
restraint WHEAT No. 2 Spring .. Sueur,86847_1.txt
@,86847_1.txt
@ 57%,86847_1.txt
have been OATS- No. 2 ....@ 43% a visit,86847_1.txt
to the,86847_1.txt
100,86847_1.txt
BARLEY-. 2 .. Sucur,86847_1.txt
No@,86847_1.txt
@ 1 10,86847_1.txt
be- FORM,86847_1.txt
PORK- Mess ..(@ 17 00 A,86847_1.txt
"hearts, LARD ... 11 22",86847_1.txt
@ field,86847_1.txt
""" MONEY OR BLOOD.""",86848_0.txt
The Latest Developments in the,86848_0.txt
"Case of Bradley, the Murderer",86848_0.txt
"of Hanlon,",86848_0.txt
An Accessory to the Crim,86848_0.txt
Discovered and Placed,86848_0.txt
Under Bonds.,86848_0.txt
Personating United States De,86848_0.txt
teotives.,86848_0.txt
Correspondence of THE BEE:,86848_0.txt
"FREMONT, June 18.- The preliminary",86848_0.txt
"examination of Bradley, the murderer",86848_0.txt
"of Patrick Hanlan, was held",86848_0.txt
yesterday and will be continued Mon,86848_0.txt
day. Several important facts were,86848_0.txt
developed that have not yet appeared,86848_0.txt
"in print, chief among them being the",86848_0.txt
"testimony of a woman of the town, at",86848_0.txt
whose house Bradley and his chum re,86848_0.txt
sorted some hours previous to the,86848_0.txt
murder. When Bradley and his,86848_0.txt
chum first visited Hanlan's store they,86848_0.txt
pretended to be members of the United,86848_0.txt
"States secret service, and under this",86848_0.txt
false badge of authority searched the,86848_0.txt
store from cellar to garret for some,86848_0.txt
evidence of crookedness. When they,86848_0.txt
returned to the bar room they inform,86848_0.txt
dated Mr. Hanlan that he had attempted,86848_0.txt
"to defraud the government, and that",86848_0.txt
$ 300 cash in hand would arrest the,86848_0.txt
"wrath of the government, which would",86848_0.txt
come sure if they should file complaint.,86848_0.txt
Mr. Harlan became indignant and ordered,86848_0.txt
them to leave the store instantly,86848_0.txt
", which they did.",86848_0.txt
The evening following found Brad,86848_0.txt
ley and his chum carousing at a noted,86848_0.txt
house of ill- faute in the outskirts of,86848_0.txt
the town. Here the former made his,86848_0.txt
public boasts that he would have,86848_0.txt
"MONEY OR BLOOD,",86848_0.txt
"at the same time displaying a pistol,",86848_0.txt
and asserting that he must get at,86848_0.txt
least fifty dollars of the amount demanded,86848_0.txt
"of Hanlon. Here, also, Brad",86848_0.txt
"ley and his chum,( who appears to be",86848_0.txt
a non- combatant) wore the mask of,86848_0.txt
secret service detectives. This is the,86848_0.txt
"fact, as given by one of the inmates",86848_0.txt
on the has,86848_0.txt
"upset the calculations of the defense,",86848_0.txt
"and they propose to put on the stand,",86848_0.txt
"at an adjourned examination, Mon",86848_0.txt
"day, a score of witnesses to impeach her",86848_0.txt
testimony and establish its falsehood.,86848_0.txt
"The hopes of the defense, if they can",86848_0.txt
"destroy the facts above related, are",86848_0.txt
centered in establishing a case of,86848_0.txt
"shooting in self- defense. Mr. Grey,",86848_0.txt
the leading lawyer that,86848_0.txt
"on side,",86848_0.txt
maintains that Hanlan fired the first,86848_0.txt
"shot, that which pierced the door of",86848_0.txt
the saloon and lodged in the wall of,86848_0.txt
"the house opposite, and is quite confident",86848_0.txt
that his client will be acquitted,86848_0.txt
at this examination. The accessory,86848_0.txt
in the case( whose name I am unable,86848_0.txt
to recall) has been bound over in the,86848_0.txt
sum of$ 500 to await the action of the,86848_0.txt
"grand jury, and it is hardly possible",86848_0.txt
that the principal in the case can be,86848_0.txt
dealt with less leniently.,86848_0.txt
"Hon. J. C. Cowin, of Omaha, has",86848_0.txt
"charge of the prosecution, and will",86848_0.txt
leave Omaha for Fremont at five,86848_0.txt
o'clock Monday morning. Grey and,86848_0.txt
Cowin are well matched and will undoubtedly,86848_0.txt
give many exhibitions of,86848_0.txt
legal sparring before the case ends.,86848_0.txt
Pictures of his wife and child ornament,86848_0.txt
Bradley's cell and secure him,86848_0.txt
the usual amount of sympathy.,86848_0.txt
Sheriff' Gregg and his assistants,86848_0.txt
have been walking arsenals since the,86848_0.txt
capture of the murderer. It was,86848_0.txt
feared he would be taken from jail,86848_0.txt
"and lynched. Their fears, however,",86848_0.txt
"proved groundless, although hundreds",86848_0.txt
of the friends and acquaintances of,86848_0.txt
the murdered man poured into town,86848_0.txt
"from the surrounding country, and",86848_0.txt
"were strongly in favor of lynch- law,",86848_0.txt
if a leader could be found. A story,86848_0.txt
is told of the sheriff that he went so,86848_0.txt
far as to have his life insured to be,86848_0.txt
prepared for the worst,86848_0.txt
.,86848_0.txt
The property left by Mr. Hanlon is,86848_0.txt
"valued at from$ 30,000 to$ 40,000.",86848_0.txt
An administrator has not been,86848_0.txt
appointed. Mrs. Hanlon is crazed,86848_0.txt
and the sympathy the,86848_0.txt
people is strongly with her. of,86848_0.txt
lynched woman was regarded as a des-,86849_0.txt
a bill will,86849_0.txt
"character, having been implicated in",86849_0.txt
"incendiary fires before the last, with enjoining the",86849_0.txt
was charged. appointment of,86849_0.txt
eral Anderson,86849_0.txt
"procure the$ 103,000",86849_0.txt
A BURGLAR SHOT.,86849_0.txt
bank by issuing,86849_0.txt
wings of the,86849_0.txt
Adventure of Massachusetts sustaining the,86849_0.txt
favor of the,86849_0.txt
Theological Students.,86849_0.txt
THE ANTI-,86849_0.txt
"dispatch from Lawrence, Massachu-",86849_0.txt
"April 13, says:",86849_0.txt
"this morning Abiel Wilson, rssid- No Countenance",86849_0.txt
"Salem turnpike, was awakened the Crown",86849_0.txt
in his house. Soon after his marck.,86849_0.txt
door was burst open by two per-,86849_0.txt
"Wilson discharged a rifle, shoot-",86849_0.txt
"but, April",86849_0.txt
fled LONDON,86849_0.txt
"of the intruders. Both,",86849_0.txt
"body of the one shot by Wilson lin says:"" The",86849_0.txt
"a short distance from the house,",86849_0.txt
Prince Bismarck,86849_0.txt
"to be that of Arthur Foster, a going about the",86849_0.txt
the Phelpes Academy. His ac-,86849_0.txt
"was his twin brother Luther, also a six months past",86849_0.txt
"The latter, after the shooting, ap- strictions on the",86849_0.txt
made a full confession. They into Germany,86849_0.txt
"residents of North Andover, Mass.,",86849_0.txt
certain walks,86849_0.txt
most respectable connections.,86849_0.txt
"weeks previously they had attempted in fact, undoing",86849_0.txt
the past in their,86849_0.txt
the same place.,86849_0.txt
the petition are,86849_0.txt
investigation of the crime and,86849_0.txt
result shows that Arthur Foster utterances of the,86849_0.txt
not intend to permit,86849_0.txt
"theological student, studying for the",86849_0.txt
and that on completing his stu- fecting the Jews,86849_0.txt
Phelps Academy he intended to Prince Bismarck,86849_0.txt
rath that the,86849_0.txt
Andover Theological Seminary.,86849_0.txt
against his wishes,86849_0.txt
confession of the surviving brother,86849_0.txt
"that the pair entered and robbed William, if not",86849_0.txt
sympathy,86849_0.txt
"months ago, securing less",86849_0.txt
A North Carolina Elopement,86849_1.txt
Exciting Alarm,86849_1.txt
"RALEIGH, N. C., April 15.- A",86849_1.txt
Great Trav,86849_1.txt
the News and Observer to day says,86849_1.txt
"and Monte- J. Munden, Republican member",86849_1.txt
Fire.,86849_1.txt
lower house of the Legislature from,86849_1.txt
"quotank county, eloped on Monday,",86849_1.txt
", VIA NEW OR- inst., with the wife of J. A. Johnson",86849_1.txt
"Woodville, Perquimons county.",86849_1.txt
"Grant and Senor ried off a large amount of money,",86849_1.txt
The movements to belong to Mr. Johnson. Mrs.,86849_1.txt
"with apprehen- about thirty- five years old, and is still",86849_1.txt
ty. Munden is about forty years,86849_1.txt
with the Prest- There is no clue to their whereabouts,86849_1.txt
was no recep-,86849_1.txt
A Charleston Steamer Compelled,86849_1.txt
.,86849_1.txt
transferred Put Back,86849_1.txt
to,86849_1.txt
"their franchises CHARLESTON, S. C., April 15.- The",86849_1.txt
"Matamoras to Monte- er Santiago de Cuba, which sailed",86849_1.txt
"construction of Wednesday evening, was towed",86849_1.txt
morning disabled and leaking slightly,86849_1.txt
"Col. Lewis, of stern post and rudder having been",86849_1.txt
the interest of away by an accident in crossing,86849_1.txt
Her cargo is not damaged and will be,86849_1.txt
destroyed the Lan- ferred to the steamer Delaware.,86849_1.txt
. sengers will proceed by other lines.,86849_1.txt
Railway. Large Sale of Missouri Lands,86849_1.txt
"15.- The in- ST. LOUIS, April 15.- Land Commissioner",86849_1.txt
"Virginia division of Coffin, of the St. Louis and San",86849_1.txt
"Railroad met in this Railroad, closed yesterday the sale",86849_1.txt
"books were 000 acres of land in Barry county,",86849_1.txt
"capital stock of to the Missouri Land Company, of",86849_1.txt
subscribed. It was The purchase was made by Gidway,86849_1.txt
"stockholders.& Co., of Chicago, as agents of the",86849_1.txt
meeting shortly company. A large number of Scottish,86849_1.txt
incorporators and nists will be settled on the land.,86849_1.txt
"directors, and",86849_1.txt
by,86849_1.txt
organized Heavy Increase of Freight,86849_1.txt
"of Pittsburg, Rates",86849_1.txt
preme Court,86850_0.txt
the court house yard. McDonald was day decided,86850_0.txt
sixteen desperadoes who were lodged Wheeling,86850_0.txt
on Friday. They had held the town and the,86850_0.txt
"for several years, and the citizens",86850_0.txt
volving,86850_0.txt
to clean them out. MeDonald was,86850_0.txt
arranging plans for breaking the former,86850_0.txt
and hence his lynching. Ex- limits,86850_0.txt
of,86850_0.txt
"Sheriff Ryan, who stabbed",86850_0.txt
of Benwood,86850_0.txt
"Michael, has not yet been ny. In",86850_0.txt
. He will be lynched when caught. that the,86850_0.txt
hinted that two more prisoners who a domestic,86850_0.txt
committed foul murders and escaped that the,86850_0.txt
"will be taken out and lynched."" in the case",86850_0.txt
property,86850_0.txt
WORK OF THE FLAMES. actual use,86850_0.txt
exercise of,86850_0.txt
"may, under",86850_0.txt
"Cincinnati Blaze- A Loss of State, be",86850_0.txt
"$ 100,000. another",86850_0.txt
THE,86850_0.txt
"CINCINNATI, April 2.- At 2 o'clock this",86850_0.txt
a fire originated in the central,86850_0.txt
"of the Robinson Wagon Works, Forty",86850_0.txt
to,86850_0.txt
"on the Cincinnati, Hamilton and",86850_0.txt
"Railroad, north of Eighth street.",86850_0.txt
IOWA CITY,86850_0.txt
hundred wagons stored in the yards,86850_0.txt
"soon in a blaze, all the factory build- Beull has",86850_0.txt
on and the railroad cars on,86850_0.txt
fire voluntary,86850_0.txt
"Houdsboro, Miss., 13.-Ed. Turner,",86851_0.txt
"( colored), who grossly assaulted Mrs.",86851_0.txt
"Michael McIntosh on March 6th, was",86851_0.txt
taken from a Mississippi jail last night,86851_0.txt
a mob and hanged. by,86851_0.txt
"Two horse thieves resisted arrest at Haywood,",86852_0.txt
"Dakota, on 28th and were killed by a",86852_0.txt
sheriff's posse the.,86852_0.txt
property.,86852_1.txt
"Martin Breckett, a colored libertine, was",86852_1.txt
"taken from jail at Hampton court house, Del.,",86852_1.txt
by a mob and hanged The body was placard-,86852_1.txt
.,86852_1.txt
"ed,"" Our women must be protected.""",86852_1.txt
Louis Sachs a prominent young San Fran-,86852_1.txt
",",86852_1.txt
"ciscoan, killed his wife in a fit of on the",86852_1.txt
25th. jealousy,86852_1.txt
"Ed. Maxweil, the desperado captured",86854_0.txt
"in Nebraska, a short time since.",86854_0.txt
"and returned to Wisconsin for trial,",86854_0.txt
had a preliminary examination at Du,86854_0.txt
"rand on the 19th ult., at which he gross",86854_0.txt
"pleaded not guilty, and waived exam tonic",86854_0.txt
"ination. Upon leaving the Court room, used",86854_0.txt
the officers having him in charge were tion,86854_0.txt
overpowered and the prisoner was burn,86854_0.txt
taken by a mob and hanged to a tree met,86854_0.txt
near by. ing,86854_0.txt
HUNG BY A MOB FOR CHICKEN STEALING,86855_0.txt
.- A few days ago a colored man,86855_0.txt
named Ben Robertson was arrested and,86855_0.txt
confined to jail in the town of Jeaner-,86855_0.txt
"ette on a charge of chicken stealing,",86855_0.txt
"and during the night was assaulted,",86855_0.txt
taken out by a mob and hung. The offense,86855_0.txt
was not deserving of so grave a,86855_0.txt
"punishment, and besides as he was in",86855_0.txt
the hands of the law it was a very fel-,86855_0.txt
",",86855_0.txt
"onious act, to say the least, on the part",86855_0.txt
The,86855_0.txt
of those who did the hanging.,86855_0.txt
"Coroner of our parish, Dr. T. J. Woolf,",86855_0.txt
made an inquest on the body and gave,86855_0.txt
verdict in accordance with the facts,86855_0.txt
a stated above .-[ Iberia Star.,86855_0.txt
A murderer named Church was ta,86856_0.txt
"ont of jail at Wilmington, N. C.",86856_0.txt
"ken by a mob, and lynched.",86856_0.txt
"Frenk Hudson, col. was hanged at",86856_1.txt
"Dawson, Ga., Friday, for the murder",86856_1.txt
of David Lee and wife and a negro,86856_1.txt
"girl, last August.,",86856_1.txt
"L. Nordean and Bushy"" Clark,",86856_2.txt
"horsethieyes, were lynched at Lama",86856_2.txt
Jeff Davis.,86856_2.txt
South. Whilst others,86857_0.txt
Corn has declined to 90 cents,86857_0.txt
fault with,86857_0.txt
or pick-,86857_0.txt
Meal to 95. Breadstuffs are not,86857_0.txt
educational system that,86857_0.txt
cently reported.,86857_0.txt
"now, Dr. Curry is Sweet Potatoes from wagons",86857_0.txt
educational matters indi,86857_0.txt
"bushel,",86857_0.txt
per,86857_0.txt
progress. This applies,86857_0.txt
Chickens 12% to 22 cents,86857_0.txt
and public schools.,86857_0.txt
years ago the advance size and quantity; Eggs 18 to 20,86857_0.txt
good table Butter 28 to 30,86857_0.txt
"noticeable."" cents",86857_0.txt
KILLED HIS KEEPER.,86858_0.txt
A Prisoner Shoots His Jailer,86858_0.txt
and a Mob Hangs the,86858_0.txt
Murderer.,86858_0.txt
1,86858_0.txt
A PRISONER SHOT FOR KILLING HIS,86858_0.txt
KEEPER.,86858_0.txt
"BLOOMINGTON, Ill., October 2.",86858_0.txt
The following is another version of,86858_0.txt
the lynching affair: About 6:30 this,86858_0.txt
"evening Ed. Franks, the jailer, was",86858_0.txt
shot and killed by a prisoner named,86858_0.txt
"Charles Pierce, alias Powlett, incarcerated",86858_0.txt
for horse stealing. The jailer,86858_0.txt
went in to,86858_0.txt
cell,86858_0.txt
one to another having a revolver,86858_0.txt
",",86858_0.txt
in his hip pocket and one in his coat.,86858_0.txt
"He went to unlock the cell door,",86858_0.txt
when the prisoner seized the revolver,86858_0.txt
and shot the jailer in the back. The,86858_0.txt
jailer then turned around and was,86858_0.txt
shot in the shoulder. A third shot,86858_0.txt
pierced his heart. Other prisoners,86858_0.txt
held the,86858_0.txt
"news spread like wildfire, and by 8",86858_0.txt
o'clock in the afternoon the jail was,86858_0.txt
"surrounded by 5,000 men, women and",86858_0.txt
"boys, demanding the blood of the",86858_0.txt
The sheriff and police,86858_0.txt
were summoned with a large force,86858_0.txt
",",86858_0.txt
who did all in their,86858_0.txt
power,86858_0.txt
but at 9 p. m. the mob gained entran-,86858_0.txt
"ce into the jail, after nearly tearing it",86858_0.txt
down. They put a rope around the,86858_0.txt
him,86858_0.txt
through the howling crowd to the,86858_0.txt
nearest tree where he was soon dang-,86858_0.txt
were,86858_0.txt
drowned in the loud cheers and elle,86858_0.txt
"of"" hang",86858_0.txt
citizens were in the front. Business,86858_0.txt
men cheered and encouraged the,86858_0.txt
lynchers. Women cheered and waved,86858_0.txt
their handkerchiefs. Jailer Franks,86858_0.txt
was a highly respected man who had,86858_0.txt
lived here over twenty years. The,86858_0.txt
"murderer, Pierce, was only twenty",86858_0.txt
years old. After hanging thirty,86858_0.txt
utes the body was cut down and taken,86858_0.txt
in charge by the coroner.,86858_0.txt
The following dispatches have been,86858_0.txt
exchanged:,86858_0.txt
"BLOOMINGTON, Ill, October 2.- To",86858_0.txt
"Gov. Cullom, Springfield: Our jailer",86858_0.txt
was murdered by a prisoner in the,86858_0.txt
immense mob is,86858_0.txt
jail tonight,86858_0.txt
now tearing down the jail to kill the,86858_0.txt
murderer and probably Patsey Devine.,86858_0.txt
is,86858_0.txt
"HAMILTON, Lieut. Gov.",86858_0.txt
"SPRINGFIELD, October 2.- To Hon.",86858_0.txt
I,86858_0.txt
hope the sheriff and law- abiding citizens,86858_0.txt
will prevent any such violence.,86858_0.txt
Telegraph me the situation.,86858_0.txt
S. M. CULLOM.,86858_0.txt
SPRINGEIELD -- Hon. Hamilton: Tell,86858_0.txt
the sheriff to call on the military if,86858_0.txt
"necessary, to protect life and",86858_0.txt
erty. prop-,86858_0.txt
"AT Dyersburg, Tenn., on the 2d, Mike",86859_0.txt
"Wells, a negro, was lynched upon his con",86859_0.txt
fessing assault upon the person of Mrs.,86859_0.txt
J. T. Childress an.,86859_0.txt
A Brute Lynched.,86860_0.txt
"CHICAGO, August 21.- A special from",86860_0.txt
"Vater, Nebraska, says: Jerry White, the",86860_0.txt
negro who brutally assaulted an aged lady,86860_0.txt
Wednesday night was taken from jail,86860_0.txt
"here this morning, and lynched by a mob.",86860_0.txt
As a sensational news center Nebraska,86861_0.txt
City probably has no rival in the west.,86861_0.txt
More really startling sensations have,86861_0.txt
occurred there thau in any other town in,86861_0.txt
Nebraska. A few years,86861_0.txt
"ago, if we",86861_0.txt
"remember rightly, two negroes were",86861_0.txt
lynched there. Bohannon was tried and,86861_0.txt
"convicted there, and while under sentence",86861_0.txt
of death made his escape. David,86861_0.txt
"Hoffman, the train wrecker, was legally",86861_0.txt
"executed on Friday last, and the next",86861_0.txt
"night Lee Shellenberger, under sentence",86861_0.txt
of death for the murder of his daughter,86861_0.txt
a horrible crime in itself- was taken from,86861_0.txt
jail and lynched. Still another sensation,86861_0.txt
was the big defaleation of County Treasurer,86861_0.txt
"Simpson, who is now in the",86861_0.txt
tentiary. peni,86861_0.txt
"SHERIFF MCCULLAM, of Otoe county,",86861_1.txt
on Thursday remarked that in order to,86861_1.txt
take Shellenberger from the jail the mob,86861_1.txt
would have to walk over his( McCullam's),86861_1.txt
dead body. In the very excellent report,86861_1.txt
of the lynching of Shellenberger printed,86861_1.txt
"in the BEE this morning, we fail to find",86861_1.txt
"where the sheriff's body, either dead",86861_1.txt
"alive, was walked over. or",86861_1.txt
THE escape of the condemned mur.,86861_2.txt
"derer, Quin Bohannan, from the Ne.",86861_2.txt
"braska City jail, was no doubt largely",86861_2.txt
responsible for the lynching of Lee Shel,86861_2.txt
"lenberger, the convicted murderer of his",86861_2.txt
own daughter. The people of Otoe,86861_2.txt
county have been put to enormous expense,86861_2.txt
in the trials of desperadoes and,86861_2.txt
"criminals, who have finally escaped justice",86861_2.txt
and given a new lease of life through,86861_2.txt
technicalities of a trivial character.,86861_2.txt
"Lynch law is, of course, to be deplored.",86861_2.txt
"In this case, as in many others, the people",86861_2.txt
had become aggrevated at the law's,86861_2.txt
delays and the opportunities afforded for,86861_2.txt
escape. They feared that Shellenberger,86861_2.txt
might follow in the footsteps of Bo,86861_2.txt
"hannan, and they accordingly took the",86861_2.txt
"law into their own hands. It is certain,",86861_2.txt
"however, they did not hang an innocent",86861_2.txt
man. that,86861_2.txt
A Negro Lynched.,86862_0.txt
"KY., 25.- Mrs.",86862_0.txt
"Graves, an old woman, was murdered with",86862_0.txt
"a club, near this city, yesterday by Calvin",86862_0.txt
"Simpson, colored. Her two es",86862_0.txt
"caped to a neighbor's. The murderer, sup",86862_0.txt
"posed to be insane, was captured with diffi",86862_0.txt
At 2 o'clock this morning Simpson,86862_0.txt
culty.,86862_0.txt
"taken from jail, hung to a tree and his",86862_0.txt
body was riddled with bullets.,86862_0.txt
"L. White, a colored man was lynched",86863_0.txt
"at Mount Mourne, N. C., by sixty- five",86863_0.txt
negroes for killing another,86863_0.txt
na ned Frazier. negro,86863_0.txt
A Missouri Murderer Lynched.,86865_0.txt
A mob of two hundred men battered,86865_0.txt
"down the doors of the jail at Hermann, Mo.,",86865_0.txt
"shortly after midnight on the 5th, took out",86865_0.txt
the murderer Whitney and hung him to a,86865_0.txt
tree a short distance from the jail. Whit,86865_0.txt
ney was a desperado of the James stripe.,86865_0.txt
"He and another outlaw named Collier,",86865_0.txt
after robbing several stores in Gasconade,86865_0.txt
"County, Mo., on the 19th of last month, at",86865_0.txt
tempted to burglarize the little store of,86865_0.txt
"Burchard& Lukes, in the little town of",86865_0.txt
"Bern, during which they shot and killed",86865_0.txt
"young Burchard, son of one of the proprietors",86865_0.txt
. It was for this last crime that he,86865_0.txt
lynched. was,86865_0.txt
"THE Barber brothers, Iowa desperadoes,",86865_1.txt
"were taken from the jail at Waverly, Iowa,",86865_1.txt
"on the 8th, by a mob and lynched. The",86865_1.txt
mob was led by a brother of the man,86865_1.txt
"Shepard, whom the Barbers killed last",86865_1.txt
at West Union. fall,86865_1.txt
They Said it Was Justifiable Homicide.,86865_2.txt
"An unmarried daughter of Ben Brookins,",86865_2.txt
"residing in Baldwin County, Ga., gave",86865_2.txt
birth to an illegitimate child a few days,86865_2.txt
"ago, and upon being questioned by her",86865_2.txt
father confessed that a negro named Coop,86865_2.txt
er was the father of it. Mr. Brookins immediately,86865_2.txt
"shot and killed the negro, and",86865_2.txt
the Coroner's jury returned a verdict,86865_2.txt
justifiable homicide. He was released. of,86865_2.txt
oto,86867_0.txt
1 A Texas mob carelessly lynched,86867_0.txt
the wrong man last week. The gen,86867_0.txt
"and good- natured lynchee,",86867_0.txt
"however tlemanly, has entered no complaint.",86867_0.txt
PROHIBIT,86874_0.txt
CHURCH BELLS,86874_0.txt
"Des Moines, Iowa, July 22. By",86874_0.txt
order of Mayor Young of Clear Lake,86874_0.txt
n church bells rang out to call the,86874_0.txt
faithful to prayer in that town yes.,86874_0.txt
terday. A bitter fight has been,86874_0.txt
waged there to inforce the Sunday,86874_0.txt
"closing law and the mayor, determined",86874_0.txt
"to have an absolutely tight lid,",86874_0.txt
has declared the ringing of bells to,86874_0.txt
be a violation of the statute and a,86874_0.txt
disturbance of the peace. Many people,86874_0.txt
"are violently opposed to the"" blue",86874_0.txt
"laws,"" a recently hanging Mayor",86874_0.txt
Young in mob effigy.,86874_0.txt
"was a person to be loved, honored and",86886_0.txt
obeyed instantly- agreed with his lady,86886_0.txt
by a process of reflex action. The fat,86886_0.txt
"lady, who had a commonplace for every",86886_0.txt
"occasion, didn't know what we",86886_0.txt
"were all coming to."" Miss Carmichael,",86886_0.txt
who was beginning to find her capacity,86886_0.txt
"for amazement overstrained,",86886_0.txt
alone accepted this last incident with,86886_0.txt
apathy Mr. Hamilton might have,86886_0.txt
gone in swift pursuit of cattle thieves,86886_0.txt
or he might be riding the mare to,86886_0.txt
death for pure whimsy. Only Judith,86886_0.txt
"Rodney, who said nothing, felt that he",86886_0.txt
was spurring across the wilderness at,86886_0.txt
breakneck speed to see a gir! at Wet,86886_0.txt
more's. But her lack of comment,86886_0.txt
caused no ripple of surprise in the flow,86886_0.txt
of loose lipped speculation that served,86886_0.txt
for the time being to inject a casual,86886_0.txt
interest into the talk of these folk.,86886_0.txt
bored to the verge of demoralization,86886_0.txt
by long waiting for Chugg.,86886_0.txt
Judith preferred to confirm her apprehensions,86886_0.txt
regarding Hamilton's ride,86886_0.txt
alone. She knew -- had not all her wo,86886_0.txt
man's intuitions risen in clamorous,86886_0.txt
"warning? -yet she hoped, hoped despairingly",86886_0.txt
", even though the dread alter",86886_0.txt
native to the girl at the Wetmore ranch,86886_0.txt
threatened lynch law for her brother.,86886_0.txt
Her very gait changed as she withdrew,86886_0.txt
"from the group about the door, covertly",86886_0.txt
gaining her vantage ground inch by,86886_0.txt
inch. The heels of her riding boots,86886_0.txt
made no sound as she stole across the,86886_0.txt
"kitchen floor, toeing in like an Indian",86886_0.txt
tracking an enemy through the forest.,86886_0.txt
The small window at the back of the,86886_0.txt
kitchen commanded a view of the road,86886_0.txt
all its sprawling circumlocution.,86886_0.txt
in Seen from this prospect it had no more,86886_0.txt
Mob Hangs Negress.,86887_0.txt
"Pinehurst, Ga., June 26.- A moh",86887_0.txt
"took Ann Boston, a negro cook, from",86887_0.txt
county officials who were guarding,86887_0.txt
her and hanged the woman from a,86887_0.txt
tree.,86887_0.txt
The Boston woman was accused of,86887_0.txt
"the murder of her mistress, Mrs. R.",86887_0.txt
"F. Jordan, wife of a wealthy planter,",86887_0.txt
who was found in her home slashed,86887_0.txt
death soon after she had repri,86887_0.txt
to manded the cook.,86887_0.txt
TENNESSEE MOB,86899_0.txt
HANGED A NEGRO,86899_0.txt
Jury Failed to Agree and Crowd,86899_0.txt
of Citizens Proceeded,86899_0.txt
to Act,86899_0.txt
