value,filename
"Cox, D. who was terribly roasted in his berth. He, They had built a somewhat",86762_0.txt
"OHIO was taken to the the room, and, as the",86762_0.txt
". hotel, where he",86762_0.txt
now lies,86762_0.txt
"Follett, D. 12. Alphonso Hart, It.",86762_0.txt
"in a dying condition. His name is not known. it grew warmer, they",86762_0.txt
"Jordan, D. 13. G. R. Converse, D.",86762_0.txt
"Another man lost his hat, in which he had and windows. The rats",86762_0.txt
"Murray, D. 14. Geo. W. Geddes D.",86762_0.txt
", placed$ 180. The the smell of the",86762_0.txt
Lynched.,86763_0.txt
"Louisville, July 12.-Wm. Ritter, a",86763_0.txt
"negro in jail at Henderson, Kentucky,",86763_0.txt
on the charge of raping and killing,86763_0.txt
"Helen Brewster, a mulatto girl twelve",86763_0.txt
"years old, was taken from jail last",86763_0.txt
night by a mob and hanged to a tree.,86763_0.txt
is supposed the executioners were,86763_0.txt
composed It of blacks.,86763_0.txt
There seems to be little doubt of the,86764_0.txt
lynching of the negro who murdered Dr. H.,86764_0.txt
J. Avinger in Cass county recently. He,86764_0.txt
"was confined in the Linden jail, and when",86764_0.txt
Dr. Avinger died of his wound public sentis,86764_0.txt
ment was so strong against the perpetrator,86764_0.txt
of the heincus deed that it would not await,86764_0.txt
"the process of the law, with its delays",86764_0.txt
and uncertainties slow.,86764_0.txt
"-A negro was lynched at Ironton,",86765_0.txt
", for assaulting a white lady sixty",86765_0.txt
Mo. years of age.,86765_0.txt
"COLUMBIA, Georgia, May 28.",86766_0.txt
Three negroes were lynched to- day for the,86766_0.txt
"murder of Mrs. C. C. Chambless, of Stewart",86766_0.txt
"county. They attempted to rob the house, and",86766_0.txt
were resisted by Mrs. Chambless when she was,86766_0.txt
shot dead. The murderers were hanged with,86766_0.txt
"trace chains, negroes participating in the lynching",86766_0.txt
.-,86766_0.txt
"hanged Shell for murdering a woman, the",86767_0.txt
they are beginning to doubt if he was,86767_0.txt
the murderer. He was lynched on his,86767_0.txt
"wife's confession, and it is now claimed ship",86767_0.txt
wife,86767_0.txt
guilty person. Clenched in the hands on,86767_0.txt
of the murdered woman were found sev- ley,86767_0.txt
eral long auburn hairs of the color of from,86767_0.txt
Mrs Shell's locks and much longer and loss,86767_0.txt
finer than those of as to,86767_0.txt
Mrs. Shell was intersely jealous of the,86767_0.txt
"woman, the theory is ventured that she sons",86767_0.txt
took her life and then sacrificed her hus,86767_0.txt
the,86767_0.txt
band in the hope of saving herself.,86767_0.txt
Among the new Centennial notions is,86767_0.txt
a project for the construction of end,86767_0.txt
less moving sidewalk around the an con- of,86767_0.txt
NIGHT DISPATCHES,86768_0.txt
DOMESTIC.,86768_0.txt
Lynch Law.,86768_0.txt
At Jackson Mississippi Thursday,86768_0.txt
",,",86768_0.txt
"evening, John W. Gully, a prominent",86768_0.txt
"citizen of Kemper county, was assassinated",86768_0.txt
"by an unknown party, which",86768_0.txt
created intense excitement. Every,86768_0.txt
means was resorted to to discover the,86768_0.txt
perpetrator. On Saturday two colored,86768_0.txt
"men made affidavit that Benj. Rush,",86768_0.txt
"a white man, did the deed, and that",86768_0.txt
"Judge Chisolm, who run for Congress",86768_0.txt
on the Republican ticket in the Third,86768_0.txt
"District at the last election, his son",86768_0.txt
Rosenbaum and,86768_0.txt
and Gilmore Hopper,86768_0.txt
",",86768_0.txt
"prominent white Republicans, knew",86768_0.txt
of and instigated the crime. Chisolm,86768_0.txt
and his son were arrested and,86768_0.txt
imprisoned at DeKalb. Mrs. Chis-,86768_0.txt
and daughter insisted,86768_0.txt
olm on,86768_0.txt
sharing their confinement. On Sunday,86768_0.txt
Chisolm sent to Chooba for Gil-,86768_0.txt
warrant had been,86768_0.txt
"more, for whom a",86768_0.txt
"issued. Gilmore came, and on his arrival",86768_0.txt
"was arrested, but just as he arrived",86768_0.txt
at the jail he was set on by a,86768_0.txt
mob and killed. The jailor was then,86768_0.txt
"overpowered by a mob, who immediately",86768_0.txt
"attacked Chisolm, mortally",86768_0.txt
wounding him and killing his son.,86768_0.txt
"Miss Chisolm, in defending her father",86768_0.txt
"shot and killed D. Rosser, and Mrs.,",86768_0.txt
Chisolm severely wounded young Gully,86768_0.txt
", a son of Gully who was assassinated",86768_0.txt
. Miss Chisolm was,86768_0.txt
also severely,86768_0.txt
wounded. Rosenbaum and Hopper,86768_0.txt
were carried to the woods by the mob,86768_0.txt
"of to Rush extort, the from alleged them assassin the whereabouts of Gully.",86768_0.txt
"When last heard from, some weeks ago,",86768_0.txt
Rush was in Arkansas Hopposed,86768_0.txt
that Rosenbaum and Hopper were,86768_0.txt
hanged. It is reported that a horrible,86768_0.txt
state of affairs is existing throughout,86768_0.txt
"that section, and the people are wild",86768_0.txt
"with excitement, and hangings",86768_0.txt
will probably follow. other,86768_0.txt
The good and expressive American,86768_1.txt
"verb"" to lynch"" has been Frenchified,",86768_1.txt
"and one of our French exchanges, telling",86768_1.txt
about the lynching of the Bender,86768_1.txt
family in Kansas heads its paragraph,86768_1.txt
"with the words"" Une, Famille Lynchee.""",86768_1.txt
"AT St. Martinsville, Louisiana, three hundred",86769_0.txt
"men took Joseph E. Jenkins, who murdered",86769_0.txt
"his brother- in- law, Raphael Castille, a few",86769_0.txt
"nights before, to the place of the murder, near",86769_0.txt
"Breaux Bridge, and hanged him. On the way",86769_0.txt
from St. Martinsville they came across a colored,86769_0.txt
"man, Eugene Azar, who killed a young man",86769_0.txt
"January last, and Azar was hanged on the same",86769_0.txt
tree with Jenkins. The Governor offers a,86769_0.txt
"reward of$ 2,000 the arrest and conviction of",86769_0.txt
the persons engaged for in the lynching.,86769_0.txt
"AT VIENNA, Dooly County, Ga., a man named",86769_1.txt
"Elken beat his wife unmercifully, and then",86769_1.txt
hung her to the joists of the house. Friends,86769_1.txt
arrived and cut her down before life was extinct,86769_1.txt
but she died in a little while. It is probable,86769_1.txt
"the, fiend will be lynched. 120.",86769_1.txt
Friday: Considerable sharp fighting took,86770_0.txt
"place near Ismailia on the Suez Canal, but",86770_0.txt
the Egyptians were obliged to retire.,86770_0.txt
Two negro prisoners were lynched in Flor,86770_0.txt
ida; they were in confinement for some alleged,86770_0.txt
trouble growing out of the Bisbee,86770_0.txt
Finley congressional contest.,86770_0.txt
Arthur is enjoying himself at Newport President.,86770_0.txt
Winding up the Business.,86772_0.txt
"CINCINNATI, Dec. 11.- A special",86772_0.txt
from Wheeling says: Big Bill Kin,86772_0.txt
"ney, who was acquitted of murder at",86772_0.txt
"West Union, yesterday, was taken",86772_0.txt
from jail by a mob and hung last,86772_0.txt
night. It is reported the mob started,86772_0.txt
for Clarksbury where a cousin of Kin,86772_0.txt
"neys is in jail, convicted of man-",86772_0.txt
", with the intention of hangia",86772_0.txt
slaughter him,86772_0.txt
THE particulars of the shooting at,86773_0.txt
"Hurricane Bridge, a mere statement",86773_0.txt
"of which we gave last week, are",86773_0.txt
these. They are communicated to,86773_0.txt
"the Cincinnati press, under date,",86773_0.txt
"Huntington, W. Va., June 27th:",86773_0.txt
Evening before last a strange lady,86773_0.txt
and gentleman arrived here in a buggy,86773_0.txt
for the night.,86773_0.txt
terday morning the gentleman left,86773_0.txt
driving eastward. The lady went,86773_0.txt
"down the river at 10 a. m., and landed",86773_0.txt
at South Point. During the day in,86773_0.txt
formation reached here that the male,86773_0.txt
party was a horse- thief from Green,86773_0.txt
"field, Ohio. Thereupon Marshal",86773_0.txt
"Mitchell and Mr. Turner, of this city,",86773_0.txt
at once started in pursnit. At one,86773_0.txt
o'clock this morning they overtook,86773_0.txt
the thief near Hurricane Station. An,86773_0.txt
"encounter took place, the full details",86773_0.txt
"of which have not reached us, but we",86773_0.txt
have intelligence that the Marshal,86773_0.txt
and Turner were found lying help,86773_0.txt
"less on the highway this morning,",86773_0.txt
both shot. Mitchell died about 11,86773_0.txt
"a. m., and Turner's injuries it is believed",86773_0.txt
", will prove fatal too. The thief",86773_0.txt
then stole a fresh horse in the vicinity,86773_0.txt
and escaped.,86773_0.txt
He came to the Ohio river some,86773_0.txt
"twelve miles below this city, left his",86773_0.txt
"horse, and took passage on the Parsons",86773_0.txt
for this city. He spent some,86773_0.txt
"hours here, and then took the noon",86773_0.txt
"preket for Pomeroy, where he was",86773_0.txt
arrested upon a description given by,86773_0.txt
from this city. He was,86773_0.txt
telegram taken back to Huntington.,86773_0.txt
The Murderer Lynched.,86773_0.txt
The murderer was taken to the,86773_0.txt
"Winfield, Putnam county, jail. On",86773_0.txt
"Friday night, eighteen citizens, undisguised",86773_0.txt
", appeared at the jail, and",86773_0.txt
"taking the keys from the jailor, took",86773_0.txt
"the prisoner out, and proceeded with",86773_0.txt
"him some two miles from town, and",86773_0.txt
there hung him to a tree. The murderer,86773_0.txt
"left the jail singing, but the",86773_0.txt
lynchers made him soon cease from,86773_0.txt
that sort of bravado.,86773_0.txt
Our exchanges speak of him as J.,86773_0.txt
M. Cox and as M. JOHNSON. His,86773_0.txt
"father, it is thought, lives at Boyd,",86773_0.txt
"Mecklenburg county, Virginia. On",86773_0.txt
his person at the time of his arrest in,86773_0.txt
Pomeroy were slips from newspapers,86773_0.txt
giving accounts of the shooting of a,86773_0.txt
colored waiter on the steamer J. B.,86773_0.txt
"Maud on the Mississippi river, by",86773_0.txt
"one J. M. Cox, of Texas. The accounts",86773_0.txt
closed with a statement,86773_0.txt
Cox had escaped. that,86773_0.txt
Murder in Stewart County.,86774_0.txt
A murder of unusual atrocity is re,86774_0.txt
ported to us from Stewart county. An,86774_0.txt
old gentleman named McClish had,86774_0.txt
been reported missing since the middle,86774_0.txt
of last week; by degrees a suspicion,86774_0.txt
spread abroad that crime had,86774_0.txt
"been the cause of his disappearance,",86774_0.txt
"and a search was made for him, which",86774_0.txt
"resulted on Saturday last, in the discovery",86774_0.txt
of his body about half a mile,86774_0.txt
from Dover on the road to Erin.,86774_0.txt
The scull had been cloven in two by,86774_0.txt
an axe and the throat cut very deeply,86774_0.txt
and widely. Murder had evidently,86774_0.txt
been committed. An old hat was,86774_0.txt
found near the spot which was identified,86774_0.txt
as the property of a negro in Do,86774_0.txt
"ver, who on being arrested was found",86774_0.txt
to be wearing the hat of the deceased;,86774_0.txt
another negro was found wearing his,86774_0.txt
shoes. Both negroes confessed the,86774_0.txt
"murder, which they admitted was for",86774_0.txt
"the purpose of robbery, though little",86774_0.txt
so far as is known was taken from the,86774_0.txt
"body, but it had been rumored that",86774_0.txt
MeClish had drawn a large sum of,86774_0.txt
money which report was doubtlessly,86774_0.txt
the temptation to the crime.,86774_0.txt
The neighborhood is intensely ex,86774_0.txt
cited in the matter and lynch- law was,86774_0.txt
loudly talked about. It is hoped,86774_0.txt
"however, that the law will be allowed",86774_0.txt
to take its course- what that,86774_0.txt
will be seems to be beyond a doubt course.,86774_0.txt
"FOUR men, named Jim Simmons, and",86776_0.txt
"Bob, Sam, and Joe Goodrich, who were",86776_0.txt
"confined in the Henry County Jail, at New-",86776_0.txt
"castle, Ky., on charge of murder and highway",86776_0.txt
"robbery, committed through a series",86776_0.txt
of taken out the night of,86776_0.txt
years were on,86776_0.txt
",",86776_0.txt
September 3 by a mob and hanged. No,86776_0.txt
body seems to know whence the lynchers,86776_0.txt
"came, or where they went. The visitation",86776_0.txt
"was sudden, silent, and terrible. The officers",86776_0.txt
"were powerless to offer resistance, and the",86776_0.txt
"people, if they knew anything, were afraid",86776_0.txt
to give were,86776_0.txt
taken down the next morning and an in-,86776_0.txt
",",86776_0.txt
quest was held on them the verdict being,86776_0.txt
",",86776_0.txt
"as usual, comprehensively ignorant.,",86776_0.txt
"A Mob at Oxford, Ohio.",86776_1.txt
1Cincinnati Gazette.],86776_1.txt
A special dispatch in the Gazette of Sep-,86776_1.txt
tember 2 announced the lynching of a negro$,86776_1.txt
"named Garnett, Jail,",86776_1.txt
"for an outrage upon Mrs. Kingery, a white",86776_1.txt
"woman living near College Corner, the",86776_1.txt
shooting of the culprit and his rescue single,86776_1.txt
handed by Village Marshal Kyler. On the,86776_1.txt
"morning of September 3, the mob was in",86776_1.txt
by a who went to,86776_1.txt
the calaboose where the prisoner was con-,86776_1.txt
",",86776_1.txt
"fined, battered down the doors, pressed in",86776_1.txt
"and shot the shrinking, frightened prisoner",86776_1.txt
"in his cell. Four shots were fired, each one",86776_1.txt
of which lodged in some vital part of the,86776_1.txt
"brain or body, and he died almost instantly.",86776_1.txt
The body was then brought outside and left,86776_1.txt
"on the street for about an hour, when it",86776_1.txt
"was taken back to jail by the Marshal, who",86776_1.txt
summoned Coroner Spencer at Hamilton.,86776_1.txt
"A jury was impaneled, an inquest held,",86776_1.txt
and a verdict returned that the deceased,86776_1.txt
came to his death from the effects of a pistol,86776_1.txt
"shot from the hands of a mob, to the jurors",86776_1.txt
unknown. The body was afterward taken,86776_1.txt
"possession of by colored people, and sent to",86776_1.txt
"the home of the deceased, near College",86776_1.txt
Corner.,86776_1.txt
A peculiar feature of the character of the,86776_1.txt
mob was the fact that it was led by first- class,86776_1.txt
"farmers, nearly all of whom are friends of",86776_1.txt
the injured woman. Notwithstanding the,86776_1.txt
"terrible character of the affair, the sympathies",86776_1.txt
of the whole community appear to,86776_1.txt
be with the mob. The demonstration was,86776_1.txt
"confined class, when notorious",86776_1.txt
rough named Jim Hand attented,86776_1.txt
to lead the crowd he found no followers.,86776_1.txt
"After the shooting on Sunday, and the",86776_1.txt
"failure to kill, the mob became dissatisfied.",86776_1.txt
The doctor who examined Garnett reported,86776_1.txt
a slight wound to the left of the spinal column,86776_1.txt
", which would not necessaryily prove fatal",86776_1.txt
. The failure to kill aroused the crowd,86776_1.txt
to a further and successful effort. The,86776_1.txt
"trouble, too, in fastening the crime upon",86776_1.txt
Garnett He,86776_1.txt
prove that he was at the depot at the time,86776_1.txt
"the rape was committed, but this was clearly",86776_1.txt
"disproved, and their action appeared",86776_1.txt
them the only legitimate outcome of their to,86776_1.txt
"been quite firm with a slightept in ignorance, not because of",86777_0.txt
". Prices in Liverpool, New- real sympathy with the maintenance",86777_0.txt
"Milwaukee have fluctuated only to of the sultan's power, but because",86777_0.txt
two or three cents. Foreign ad- the dangers attendant upon his inherit-,86777_0.txt
encouragement for any imme- ance. At the door of the foreign,86777_0.txt
California report says there is suls must be laid the whole crime,86777_0.txt
"tons in the State for export, suppression of the truth. They",86777_0.txt
as much again as ever before cognizant of the atrocities committed,86777_0.txt
daily by the ferocious Moslem soldiery,86777_0.txt
"Minneapolis last advices, and, yet either in accordance with",86777_0.txt
"to 86c for No. at 2 new, and 90 structions from their respective",86777_0.txt
Shocking Murder and Lynch Law in West V,86778_0.txt
Virginia.,86778_0.txt
A MAN KILLS THREE PERSONS FOR TALKING,86778_0.txt
ABOUT HIS FAMILY- HE IS SEIZED,86778_0.txt
BY MOB AND HUNG- LETTER TO HIS,86778_0.txt
WIFE A.,86778_0.txt
& C.,86778_0.txt
"& C.,& C.,",86778_0.txt
"John Wallace near Wheeling, W. Va.,",86778_0.txt
his,86778_0.txt
had come to believe that the wife of,86778_0.txt
"brother George had been talking about""",86778_0.txt
him. He went to his brother's house and,86778_0.txt
told his wife that she must go to Miss,86778_0.txt
"Church's, as that lady was sick .. He asked",86778_0.txt
for a hammer and she gave it to him.,86778_0.txt
Wallace and his brother's wife and her little,86778_0.txt
"child started to Church's, and as Mrs.",86778_0.txt
Wallace was climbing the fence he struck,86778_0.txt
"twice with the hammer on the head, which",86778_0.txt
"killed her. He then picked up the child,",86778_0.txt
"which was crying, and struck it against a",86778_0.txt
stone. Death immediately followed. He,86778_0.txt
then went back and told Miss Church to,86778_0.txt
"get him something to eat, and as she star-",86778_0.txt
out he struck her several times with,86778_0.txt
caused death. He,86778_0.txt
"the hammer, which",86778_0.txt
"then went home and slept over night, and",86778_0.txt
gave the alarm next morning in order to,86778_0.txt
screen himself. He stated that his brother,86778_0.txt
"and wife had been talking about him,",86778_0.txt
and his wife and he had determined to,86778_0.txt
kill the woman His reason for killing,86778_0.txt
Miss Church is that he was afraid she,86778_0.txt
would find out what he had done. All this,86778_0.txt
he confessed after he was arrested on suspicion,86778_0.txt
and confined in Black's Hotel preparatory,86778_0.txt
to being committed to jail. He,86778_0.txt
spent Saturday night praying and crying.,86778_0.txt
About 2 o'clock in the morning twenty- five,86778_0.txt
men broke into the hotel. They approached,86778_0.txt
the first guard and demanded admittance.,86778_0.txt
He refused and they drew their pistols and,86778_0.txt
"fired several shots in the air, and the man",86778_0.txt
ran off. Entering the front door noisily,86778_0.txt
they began knocking off the lamp chimneys,86778_0.txt
"with their pistol barrels, and as the",86778_0.txt
wind was blowing strong the lamps were,86778_0.txt
soon extinguished and the place was in,86778_0.txt
utter darkness. The mob then began,86778_0.txt
firing in the ceiling and shouting as if,86778_0.txt
they were so many devils. They fired,86778_0.txt
about in such a reckless manner that several,86778_0.txt
of their party were slightly wounded.,86778_0.txt
uproar he began,86778_0.txt
Wallace,86778_0.txt
prayard the,86778_0.txt
When,86778_0.txt
sobbing and,86778_0.txt
his room opened and the first of the lynchers,86778_0.txt
made his appearance he sprang behinb,86778_0.txt
"one of the guards and screamed,"" My God",86778_0.txt
"don't kill; save me, save me.! The mod",86778_0.txt
"laughed at his cries, and after knocking the",86778_0.txt
"guard down and trampling on him, they",86778_0.txt
threw Wallace on his back and began to,86778_0.txt
tie his arms. Again he screamed in agony,86778_0.txt
as great drops of perspiration rolled down,86778_0.txt
"his face:"" Don't murder, don't kill me!",86778_0.txt
For God's sake give me time to pray.,86778_0.txt
"I want to see a minister."" One of the",86778_0.txt
"men yelled,"" You murderer. Miss Church",86778_0.txt
"wants to see you, and by -- she shall!""",86778_0.txt
After placing the rope firmly about his,86778_0.txt
neck they dragged him down stairs headforemost,86778_0.txt
", and out of the house on to the",86778_0.txt
"railroad track, where he uttered the most",86778_0.txt
horrible cries cursing praying and beg,86778_0.txt
",,",86778_0.txt
ging them to let him go. They paid no attention,86778_0.txt
"to him, but began running with",86778_0.txt
him as if he were a log or barrel. They,86778_0.txt
took places one behind the other and presently,86778_0.txt
began to run. Wallace did not stop,86778_0.txt
calling until he had been dragged nearly a,86778_0.txt
quarter of a mile. He vainly tried to regain,86778_0.txt
"his feet and stand up, but whenever",86778_0.txt
he did so the mob would pull the rope,86778_0.txt
suddenly and jerk him on his back. After,86778_0.txt
going nearly a mile below Littleton they,86778_0.txt
stopped and hung the body to a tree. It,86778_0.txt
"is supposed, of course, that Wallace was",86778_0.txt
dead by this time. At six o'clock he was,86778_0.txt
found dangling from a limb of an apple,86778_0.txt
"tree, alongside of the railroad, his feet",86778_0.txt
the early passenger trains on the Balti-,86778_0.txt
mo e and Ouio passed the place there was,86778_0.txt
"great commotion among those on board,",86778_0.txt
and the trains slackened their speed in order,86778_0.txt
to give the people a chance to look at,86778_0.txt
the lynchers' work. When the body was,86778_0.txt
"examined, the spine and neck were found",86778_0.txt
"to be broken, and the body horribly",86778_0.txt
mangled and bruised. A coroner's July,86778_0.txt
was at once summoned and they returned,86778_0.txt
",",86778_0.txt
verdict to the effect that he came to his,86778_0.txt
a death by hanging at the hands of unknown,86778_0.txt
persons.,86778_0.txt
The following letter was found in his,86778_0.txt
"pocket, written to his wife:-",86778_0.txt
""" Mrs. Mary Wallace, from a husband",86778_0.txt
to a wife- 1 will probably never see you,86778_0.txt
again. I am a prisoner and expect to be,86778_0.txt
hung for the murder of those who I confessed,86778_0.txt
"to have killed. Dear Mary, I can't",86778_0.txt
"tell the reason I did it, only through the",86778_0.txt
hatred I had against George for the way,86778_0.txt
he talked about you when we were stay-.,86778_0.txt
"ing at his house, and what they said about",86778_0.txt
you after we went back to your father's.,86778_0.txt
I am sorry to say that I was persuaded by,86778_0.txt
"Henry Villars, more or less, and was drink-",86778_0.txt
I was committed to jail for,86778_0.txt
ing some.,86778_0.txt
"further examination. Dear wife, I would",86778_0.txt
"like to see you, but cannot see you unless",86778_0.txt
you get well and come to see me. Darling,86778_0.txt
"if you can come and see me, come. Write",86778_0.txt
me a line or two and send to me right,86778_0.txt
away. If I live to get to jail I will write,86778_0.txt
to you and tell you all I have to say.,86778_0.txt
"Write soon. From your husband,",86778_0.txt
JOHN WALLACE.,86778_0.txt
""" P. S.- I will trust in God to save my",86778_0.txt
"soul. Good bye, dear wife, good- bye. You",86778_0.txt
"once loved your husband, and I hope will",86778_0.txt
never forget me. Let God be your comforter,86778_0.txt
. God forbid that any shall do as,86778_0.txt
"have done."" I",86778_0.txt
A Charleston( S. C.) dispatch of the 11th,86781_0.txt
says that 16 negroes were arrested in Abbe,86781_0.txt
"ville County, charged with the murder of",86781_0.txt
"two white men, Allen and Baker, near",86781_0.txt
"Lowndesville, and with having formed a conspiracy",86781_0.txt
to murder the white inhabitants of,86781_0.txt
the village. They were placed under guard,86781_0.txt
"and started for Anderson, and it was re",86781_0.txt
"ported that, while en route, they were captured",86781_0.txt
", and 13 of the negroes lynched.",86781_0.txt
"later report, however, says that the negroes",86781_0.txt
"were lodged safely in jail at Walhalla, with",86781_0.txt
"the exception of one, who committed",86781_0.txt
eide. sui,86781_0.txt
LYNCH LAW IN PRINCE GEORGE'S.- Early,86783_0.txt
on Monday morning a party of masked men,86783_0.txt
"broke open the jail at Upper Marlborough,",86783_0.txt
"Prince George's county, Md., and took from",86783_0.txt
"his cell Michael Green, colored, whom they",86783_0.txt
hanged to a tree near the town for assault,86783_0.txt
",",86783_0.txt
ing Miss Alice Sweeney. The crime was one,86783_0.txt
of peculiar atrocity and the details are too,86783_0.txt
revolting for publication. The young lady,86783_0.txt
"lived some miles north of Marlborough, and",86783_0.txt
week going to the,86783_0.txt
on Monday of last upon,86783_0.txt
"spring, about two hundred yards from the",86783_0.txt
house the waylaid her and despite her,86783_0.txt
", negro,",86783_0.txt
appeals for mercy and struggles to escape brutally,86783_0.txt
outraged her Miss Sweeney is a beautiful,86783_0.txt
.,86783_0.txt
"girl of nineteen, of high social standing and a",86783_0.txt
belle of the neighborhood. She is engaged to,86783_0.txt
"be married, and the wedding was to have taken",86783_0.txt
place in the approaching autumn. She,86783_0.txt
"was left unconscious by her assailant, but at",86783_0.txt
length she made her way to her home.,86783_0.txt
Green was arrested the following day and,86783_0.txt
Miss Sweeney positively identified him. He,86783_0.txt
had a narrow escape from lynching at the,86783_0.txt
"time, but was lodged in jail. After midnight",86783_0.txt
Sunday night the jailer was aroused by a,86783_0.txt
"band of masked men, who demanded admission",86783_0.txt
", but he refused, and without speaking a",86783_0.txt
"word, with sledge hammers and crow bars",86783_0.txt
they forced their way into the corridor. The,86783_0.txt
cell door was quickly burst open and Green,86783_0.txt
was found crouching on the floor dumb with,86783_0.txt
"terror. He was heavily manacled, but one",86783_0.txt
"of the lynchers, who appeared to be a black",86783_0.txt
"smith, advanced from the crowd, and with",86783_0.txt
hammer and cold chisel soon freed him from,86783_0.txt
