value,filename
friendly shades of the other was game. He was,86575_0.txt
"a pony when found, and after",86575_0.txt
. Between the,86575_0.txt
ing a little dropped from his,86575_0.txt
and Harry,86575_0.txt
"the jail and took to the brush, from which",86575_0.txt
"and perforated he fired at Hooker, the ball",86575_0.txt
were found pleasantly close to the latter's,86575_0.txt
father is a John replied with a few shots,86575_0.txt
and is respected,86575_0.txt
"volver, and the reckless child of",86575_0.txt
sentiment of fled. The Indians have since,86575_0.txt
act of Judge,86575_0.txt
he was hit. Through the influence,86575_0.txt
two innocent,86575_0.txt
in the same interpreter the matter of trespass,86575_0.txt
been settled.,86575_0.txt
two of the,86575_0.txt
"punishment by Edward Harris, a colored waiter",86575_0.txt
"country. Fountain House, in Waukesha,",86575_0.txt
murdered in the woods near,86575_0.txt
"Business Out Lake, a few miles from Waukesha",86575_0.txt
days ago. The murder was,86575_0.txt
have been committed by some,86575_0.txt
"Minn., Aug. 13. of the murdered man during a",86575_0.txt
Folger is here picnic the day previous.,86575_0.txt
his official du,86575_0.txt
The night of the 20th of May,86575_0.txt
"of about a sec John Ludewig, alias Linde, robbed",86575_0.txt
"very social, and mate named Matthew",86575_0.txt
Gauche at,86575_0.txt
"and other topics Milwaukee, and escaped. He",86575_0.txt
"business situation, that city, however, a few days",86575_0.txt
is in a con- has now been caught. He immediately,86575_0.txt
safely along in a knowledged his identity and,86575_0.txt
"spoke especially the robbery. Ludewig, it turns",86575_0.txt
a wonderful son of a wealthy German nobleman,86575_0.txt
by the rapid de- ing fled to the United States after,86575_0.txt
and,86575_0.txt
ting a series,86575_0.txt
the in,86575_0.txt
of crimes in his,86575_0.txt
considers the,86575_0.txt
try. He has a wife and child in,86575_0.txt
condition of the,86575_0.txt
the former being also of noble,86575_0.txt
"satisfactory, in",86575_0.txt
"dullness in Wall Captain Joseph Shipton, of",86575_0.txt
"among the Grant County, disappeared",86575_0.txt
New England. speculation was rife to what,86575_0.txt
regards as strict of him. as,86575_0.txt
on the 12th,86575_1.txt
degree.,86575_1.txt
"Generale, and",86575_1.txt
"the finest hotels in the South, the turned Republicans",86575_1.txt
"House, at Atlanta, Ga., and the servatives, a",86575_1.txt
City Bank were destroyed by fire,86575_1.txt
THE chief,86575_1.txt
"morning of the 12th. Loss,$ 1,000,000. Europe",86575_1.txt
armed mob of cowboys took L. C. have,86575_1.txt
", W. Va., by the upsetting of Northern States",86575_2.txt
.,86575_2.txt
of revolution,86575_2.txt
"FULFORD, of Miller County, ent year.",86575_2.txt
"the aid of a negro, beat his wife",86575_2.txt
THE failure,86575_2.txt
and sunk the body in the.,86575_2.txt
creek and furniture,86575_2.txt
A VIRULENT,86575_3.txt
"messenger and secured$ 3,200",86575_3.txt
ease was reported,86575_3.txt
Another stage was plundered near peared at Bristol,86575_3.txt
but the amount taken was not,86575_3.txt
cattlo.,86575_3.txt
Bozeman( Montana) Railroad tun,86575_3.txt
men were killed a few days ago.,86575_3.txt
camp near Cumberland THREE men,86575_3.txt
"Tenn railroad., the bodies of four men were James Claiborne",86575_3.txt
was ing been,86575_4.txt
to send two hundred thousand no material,86575_4.txt
to Canada and other British col- was of the strike.,86575_4.txt
At the Palace Tonight.,86577_0.txt
The feature picture tonight is the,86577_0.txt
"three- part Essanay drama, featuring",86577_0.txt
Edna Mayo and Bryant Washburn.,86577_0.txt
"Zelda Dunbar, a detective, on the",86577_0.txt
"trail of two notorious blackmailers,",86577_0.txt
offers herself as their accomplice and is,86577_0.txt
accepted by Eldridge and Mortimer.,86577_0.txt
"Zelda wins the heart of Kendrick, a",86577_0.txt
rich bachelor. Zelda slips Kendrick&,86577_0.txt
note saying her father is going to force,86577_0.txt
her to marry a man she does not love.,86577_0.txt
Kendrick takes the girl into another,86577_0.txt
state. At a hotel the pair,86577_0.txt
are con,86577_0.txt
fronted by two blackmailers and Eld,86577_0.txt
ridge charges Kendrick with violating,86577_0.txt
the Mann act. Kendrick is arrested.,86577_0.txt
A mob threatens to lynch the prisoner,86577_0.txt
See the picture..,86577_0.txt
GEORGIA MOB LYNCHES,86578_0.txt
"NEGRO, BURNS CHURCHES",86578_0.txt
"EASTMAN, Ga- The charred body",86578_0.txt
"of Eli Cooper, a Negro, was found to",86578_0.txt
"day in the ashes of a Negro church,",86578_0.txt
burned by incendiaries this week.,86578_0.txt
Three other Negro churches and a,86578_0.txt
Negro lodge in this section were burned,86578_0.txt
Tuesday night. The acts of violence,86578_0.txt
followed reports that the Ne,86578_0.txt
"groes planned to"" rise up and wipe",86578_0.txt
"out the white people,"" and that Cooper",86578_0.txt
"remarked the Negroes had been"" run",86578_0.txt
"over for fifty years, but this will all",86578_0.txt
"change in thirty days."" The burned",86578_0.txt
churches and lodge rooms were said,86578_0.txt
to have been the scenes of mass meet,86578_0.txt
recently during which the uprisings,86578_0.txt
ing of Negroes was discussed.,86578_0.txt
LYNCHING AS A HABIT,86579_0.txt
The records of lynchings in the United States last,86579_0.txt
"year, as compiled by the Tuskegee Institute, is not a",86579_0.txt
"thing to be proud of. In 1918, sixty- two persons were",86579_0.txt
"assassinated in this way, fifty- eight of them being",86579_0.txt
"Negroes and five of them women. Of the total, six",86579_0.txt
teen were killed because they were accused of crimes,86579_0.txt
against women. Fourteen were accused of complicity,86579_0.txt
"in murder, seven of murder, and six of using",86579_0.txt
threats to murder. The total was an increase of,86579_0.txt
"twenty- four over 1917, and all but three of the out",86579_0.txt
rages were perpetrated in southern states.,86579_0.txt
These figures give every American something to,86579_0.txt
"think about. In the beginning, lynching was theoretically",86579_0.txt
resorted to in the south as a retaliation for,86579_0.txt
one offense against society. But the Tuskegee report,86579_0.txt
shows that last year only about a quarter of those,86579_0.txt
"killed were even accused of that crime. This fact,",86579_0.txt
"the increase in the total number of assassinations, the",86579_0.txt
"numbering of five women among the dead, go together",86579_0.txt
to indicate that in the districts where nearly,86579_0.txt
all the killings occurred. lynch law is bearing its,86579_0.txt
natural fruit. What was once excused as an extra,86579_0.txt
ordinary proceeding to prevent the commission of a,86579_0.txt
peculiarly heinous offense has become a convenient,86579_0.txt
medium for the gratification of savage revengefulness,86579_0.txt
and barbarous impulse. It has grown to be one of,86579_0.txt
the diversions of the population and obviously is not,86579_0.txt
resorted to in the great majority of cases because,86579_0.txt
there is any feeling that the law will lag or inflict in,86579_0.txt
"adequate penalties, but because the populace prefers",86579_0.txt
to take the law into its own hands.,86579_0.txt
The whole nation is concerned in this condition be,86579_0.txt
cause the honor and reputation of the whole nation,86579_0.txt
are at stake. As long as the lynching bee persists as,86579_0.txt
a recognized institution of a large portion of the,86579_0.txt
United States there is all too much point in the sneers,86579_0.txt
of the Teutons and Bolshevists when in response to,86579_0.txt
"our protests against their inhumanities, they tell",86579_0.txt
"to look at home."" Detroit Free Press. us",86579_0.txt
A BLOT ON OUR CIVILIZATION,86579_1.txt
The record of 62 lynchings in the United States,86579_1.txt
"during 1918, compiled by Tuskegee Institute, shows",86579_1.txt
that while we have been engaged as a people in making,86579_1.txt
the world safe for democracy we have done nothing,86579_1.txt
more toward removing a hideous blot from our,86579_1.txt
civilization and making the south safe for our citizens,86579_1.txt
of the Negro race. For it is no answer to say,86579_1.txt
that if the Negro behaves himself he will not be,86579_1.txt
"lynched. The summary killing of"" the wrong man",86579_1.txt
is a familiar sequel to the story of a clime in the,86579_1.txt
south. The maddened mob is satisfied as long as it,86579_1.txt
"lynches somebody, and that somebody was a Negro",86579_1.txt
in 58 of the 62 cases of mob violence reported for the,86579_1.txt
year just ending. Fourteen of the victims were ac,86579_1.txt
"eused of complicity in murder, accused not by a grand",86579_1.txt
jury after careful investigation but by common rumor,86579_1.txt
. Six were alleged to have made threats to kill,86579_1.txt
an offense not punishable by death even if guilt is,86579_1.txt
proved. As usual the state of Georgia held the record,86579_1.txt
"for the largest number of mob murders, 18",86579_1.txt
the 62. of,86579_1.txt
"In the light of these ghastly figures, President Wil",86579_1.txt
son's remarkable exhortation to the country to abolish,86579_1.txt
the lynching evil is seen to have been fully justified.,86579_1.txt
"As he pointed out at the time, the murders by the",86579_1.txt
"mob, uncondemned by public sentiment, in certain",86579_1.txt
"sections of the country, afford the opportunity to our",86579_1.txt
foes to question the sincerity of our motives as a nation,86579_1.txt
. Those that would reform others must them,86579_1.txt
selves have clean hands. Many schemes have been,86579_1.txt
"suggested for coping with the evil, including that of",86579_1.txt
federal interference. But notwithstanding our na-,86579_1.txt
tion's supposed steady advancement toward the ideal,86579_1.txt
"democracy, we suffer this blot to remain. Until it is",86579_1.txt
removed our claim to the attainment of the highest,86579_1.txt
civilization cannot be granted.- Pittsburgh,86579_1.txt
icle- Telegraph. Chron,86579_1.txt
"Five negroes, three men and two",86580_0.txt
"women, were taken from the jali at",86580_0.txt
"Newberry, Fla., and hanged by a mob,",86580_0.txt
as the result of the killing of Constable,86580_0.txt
"S. G. Wynne by Boisey Long,",86580_0.txt
negro The lynched negroes were,86580_0.txt
accused. of aiding Long to escape.,86580_0.txt
GIST OF THE NEWS,86581_0.txt
GEN ERAL,86581_0.txt
City officials are proper persons to invite Pershing here.,86581_0.txt
Immigration agent facing trial on a serious charge.,86581_0.txt
Ludendorff planned big battle at Campretto two years ago.,86581_0.txt
"Baltimore fire loss may exceed$ 700, 000, say authorities.",86581_0.txt
McAdoo makes open bid for organiz ed labor vote.,86581_0.txt
I. W. W.'s on a hunger will be allowed to starve.,86581_0.txt
Negro who chased white strike girl lynched by Mississippi mob.,86581_0.txt
Offer Big Reward for,86583_0.txt
Arrest of Lynchers,86583_0.txt
"Atlanta, Ga., July 27.- Fifteen",86583_0.txt
hundred dollars reward is offered,86583_0.txt
tor arrest and conviction of men-,86583_0.txt
bers of a mob that lynched Bery,86583_0.txt
"Washington, a negro, 72 years old,",86583_0.txt
"near Milan, May 26. Governor Dor",86583_0.txt
"sey offered$ 1,000 and Dr. Floyd",86583_0.txt
"McRae, an Atlanta physician, whose",86583_0.txt
family home is in the county in,86583_0.txt
which the old man was hanged to a,86583_0.txt
"post and shot to death, added$ 500.",86583_0.txt
"On the night of May 24, two white",86583_0.txt
men are alleged to have invaded the,86583_0.txt
negro section of Milan and threatened,86583_0.txt
occupants of several houses.,86583_0.txt
"Washington, armed with a shotgun.",86583_0.txt
"came out of his home, and shots",86583_0.txt
were exchanged. One of the white,86583_0.txt
men was killed and Washington sur-,86583_0.txt
rendered. Two nights later a mob,86583_0.txt
him from the jail and lynched,86583_0.txt
took him.,86583_0.txt
"whites, but because of the injustice",86584_0.txt
handed down in these courts.,86584_0.txt
And now there is an opportunity,86584_0.txt
offered the Negro to better,86584_0.txt
"his environments, and what do",86584_0.txt
"you think? The white man,",86584_0.txt
"through his official powers, is",86584_0.txt
"calling out the police force and,",86584_0.txt
"perhaps, the state militia, to stop",86584_0.txt
the man who is down; the man,86584_0.txt
who is legislated against; the,86584_0.txt
man who is segregated; the man,86584_0.txt
who cannot and is not allowed to,86584_0.txt
protect his wife and daughters;,86584_0.txt
the man who is lynched and shot,86584_0.txt
"like a vonomous viper, guilty or",86584_0.txt
innocent; and the man whose,86584_0.txt
skin is not white. God is Judge,86584_0.txt
and Ruler and things must come,86584_0.txt
and go His way or perish,86584_0.txt
J. B. HARPER..,86584_0.txt
LYNCHING MADE EASY.,86584_1.txt
Is there such a thing as government,86584_1.txt
in the State of Ken,86584_1.txt
tucky? The liesurely perfor,86584_1.txt
[ mance of a Paducah mob in taking,86584_1.txt
one Negro from the County,86584_1.txt
Jail and lynching him and another,86584_1.txt
without serious interference,86584_1.txt
by the authorities gives point to,86584_1.txt
the question. The jail doors had,86584_1.txt
"first to be battered in, a slow",86584_1.txt
Then the steel cells,86584_1.txt
process.,86584_1.txt
"had to be forced, necessitating",86584_1.txt
further delay until a foundryman,86584_1.txt
could be summond to cut the,86584_1.txt
"bars. Altogether, five hours of",86584_1.txt
precious time from the point of,86584_1.txt
view of men bent on vengeance,86584_1.txt
were consumed before the mob,86584_1.txt
gained possession of its victims,86584_1.txt
and could proceed to hang and,86584_1.txt
burn them.,86584_1.txt
There was plenty of time for,86584_1.txt
"mob violence, plenty of time for",86584_1.txt
lawlessness. Why was the time,86584_1.txt
not sufficient also for the authorities,86584_1.txt
"to act, for the sheriff to raise",86584_1.txt
"a posse, or to appeal for mititary",86584_1.txt
aid? Their utter failure to prevent,86584_1.txt
the lynching in the circumstances,86584_1.txt
puts the stamp of official,86584_1.txt
"incompetency, if not of official",86584_1.txt
"cowardice, on the Paducah authorities",86584_1.txt
. If there are degrees,86584_1.txt
"of disgrace in lynchings, the",86584_1.txt
Kentucky city must bear the reproach,86584_1.txt
of having permitted one,86584_1.txt
of the exhibitions of unrestrained,86584_1.txt
worst mob violence.,86584_1.txt
derstand that their protection comes,86585_0.txt
not from a mob of cowardly lynchers,86585_0.txt
", influenced by passion or preju.",86585_0.txt
"dice, but only from the majestic",86585_0.txt
"counsupremacy of the law, under which",86585_0.txt
alone the rights of person and prop,86585_0.txt
can be protected.,86585_0.txt
jerty 0,86585_0.txt
A white man who took part in a,86586_0.txt
"pistol battle at Pleasant Hill, Mo.,",86586_0.txt
which resulted in the death of two,86586_0.txt
"men, one a policeman, was taken",86586_0.txt
from jail by a mob and lynched. As,86586_0.txt
"long as they will engage in lynching,",86586_0.txt
is just as well not to draw the color,86586_0.txt
line it.,86586_0.txt
PROBE STARTED,86587_0.txt
BY GRAND JURY,86587_0.txt
MANY INDICTMENTS RETURNED,86587_0.txt
IN CONNECTION WITH RACE,86587_0.txt
RIOTS IN OMAHA.,86587_0.txt
"OMAHA, Neb., Nov. 19 .-( P) -The",86587_0.txt
grand judy which has been probing,86587_0.txt
"the recent race riots in this city, in",86587_0.txt
which one negro was lynched and,86587_0.txt
the city jail and courthouse partially,86587_0.txt
Furned by mobs and the mayor seriously,86587_0.txt
injured as a result of his stand,86587_0.txt
"against the rioters, has returned many",86587_0.txt
indictments implicating a considerable,86587_0.txt
number of people in the riots.,86587_0.txt
It is maintained by the report of the,86587_0.txt
grand jury that the trouble was caused,86587_0.txt
by crimes committed by negroes,86587_0.txt
against women and to undue,86587_0.txt
criticism white of public officials.,86587_0.txt
LYNCHING NEGRO,86588_0.txt
QUARREL ENDS IN,86588_0.txt
nine bullets entering his body.,86588_0.txt
This is the second lynching at,86588_0.txt
Hope within the last 18 months,86588_0.txt
",",86588_0.txt
Brownie Tugles having been hanged,86588_0.txt
there on the night of March 15.,86588_0.txt
"1921, because of an alleged",86588_0.txt
on a white woman. attack,86588_0.txt
MOB THREATENS TO LYNCH,86589_0.txt
NOTORIOUS CHICAGO GUNMAN,86589_0.txt
"CHICAGO, Aug. 1.- Policemen",86589_0.txt
fought back a hostile crowd as they,86589_0.txt
"carried Tommy O'Connor, notorious",86589_0.txt
gunman and alleged slayer of Detective,86589_0.txt
"Sergeant Paddy O'Neill, into",86589_0.txt
the office of Chief Fitzmorris.,86589_0.txt
""" Lynch him!"" members of the",86589_0.txt
crowd cried as they recognized the,86589_0.txt
man who had sworn,86589_0.txt
never to be,86589_0.txt
taken alive.,86589_0.txt
""" That's Tommy O'Connor. Hang the",86589_0.txt
"cur!""",86589_0.txt
Police had,86589_0.txt
expected O'Connor's,86589_0.txt
friends to attempt to rescue him and,86589_0.txt
he,86589_0.txt
was kept in irons after being,86589_0.txt
taken from the jail at Minneapolis,86589_0.txt
Three revolvers were found on O'Con-,86589_0.txt
nor when he was captured during,86589_0.txt
atempted hold- up. an,86589_0.txt
NEGRO IS LYNCHED.,86590_0.txt
"QUITMAN, Ga., Oct. 1.- Roy New.",86590_0.txt
"some, a negro, was taken from a farm",86590_0.txt
"near Pintta, Florida late today and shot",86590_0.txt
to death. He was accused of insulting,86590_0.txt
white girl a,86590_0.txt
sided. Chris Jackson stood,86591_0.txt
"March 18, 1918.",86591_0.txt
Clerk Walter Christian,86591_0.txt
"Hon. R. G. Pleasant, Governor,",86591_0.txt
indictment. He entered a,86591_0.txt
"Baton Rouge, Louisiana.",86591_0.txt
"Sir: Associated Press dispatches Guilty."" He was represented",86591_0.txt
"H. M. Smith, Jr., Hon.",86591_0.txt
of March 16 report that George Me,86591_0.txt
"Neel, a Nogro, suspected of a crime denburg and Attorney J.",86591_0.txt
but neithor tried nor found guilty.( cplored) Commonwealth's,86591_0.txt
was lynched in the Court House yard George E. Wise represented,86591_0.txt
"at Monroe, Louisiana, on the above cution.",86591_0.txt
date. The National Association for,86591_0.txt
the Advancement of Colored People. LITTLE INTEREST,86591_0.txt
composed of representative citizens,86591_0.txt
of both aces. addresses you for the But little interest was,86591_0.txt
"third time within Six weeks to sh, use the tit",86591_0.txt
in the name of its one hundred the court room crowded,86591_0.txt
"branches and ten thousand members, Vaughan, grand mother",86591_0.txt
"for whom it speaks directly, and in ed sat next to him during",86591_0.txt
the name of the law- abiding citizens The jury was quickly,86591_0.txt
"of the whole country, what steps",86591_0.txt
Louisiana proposes to take to vindicate,86591_0.txt
her law.,86591_0.txt
"On February sixth, we addressed",86591_0.txt
you concerning the lynching of one,86591_0.txt
"Negro, on March sixth, concerning",86591_0.txt
No,86591_0.txt
the lynching of three Negroes.,86591_0.txt
reply has been made to us nor have,86591_0.txt
we seen any statement in the public,86591_0.txt
press which would indicate your appreciation,86591_0.txt
as Governor of the State,86591_0.txt
of the position in which Louisiana's,86591_0.txt
mob actions place the nation at this,86591_0.txt
time when national prestige abroad,86591_0.txt
demands high regard for law and,86591_0.txt
der at home. or,86591_0.txt
NEWS НЕ,86591_0.txt
Л,86591_0.txt
WORLD,86591_0.txt
-,86591_0.txt
COUNTRY,86591_0.txt
JE,86591_0.txt
-,86591_0.txt
RACE,86591_0.txt
Gamery,86591_0.txt
"VOLUME XXXV, NO. 22",86591_0.txt
LOUISIANA GOVERNOR,86591_0.txt
SILENT ON RECENT CHRIS,86591_0.txt
LYNCHINGS,86591_0.txt
Jury,86591_0.txt
REPEATED EFFORTS ON PART,86591_0.txt
sumed,86591_0.txt
OF N. A. A. C. P. ARE OF,86591_0.txt
NO AVAIL.,86591_0.txt
The National Association for the,86591_0.txt
Advancement of Colored People sent,86591_0.txt
to Governor R. G. Pleasant of Louis The Man,86591_0.txt
jana a telegram of otest against,86591_0.txt
the lynching of a Negro in the Court,86591_0.txt
"House yard at Monroe, La. on March",86591_0.txt
16. The Association's telegram calls,86591_0.txt
attention to the fact that this is the,86591_0.txt
"Chris. Jackson, charged",86591_0.txt
third protest which it has been compelled,86591_0.txt
to make against lynchings in murder of his wife. Florence,86591_0.txt
Louisiana within the last six weeks quitted in the Hustings,86591_0.txt
altogether five Negroes,86591_0.txt
involving,86591_0.txt
lynched on three separate occasions city last Monday night,86591_0.txt
and that no reply to the Association's had deliberated about,86591_0.txt
previous requests for information or utes.,86591_0.txt
public statement as to Louisiana's,86591_0.txt
"attitude toward these lynchings had The trial of Chris,",86591_0.txt
been made by Governor Pleasant ..,86591_0.txt
ed with the murder of,86591_0.txt
Similar telegrams were sent to the,86591_0.txt
"ence, Tuesday night.",86591_0.txt
Chambers of Commerce of New Or,86591_0.txt
1917 at Ellen Graham's,86591_0.txt
"leans, Baton Rouge, Shreveport and",86591_0.txt
"Brook Ave., was begun in",86591_0.txt
Monroe.,86591_0.txt
"Court. Monday, April 8,",86591_0.txt
The telegram:,86591_0.txt
follows M. His Honor. D. C.,86591_0.txt
LOUISIANA GOVERNOR,86591_0.txt
SILENT ON RECENT CHRIS. JACKSON,86591_0.txt
LYNCHINGS,86591_0.txt
Jury Justifies Him in Killing His Wife,86591_0.txt
REPEATED EFFORTS ON PART,86591_0.txt
sumed in the Trial -- Witnesses Testify,86591_0.txt
OF N. A. A. C. P. ARE OF,86591_0.txt
NO AVAIL,86591_0.txt
. for the,86591_0.txt
of negro lynchings in,86592_0.txt
to a report of the Tuskegee Institute,86592_0.txt
published here today. The Lone Star,86592_0.txt
state has ten cases charged against its,86592_0.txt
record.,86592_0.txt
Lynchings were less numerous during,86592_0.txt
"1920 than in 1919, the record",86592_0.txt
shows.,86592_0.txt
"Sixty one persons, including",86592_0.txt
"eight white men, were put to death by",86592_0.txt
"bombs this year, as compared 83",86592_0.txt
last year and 64 in 1918. The with re,86592_0.txt
in southern states. Armed force was,86592_0.txt
used to repel would- be lynchers on,86592_0.txt
14 occasions and in four of these,86592_0.txt
the mobs were fifred upon and seven,86592_0.txt
of the attackers killed and a number,86592_0.txt
"wounded. In 42 cases, prisoners were",86592_0.txt
removed or the guards were augmented,86592_0.txt
or other precautions taken.,86592_0.txt
Of the 61 persons lynched the re,86592_0.txt
"port says, 52 were in the south and",86592_0.txt
nine in the north and west. One of,86592_0.txt
these put to death was a negro woman.,86592_0.txt
Eighteen were charged with attacks,86592_0.txt
or attempted attacks on women. Three,86592_0.txt
"were burned to death, one of whom",86592_0.txt
was charged with attacking and murdering,86592_0.txt
a woman and two for killing,86592_0.txt
"landlords during disputes, the report",86592_0.txt
says.,86592_0.txt
Charges against whites: Murders.$,86592_0.txt
"insulting white women, 1; no charge:",86592_0.txt
"except being a foreigner, 1; killing",86592_0.txt
"officer of the law,.",86592_0.txt
Offenses charged 1 against the ne,86592_0.txt
"groes lynched, the report lists as fol",86592_0.txt
:,86592_0.txt
"lows Murder, 5; attempted murder, 5:",86592_0.txt
MOBS ATTACK TWO JAILS.,86593_0.txt
State troops guarded jails at Knox,86593_0.txt
"ville, Tenn., and Barnstable, Mass.,",86593_0.txt
Saturday in momentary expectation of,86593_0.txt
attack by mobs Intent on lynching or,86593_0.txt
"rescuing negro prisoners, held on",86593_0.txt
charges of attacking white girls.,86593_0.txt
At Knoxville one man is dead and 50,86593_0.txt
"wounded, following an attempt to",86593_0.txt
storm the jail Friday night with the,86593_0.txt
"intention of lynching Frank Martin,",86593_0.txt
"alleged assailant of Miss Jessie Parks,",86593_0.txt
"25, school teacher..",86593_0.txt
"At Barnstable white mobs, planning",86593_0.txt
lynching of three negroes charged,86593_0.txt
with an attack on Miss Gertrude Butler,86593_0.txt
", have been repulsed twice. Soldiers",86593_0.txt
have been warned negro rescue parties,86593_0.txt
may attempt to release the,86593_0.txt
by force. prisoners,86593_0.txt
and knocked unconscious.,86594_0.txt
According to the story told by Jailer,86594_0.txt
"McKenzie, the mob balted at the jail",86594_0.txt
and demanded the keys. These the,86594_0.txt
jailer refused to surrender. After,86594_0.txt
some parley the door was broken down,86594_0.txt
and five inside doors were broken,86594_0.txt
until the cell in which Jones was being,86594_0.txt
held was reached.,86594_0.txt
The jail was in a turmoil.,86594_0.txt
The mob quieted the prisoner with,86594_0.txt
"a hard blow on the head, carrying",86594_0.txt
him down the stairs and out into the,86594_0.txt
open where he was hanged to a limb,86594_0.txt
of one of the large trees which stands,86594_0.txt
just outside the jail.,86594_0.txt
The jailor said part of the mob kept,86594_0.txt
"him, Sheriff Edmondson and Deputy",86594_0.txt
Joe Ray surrounded while the remainder,86594_0.txt
did its work.,86594_0.txt
The darkness of the night and the,86594_0.txt
masks worn prevented any possible,86594_0.txt
identification.,86594_0.txt
The body was cut down early this,86594_0.txt
morning and taken to the office of,86594_0.txt
"Coroner J. E. Hulett, where a jury",86594_0.txt
will investigate the lynching late,86594_0.txt
today.,86594_0.txt
"Not a shot was fired, said Mr. Mc.",86594_0.txt
"Kenzie, during the lynehing, which",86594_0.txt
took place in a quiet and methodical,86594_0.txt
manner with exception of the,86594_0.txt
struggle in the the jail.,86594_0.txt
