value,filename
21,86419_0.txt
A Texas mob lynched a negro,86419_0.txt
because he shot a white bay. An-,86419_0.txt
other chance for Fonaker to clinch,86419_0.txt
xa another nail with the colored vote.,86419_0.txt
SHORT ROPE FOR TRICE.,86420_0.txt
"Olive Branch, Moss, Negro Who Killed",86420_0.txt
Mistress Lynched by Mob.,86420_0.txt
"Olive Branch, Miss., July 22. Andrew",86420_0.txt
"Trice, a negro, who Saturday night",86420_0.txt
"smashed the head of Susie Williams, his",86420_0.txt
"mistress, while the woman lay sleeping,",86420_0.txt
was taken from officers near here to,86420_0.txt
day by a mob of 30 negros and hanged,86420_0.txt
Trice's body was thrown into a creek,86420_0.txt
near the spot the negro had cast,86420_0.txt
the corpse of where the woman.,86420_0.txt
now our own national body,86421_0.txt
MOB LYNCHES TWO NEGROES.,86421_0.txt
They Had Confessed to Taking Part in,86421_0.txt
Murderous Raid on Italians.,86421_0.txt
"NEW ORLEANS, March 15.- Clint Farris",86421_0.txt
"and Henry Gardner, negroes, were lynched",86421_0.txt
"at Monroe, La., early to- day for connection",86421_0.txt
with the murders and other crimes recently,86421_0.txt
committed in that vicinity.,86421_0.txt
The negroes confessed to killing two,86421_0.txt
"Italians, Frank Lombardo and Joseph",86421_0.txt
"Dallio, in a negro raid on fruit stores. They",86421_0.txt
"implicated a third negro, who has not yet",86421_0.txt
been caught. Since the attack on the,86421_0.txt
Italians public sentiment in Monroe has,86421_0.txt
been roused to a high state of excitement,86421_0.txt
by a negro's attempt to outrage a white,86421_0.txt
woman and by attacks on white men at,86421_0.txt
night.,86421_0.txt
The two negroes were captured late in,86421_0.txt
the evening on suspicion. They confessed,86421_0.txt
and shortly after midnight a mob of fifty,86421_0.txt
men gathered in the court house square.,86421_0.txt
The mob leaders demanded the keys of the,86421_0.txt
"jail, and failing to get them broke into the",86421_0.txt
"prison, took out the prisoners and lynched",86421_0.txt
them in the square. On the bodies of the,86421_0.txt
lynched negroes were found this morning,86421_0.txt
the sign: Bad negroes not wanted in,86421_0.txt
"Monroe.""'",86421_0.txt
MOB LYNCHES A NEGRO,86422_0.txt
WHO HAD ATTACKED WOMAN.,86422_0.txt
"Anniston, Ala., Nov. 24.- A mob.",86422_0.txt
"lynched Roy Rolston, a negro here",86422_0.txt
today for attacking Mrs. W. C. Cheat-,86422_0.txt
"wood, wife of a white farmer. The",86422_0.txt
negro fled after his crime and was,86422_0.txt
tracked many miles. His pusuers,86422_0.txt
riddled him with shot and his body,86422_0.txt
then was burned. His victim is in,86422_0.txt
a critical condition and,86422_0.txt
may die ..,86422_0.txt
There is much feeling against,86422_0.txt
residents as a result of the affair negro.,86422_0.txt
Gov. Deneen has ordered troops to,86424_0.txt
"Vienna, Ill., to prevent the threatened",86424_0.txt
lynching of three Negroes accused of,86424_0.txt
shooting a mail carrier on a rural,86424_0.txt
Four former employes of the Ameri route,86424_0.txt
A Negro Prisoner Lynched at,86425_0.txt
"Mexico, Mo.",86425_0.txt
"St. Louis, July 22.- A special to the",86425_0.txt
"Post- Dispatch from Mexico, Mo., says:",86425_0.txt
"Frank Embree, the negro charged with",86425_0.txt
assaulting 14 year old Miss Dougherty,86425_0.txt
"near Benton, Howard county, a few",86425_0.txt
"weeks ago, was taken from the jail",86425_0.txt
here today and while en route to Fay,86425_0.txt
"ette to be tried for his crime, he was",86425_0.txt
taken from the officers by a mob at,86425_0.txt
"Steinmetz, and hanged to a tree. Your",86425_0.txt
correspondent had a talk with the negro,86425_0.txt
and he denied his guilt. He wanted to,86425_0.txt
be taken to Kansas City to prevent,86425_0.txt
"by a mob, but the officers did",86425_0.txt
capture not think it necessary.,86425_0.txt
AFRAID OF A MOB.,86425_1.txt
It Appears That There Is Still Danger,86425_1.txt
at Alma.,86425_1.txt
Although Sheriff Treu of Wabaunsee,86425_1.txt
county stoutly asserted that there was,86425_1.txt
no danger of mob violence toward,86425_1.txt
""" Dick"" Williams and James Render,",86425_1.txt
"alias Denver Kid, during their stay in",86425_1.txt
Alma yet he changed his mind and,86425_1.txt
brought Render back to the county,86425_1.txt
jail in Topeka Friday night.,86425_1.txt
There has been talk enough in Alma,86425_1.txt
to warrant the sheriff in being cautious.,86425_1.txt
With the two supposed principals in the,86425_1.txt
murder in Alma at the same time there,86425_1.txt
was danger of lynching. Render was,86425_1.txt
glad to get back to the safe keeping,86425_1.txt
the Shawnee jail. of,86425_1.txt
MINISTERS DISCUSS LYNCHING.,86426_0.txt
Atlanta Lawyer Proposes to Call Convention,86426_0.txt
to Deal with the Subject.,86426_0.txt
Special to The Post.,86426_0.txt
"Atlanta, Ga.,",86426_0.txt
"ministers of the city, for the second time,",86426_0.txt
this morning refused to pass resolutions,86426_0.txt
condemning lynching. The first resolutions,86426_0.txt
"were offered by Rev. J. T. Daves,",86426_0.txt
declaring that the crime of Hose was in,86426_0.txt
"excusable, and that no punishment could",86426_0.txt
"outweigh it, but at the same time refus-",86426_0.txt
ing to approve lynching. The other set,86426_0.txt
"condemned the crime, but added nothing",86426_0.txt
either condemnatory or in favor of mob,86426_0.txt
violence. The ministers discussed these,86426_0.txt
two papers until they were all excited,86426_0.txt
"and sorely wrought up, but compromised,",86426_0.txt
or at least decided not to commit them,86426_0.txt
"selves, by tabling both.",86426_0.txt
"Judge George Hillyer, a prominent barrister",86426_0.txt
"of this city, has inaugurated a",86426_0.txt
movement to hold a convention in Atlan,86426_0.txt
"ta shortly, to be attended by delegates",86426_0.txt
"from every county in the State, at which",86426_0.txt
the various phases of the lynching prob,86426_0.txt
"lemn, and remedies therefor, will be dis",86426_0.txt
cussed. Judge Hillyer expresses himself,86426_0.txt
very strongly on the matter He declares,86426_0.txt
.,86426_0.txt
"as a basic principle that"" any one who",86426_0.txt
thinks assaults on women should be permitted,86426_0.txt
and nothing done about it has no,86426_0.txt
"place in such a convention."" He follows up",86426_0.txt
this remark by declaring that while there,86426_0.txt
",",86426_0.txt
"can be no palliation of mob violence, at the",86426_0.txt
same time such legislation should be suggested,86426_0.txt
as will render the infraction of law,86426_0.txt
less probable or possible The press has,86426_0.txt
favorably commented on. the scheme.,86426_0.txt
Negro Lynched for Barn- burning.,86426_1.txt
"Memphis, Tenn., May 1- Willis Sees, a",86426_1.txt
"negro aged thirty years, was taken from",86426_1.txt
"the jail at Osceola, Ark., Sunday, and",86426_1.txt
hanged in the jail yard by a mob of torty,86426_1.txt
mer. Sees was charged with barn- burn-,86426_1.txt
ing.,86426_1.txt
"the negro confessed the crime, and",86426_1.txt
twice he was then hanged.,86426_1.txt
NEGRO LYNCHED.,86427_0.txt
"✦ Nashville, Tenn .. June 20.- Simon",86427_0.txt
"Ford, a negro who assaulted a",86427_0.txt
"+ white woman near Riverside, has ✦",86427_0.txt
been taken from jail to Hohen,86427_0.txt
"wald, Tenn., by a mob of fifty",86427_0.txt
and shot to death. men,86427_0.txt
Joe Fulford was lynched in Millen,86428_0.txt
"county. Ga., for the murder of his wife.",86428_0.txt
"--- E. L. Watkins, charged with cattle",86428_0.txt
stealing. was lynched by cow boys,86428_0.txt
"near Carson City, Colorado. -The",86428_0.txt
"National Bank, Lawrenceburg. Ind.,",86428_0.txt
suspended City,86428_0.txt
"a quiver."" She won't bodder I know, which",86429_0.txt
"now."" The murderer then to bear. Her",86429_0.txt
"circumstantial account of how dependent, says",86429_0.txt
"her. Two weeks before, he",86429_0.txt
of$ 800 a year,86429_0.txt
wife made her last attempt,86429_0.txt
"ses, a carriage",86429_0.txt
him. He made her drink,86429_0.txt
palatial mansion,86429_0.txt
"tea, which sickened her consid- he never will",86429_0.txt
Friday afternoon he chided her,86429_0.txt
"new evidences of infidelity, to with a man who",86429_0.txt
"only, response was that he would the same style",86429_0.txt
to think how,86429_0.txt
dose of tea when he was,86429_0.txt
""" Hattie is",86429_0.txt
about it. She then lay,86429_0.txt
"an evening nap. Hall says a born jilt, and",86429_0.txt
there until she was fast rid of you that,86429_0.txt
another.,86429_0.txt
"""",86429_0.txt
in thinking over his misfortune,86429_0.txt
"almost like killing himself. Then"" But she kissed",86429_0.txt
"suggestion:"" Why not kill her,"" and promised",86429_0.txt
obeyed it. He declared solemnly that were in her,86429_0.txt
"for a long time with himself"" Tears? And",86429_0.txt
"inclination before he succumbed them? Why,",86429_0.txt
"murderer is in jail, and lynching are her artillery",86429_0.txt
lalked of.,86429_0.txt
slightest summons,86429_0.txt
floods of them,86429_0.txt
Neuromburg's Faithful Dog.,86429_0.txt
I am,86429_0.txt
", Wis., Aug. 25.- George Neu- pang.",86429_0.txt
of woman's tears,86429_0.txt
"who murdered his wife Thursday,",86429_0.txt
""" And yet",86429_0.txt
by neighbors Friday morning,86429_0.txt
from the limb of a tree dead. A when Milly,86429_0.txt
lay beneath the swinging corpse them at the,86429_0.txt
"everybody at a distance until a late"" Well, yes;",86429_0.txt
", when the animal was shot. was afraid she",86429_0.txt
"night has long been noted for his of hysteria, as",86429_0.txt
", THE MURDERERS of Marshal Brenner",86430_0.txt
will be on trial next week. In view of,86430_0.txt
. the alarming increase in crime amounting,86430_0.txt
"to an epidemic, from which no one seems",86430_0.txt
"to be safe, it is to be hoped that they will",86430_0.txt
have swift justice done them. Society,86430_0.txt
cannot afford to have them turned loose,86430_0.txt
to certainly return to the life of crime up,86430_0.txt
", on which they have entered. It cannot be",86430_0.txt
doubted that to the frequency of escapes,86430_0.txt
"from justice by the technialities of law,",86430_0.txt
"the general laxness of public sentiment,",86430_0.txt
and the idiotic sentimentality so prevalent,86430_0.txt
we are indebted for this unparalled reign,86430_0.txt
"of crime, and also for the disposition",86430_0.txt
among law- abiding people to resort to,86430_0.txt
lynch law to put it down. Unless there is,86430_0.txt
"a radical change in administration, we",86430_0.txt
shall be lynching as common as in,86430_0.txt
fornia history. Cali-,86430_0.txt
"A mob at Evansville, Ind., attacked the jail",86432_0.txt
and forcibly carried off the wife murderer,86432_0.txt
"Redmond, for the purpose of lynching him.",86432_0.txt
"Officers fired on the mob and killed one man,",86432_0.txt
but the others got off with the murderer.,86432_0.txt
"Theodore Finney, ten years of age, killed",86432_0.txt
"himself recently at Bellwood, Neb. The boy",86432_0.txt
was an insatiate devourer of blood and,86432_0.txt
der literature. thun-,86432_0.txt
"At Fort Fetterman, Wyoming Territory, J.",86432_1.txt
"H. Capp shot and instantly killed R. R. Elgin,",86432_1.txt
"bookkeeper for Seabright Bros., and danger-",86432_1.txt
ously wounded W. K. Eagan. A party of cowboys,86432_1.txt
took Capp from custody and lynched him.,86432_1.txt
This was the second lynching in that,86432_1.txt
"within three days, county",86432_1.txt
gressmen.,86432_2.txt
Three of the mob that broke into the Evans-,86432_2.txt
"ville, Indiana, jail and took out Redman,",86432_2.txt
"the wife murderer, were arrested. In the",86432_2.txt
fight that took place the murderer was brained,86432_2.txt
with a sledge- hammer and his body riddled,86432_2.txt
with bullets. The member of the lynching,86432_2.txt
party killed was a brother- in- law of the,86432_2.txt
dered woman. mur-,86432_2.txt
MOB RULE.,86432_3.txt
Particulars of the Recent Attack on the,86432_3.txt
Evansville( Ind.) Jall and the Kriling of,86432_3.txt
the Murderer Redman- One of the Lynchers,86432_3.txt
and Several Others Arrested,86432_3.txt
Redman's Killed Crime.,86432_3.txt
An Alleged Outrager Lynched.,86433_0.txt
"DETROIT, June 15.- A man named Warner,",86433_0.txt
believed to be the person who outraged little,86433_0.txt
"Nettie Lyons at Cheboygan Tuesday night,",86433_0.txt
was taken from the jail at that place last night,86433_0.txt
by a mob and hung. The girl identified him,86433_0.txt
"as her assailant, but he maintained his inno-",86433_0.txt
", even after being once let down to see if",86433_0.txt
cence a confession could be extorted from him.,86433_0.txt
A WHITE MAN SOUGHT,86434_0.txt
BY MOB IN CAROLINA,86434_0.txt
"Augusta, Aug. 28.- A special from",86434_0.txt
Aikin count by by telephone says Sheriff,86434_0.txt
Raybun has been notified that a,86434_0.txt
mob is being formed near Granite,86434_0.txt
"ville, where Mrs. Bryant says she.",86434_0.txt
was criminaly assaulted by a white,86434_0.txt
"man named Barton Saturday, with",86434_0.txt
the determination to take the man,86434_0.txt
from the Aiken county jail.,86434_0.txt
Sheriff has taken every precaution,86434_0.txt
. Raybun,86434_0.txt
"Calhoun, La., Aug. 28.- A quiet but",86434_1.txt
determined mob hanged Alfred Schan,86434_1.txt
"fulet, a negro, to a telegraph pole",86434_1.txt
yesterday morning for attempting to,86434_1.txt
criminally assault Miss Olive Chambers,86434_1.txt
", a prominent young woman of",86434_1.txt
"this place, at an early hour",86434_1.txt
morning. The negro was frightened this,86434_1.txt
a fast trotter and a cigar.,86435_0.txt
"Samuel Camden, colored, arrested on a",86435_0.txt
"charge of felony, was taken from the jail",86435_0.txt
"at Barboursville, W. Va, Sunday morning",86435_0.txt
", by a masked mob and. lynched.",86435_0.txt
"Henry Smith and Squire Hammond,",86435_1.txt
"charged with murder, were taken from jail",86435_1.txt
"at Owenton, Ky., early on Saturday morning",86435_1.txt
by a gang of forty masked men,86435_1.txt
lynched. and,86435_1.txt
Negro Taken from Alabama Jail,86436_0.txt
and Hanged.,86436_0.txt
"Scottsboro, Ala., June 30.- Andrew Diggs, a",86436_0.txt
"negro, was taken from the jail here last night",86436_0.txt
by a mob and hanged. The negro was,86436_0.txt
on Sunday for an attempt arrested,86436_0.txt
It is considered a clever move on the part of,86436_1.txt
"Coroner McCormick to empanel a jury of blacks,",86436_1.txt
as it is thought that this will go far to make,86436_1.txt
them think that they are being put on a par,86436_1.txt
"with the whites, with whom they have been on",86436_1.txt
the verge of a race war since the lynching of,86436_1.txt
"George White. The city is now quiet, and",86436_1.txt
further trouble is expected. no,86436_1.txt
McCann.,86436_2.txt
Barrington's preliminary hearing will be held on,86436_2.txt
July 8. When asked to- day if he did not fear being,86436_2.txt
"lynched Barrington replied:"" Not a bit of it.",86436_2.txt
"I'm a Britis subject, and I expect to be legally",86436_2.txt
tried on the charges against me. The sheriff has,86436_2.txt
me that I will be well protected. I am,86436_2.txt
"innocent assured until you prove me guilty.""",86436_2.txt
"Omaha, Sept. 30.- A steady rain|",86437_0.txt
which fell during the night probably,86437_0.txt
done more to restore order than anything,86437_0.txt
"else, following the riots Sun-",86437_0.txt
day night when a negro was lynched,86437_0.txt
and the courthouse was fired. Mayor,86437_0.txt
"Smith, who was nearly hanged, is",86437_0.txt
improving and is expected to recover.,86437_0.txt
military guard is patrolling,86437_0.txt
around the hospital where he,86437_0.txt
kept. is,86437_0.txt
"Montgomery, Ala., Sept. 30.",86437_1.txt
The city is quiet today following,86437_1.txt
the lynching of two negroes last,86437_1.txt
"night, by a mob who took the",86437_1.txt
prisoners from officials. An,86437_1.txt
other negro was killed in a revolver,86437_1.txt
duel with a policeman,86437_1.txt
last night. The officer also,86437_1.txt
from wounds which he received died.,86437_1.txt
"Greensburg, Pa., May 6.- An entire troop of the state",86438_0.txt
"constabulary, reinforced by a score of uniformed and",86438_0.txt
"armed volunteers, surrounded the barracks where James",86438_0.txt
"Crawford, alleged to have confessed to the murder of",86438_0.txt
"Emma Austraw, the La Trobe school teacher and alleged",86438_0.txt
"accomplice, John Ray, age 17, are being guarded from",86438_0.txt
Both parties are white. The news of the arrest of the,86438_0.txt
alleged slayers has sent countless mobs of people to,86438_0.txt
Trobe to lynch the slayers at any cost. La,86438_0.txt
"DISORDERS, one little bottle worked a complete cure",86439_0.txt
THE WILMINGTON and he cannot help but feel grateful.,86439_0.txt
This is a summary of the events in The season for bowel disorders being at,86439_0.txt
"Wilmington, Del., yesterday in connec hand suggests this item. For sale by",86439_0.txt
tion with the lynching of the negro White Richard Gibson.,86439_0.txt
on Monday night and the race riots WATCHES AND JEWELRY DE,86439_0.txt
Thursday night:,86439_0.txt
"William Cramer, colored, died as a",86439_0.txt
result of the wounds received Thursday Our,86439_0.txt
night at the hands of another colored,86439_0.txt
W,86439_0.txt
man. Special,86439_0.txt
Missouri Lynchers Held for Murder.,86440_0.txt
"JOPLIN, Mo., April 19.- Three alleged",86440_0.txt
leaders in the mob that lynched the negro,86440_0.txt
"here are under arrest and in jail, charged",86440_0.txt
with murder in the first degree. They are,86440_0.txt
"Sam Mitchell, Ed Fields and B. A. Barnes",86440_0.txt
A number of others will be arrested.,86440_0.txt
9 NEGROES HANG IN ONE DAY,86441_0.txt
South Executes Seven by Legal Process,86441_0.txt
and Two Are Mob,86441_0.txt
Victims.,86441_0.txt
"Memphis, Aug. 9.- Nine negroes",86441_0.txt
"were hanged, seven legally and two",86441_0.txt
"lynched, while a tenth was being",86441_0.txt
chased in the southern states on Fri,86441_0.txt
day.,86441_0.txt
Alabama led the list with four legal,86441_0.txt
"hangings. At Evergreen, Robert Wat",86441_0.txt
kins and John Salter were hanged for,86441_0.txt
the murder and assault of Mrs. Mary,86441_0.txt
Lassiter at Cullman.,86441_0.txt
George James was hanged for the,86441_0.txt
murder of George Clayburn. Millard,86441_0.txt
Carpenter was hanged at Birmingham,86441_0.txt
for the murder two years ago of John,86441_0.txt
"T. Camp, a white man.",86441_0.txt
"Mississippi hanged three negroes,",86441_0.txt
"two of them, Peter Bolen and Jim",86441_0.txt
"Seales, were convicted of murdering",86441_0.txt
another negro.,86441_0.txt
Bunyan Walters was hanged at Fay,86441_0.txt
"etteville, Miss., for the murder of Tom",86441_0.txt
Neals.,86441_0.txt
"Dispatches from Shawnee, Okla ..",86441_0.txt
"tell of a"" quiet, orderly crowd armed",86441_0.txt
"to the teeth,"" which hanged Ed Berry",86441_0.txt
"to a Santa Fe railroad bridge, riddled",86441_0.txt
his body with bullets and dispersed,86441_0.txt
in as orderly a fashion as it had,86441_0.txt
formed.,86441_0.txt
In the early,86441_0.txt
morning hours at,86441_0.txt
"Trilby, Fla., a crowd, hypnotized with",86441_0.txt
"fury, lynched Will Leach, accused",86441_0.txt
attacking a thirteen- year- old girl. of,86441_0.txt
Two Negroes Lynched for,86442_0.txt
Murder by Georgia Mob,86442_0.txt
"MACON, Ga., Dec. 21.- Residents of",86442_0.txt
"Eastman, a village near here, awoke",86442_0.txt
today to find bullet- riddled bodies of,86442_0.txt
"two negroes, William Stewart and",86442_0.txt
"Samuel Bland, swinging from nooses,",86442_0.txt
the victims of a lynching bee during,86442_0.txt
the night.,86442_0.txt
A confession was said to have been,86442_0.txt
obtained by members of a mob from,86442_0.txt
the that they robbed and,86442_0.txt
negroes,86442_0.txt
"killed A. M. Batchellor, a merchant,",86442_0.txt
"Sunday night, near his home, at",86442_0.txt
Eastman.,86442_0.txt
"The mob, estimated at nearly 100,",86442_0.txt
strung up the negroes near the scene,86442_0.txt
of the robbery. Few of the mob wore,86442_0.txt
masks and authorities today were,86442_0.txt
"making, an investigation.",86442_0.txt
Mob Lynches Negro Assailant.,86443_0.txt
"Hearne, Tex- After he had shot and",86443_0.txt
"twice wounded J. R. Robertson, plantation",86443_0.txt
"manager, near here, Bill Wil",86443_0.txt
"liams, negro was hanged by a posse",86443_0.txt
"of citizens., Robertson will recover.",86443_0.txt
"Shoots Into Crowd at Paris, Ky., to",86444_0.txt
Prevent Lynching of Negro,86444_0.txt
Prisoner.,86444_0.txt
"Paris, Ky., Aug. 31.- In defending c",86444_0.txt
prisoner whom a mob attempted to,86444_0.txt
take from the jail here City Jailer E.,86444_0.txt
J. Farris shot and killed Eugene Hous,86444_0.txt
"ton, a prominent citizen. The mob",86444_0.txt
had attacked the jail in an attempt,86444_0.txt
"to get a negro, Henry Thompson, who,",86444_0.txt
after being caught robbing the home,86444_0.txt
"of Henry Mead, struck Mead with a",86444_0.txt
"hatchet, probably fatally injuring him.",86444_0.txt
"Mead, after being injured, wrenched",86444_0.txt
the hatchet from Thompson's hand,86444_0.txt
and inflicted a wound that prove,86444_0.txt
fatal to the negro. will,86444_0.txt
In denouncing at the session of the,86445_0.txt
"national independent political league,",86445_0.txt
"the lynching of negroes, Bishop Alex",86445_0.txt
ander Walters declared that President,86445_0.txt
"Taft was"" one of the weakest presidents",86445_0.txt
"the country had ever had, in",86445_0.txt
view of the fact that he had remained,86445_0.txt
silent in the face of many,86445_0.txt
"about the country."" lynchings",86445_0.txt
State Southern in,86446_0.txt
The Spectacular Lynching of a Negro,86446_0.txt
"Owensboro, Ky, May 12- Indictments",86446_0.txt
were returned here today against eighteen,86446_0.txt
well known citizens of McLain,86446_0.txt
county growing out of the spectacular,86446_0.txt
"lynching of the negro, William Potter",86446_0.txt
at Livermore about three weeks ago.,86446_0.txt
Three of the indictments charge murder,86446_0.txt
.,86446_0.txt
"The mob's victim, accused of having",86446_0.txt
killed a white man was arrested and,86446_0.txt
concealed in a dressing room in the,86446_0.txt
Crown theater. The mob found him,86446_0.txt
and Potter was strung up over the or,86446_0.txt
lights while those in the house,86446_0.txt
chestra filled his body with bullets.,86446_0.txt
NEGROES GUARD JAIL,86447_0.txt
AND PREVENT LYNCHING,86447_0.txt
"Stanford, Ky .. Jail Scene of",86447_0.txt
Unusual Doings,86447_0.txt
"Stanford, Ky., Feb. 16.- A mob of",86447_0.txt
negroes heavily armed stood on guard,86447_0.txt
outside the jail here last night prepared,86447_0.txt
to resist any attempt of a whit,86447_0.txt
"mob to lynch the blacks, Louis Gregory",86447_0.txt
"and Curley Johnson, held for shooting",86447_0.txt
and robbing three white tobacco,86447_0.txt
farmers on the Danville pike last Mon-,86447_0.txt
day night. It is believed the action of,86447_0.txt
the negro mob had the effect of warding,86447_0.txt
or an attempt to lynch the prisoners,86447_0.txt
.,86447_0.txt
At midnight a posse of armed white,86447_0.txt
men who are neighbors of the high-,86447_0.txt
waymen's victims drove into town and,86447_0.txt
scouted about the jail. They advised,86447_0.txt
"against an attempt to storm the jail, it",86447_0.txt
"is believed, because the slightest mov",86447_0.txt
against the negro prisoners would have,86447_0.txt
resulted in a fierce clash between the,86447_0.txt
races.,86447_0.txt
Sheriff McCarthy and a squad of,86447_0.txt
deputies stood guard in front of the,86447_0.txt
jail during the night. They paid no at,86447_0.txt
attention to the negroes' demonstration,86447_0.txt
until several shots were fired in,86447_0.txt
to the black camp. There is a bitter,86447_0.txt
feeling against the negroes in this vicinity,86447_0.txt
", and the whites are going",86447_0.txt
fully armed. about,86447_0.txt
PRISONER SHOOTS SHERIFF,86448_0.txt
Negroes Kill Captor and Escape with,86448_0.txt
Mob Anxious for Lynching on,86448_0.txt
Their Heels.,86448_0.txt
"BIRMINGHAM, Ala., Jan. 11.- A report",86448_0.txt
reached here today of the assassination of,86448_0.txt
Sheriff Reese of Bibb county. The crime,86448_0.txt
occurred at Brierfield late last night.,86448_0.txt
Reese and one of his deputies had arrested,86448_0.txt
two negroes and were taking them,86448_0.txt
to Centerfield to board a train. One of the,86448_0.txt
negroes was walking in front of the sheriff,86448_0.txt
"and the other behind, when suddenly the",86448_0.txt
"rear man shot the sheriff, killing him instantly",86448_0.txt
. mob is chasing the negroes and,86448_0.txt
preparations A are being made for a lynching.,86448_0.txt
Three negroes were lynched at Tus,86449_0.txt
"cumbia, Ga., Saturday night, for",86449_0.txt
ing barns. burn,86449_0.txt
BULLETIN,86451_0.txt
( Associated Press by Federal Wireless.),86451_0.txt
"ATLANTA, Georgia, August 17 .-( 5",86451_0.txt
o'clock a. m.)- The body of Leo Frank,86451_0.txt
who was abducted last night by an,86451_0.txt
"armed and masked band, is reported",86451_0.txt
to have been found hanging from a,86451_0.txt
"tree, within five miles of the state",86451_0.txt
penitentiary at Milledgeville. He,86451_0.txt
been lynched. had,86451_0.txt
( Associated Press by Federal Wireless.),86451_1.txt
"MILLEDGEVILLE, Georgia, August",86451_1.txt
17.- Twenty- five masked and armed,86451_1.txt
men overpowered the warden of the,86451_1.txt
state penitentiary here last night oth,86451_1.txt
delivered Leo from jail. Whether,86451_1.txt
he is now in the hands of friends,86451_1.txt
or already has been lynched by his,86451_1.txt
enemies is unknown.,86451_1.txt
Frank was convicted of the murder,86451_1.txt
