value,filename
manifestation on the outskirts of New,90563_0.txt
"Orleans, which is one of the most",90563_0.txt
wanton and barbarous instances of,90563_0.txt
lynching in the annals of lawlessness.,90563_0.txt
There was no pretence that the three,90563_0.txt
"negros so o savagely"" strung up"" were",90563_0.txt
guilty of any other offence than refusing,90563_0.txt
to betray their brother to the savage,90563_0.txt
"mob to be brutally murdered, or",90563_0.txt
"that the fourth victim, kicked to death,",90563_0.txt
was any inore deserving of his awful,90563_0.txt
fate. But not even their conceded innocence,90563_0.txt
availed to save them from the,90563_0.txt
fury of the maddened crowd bent on,90563_0.txt
lynching the fugitive negro.,90563_0.txt
In former times lynch law resorted,90563_0.txt
to only by masked desperadoes was,90563_0.txt
"under cover of darkness, to inflict sum-",90563_0.txt
mary punishment on the undoubted,90563_0.txt
perpetrator of a crime exceptionally,90563_0.txt
"heinous, and it was regarded with horror",90563_0.txt
"when committed in a well settled,",90563_0.txt
law- abiding community. But it has,90563_0.txt
grown alarmingly common in parts of,90563_0.txt
the country where it should not be,90563_0.txt
countenanced. It become the,90563_0.txt
means of savage torture has as well as of,90563_0.txt
death. It has been extended to ac-,90563_0.txt
cused criminals whose guilt has been,90563_0.txt
"doubtful, and now it numbers even the",90563_0.txt
"innocent among its victims. In short,",90563_0.txt
it has been spreading and growing,90563_0.txt
barbarous and more dangerous. more,90563_0.txt
A GOOD LAW.,90564_0.txt
"In Ohio, counties where lynchings occur",90564_0.txt
must pay damages to those dependent,90564_0.txt
"on victims for support, the",90564_0.txt
same as corporations must pay damages,90564_0.txt
for injuries by which individuals,90564_0.txt
are deprived of ability to support themselves,90564_0.txt
or families. It is a law of that,90564_0.txt
state the validity of which has been,90564_0.txt
twice sustained by the supreme court.,90564_0.txt
A recent decision was made in suits for,90564_0.txt
damages resulting from the atrocious,90564_0.txt
Urbana lynchings four years ago. The,90564_0.txt
members of the mob of lynchers could,90564_0.txt
"not be reached or were irresponsible,",90564_0.txt
"and so the county was sued for$ 5,000",90564_0.txt
by the heirs of one of the victims of,90564_0.txt
the mob. This is the amount for which,90564_0.txt
final judgment has affirmed.-,90564_0.txt
Chicago Chronicle. been,90564_0.txt
GATHERING,90565_0.txt
AT ST. LOUIS,90565_0.txt
Of the Representatives of,90565_0.txt
the Southwest,90565_0.txt
An Arizonian Breaks in With a Propo-,90565_0.txt
sition to Establish a Negro Colony,90565_0.txt
in Africa.,90565_0.txt
"St. Louis, April 16.- A convention of",90565_0.txt
the commercial clubs and newspaper,90565_0.txt
"editors of the southwest, held under",90565_0.txt
the auspices of the Busines League of,90565_0.txt
"St. Louis, was called to order here today",90565_0.txt
at the mercantile club. Governor,90565_0.txt
"Hoca of Kansas, Governor Kibbey of",90565_0.txt
Arizona and Governor Hagerman of,90565_0.txt
"New Mexico, were present, as guests",90565_0.txt
of honor.,90565_0.txt
"Theodore W. Gulick, of Muskogee, I.",90565_0.txt
T .. was chosen temporary,90565_0.txt
chairman.,90565_0.txt
The convention was thrown into an,90565_0.txt
uproar by the reading of a communication,90565_0.txt
"from D. R. Thomas, of Bonita,",90565_0.txt
"Arizona, styling himself' Chairman of",90565_0.txt
"the Black Movement association,"" in",90565_0.txt
"which he said he represented 500,000-",90565_0.txt
negroes in the United States in requesting,90565_0.txt
the clubs to endorse a movement,90565_0.txt
to deport the colored people of,90565_0.txt
"the country to the Congo Free State,",90565_0.txt
Africa Africa.. Instantly a score of delegates,90565_0.txt
were on their feet demanding that the,90565_0.txt
communication be tabled. This was,90565_0.txt
done.,90565_0.txt
A permanent organization was effected,90565_0.txt
", Jos. W. McNeil, of Guthrie, O.",90565_0.txt
"T., being made permanent chairman.",90565_0.txt
"Governor Hoch of Kansas, the only",90565_0.txt
"governor present, who had arrived,",90565_0.txt
made a brief addres on which he,90565_0.txt
dwelt upon the proposed celebration of,90565_0.txt
the fiftieth anniversary of the state,90565_0.txt
"of Kansas to be held in Topeka, in",90565_0.txt
1911.,90565_0.txt
The governor spoke of agricultural,90565_0.txt
pride in the southwest and its vast re-,90565_0.txt
He said that the time is,90565_0.txt
sources.,90565_0.txt
coming when the western half of the,90565_0.txt
union will dominate in the affairs of,90565_0.txt
the nation.,90565_0.txt
""" With great New York in the east,""",90565_0.txt
"he said,"" and the greater New York of",90565_0.txt
"the west, Kansas and the southwest",90565_0.txt
might be termed eventually the juicy,90565_0.txt
"meat of the national sandwich.""",90565_0.txt
"Seymour Riddle of Vinita, I. T ..",90565_0.txt
"spoke on the"" Agencies of Development",90565_0.txt
"and Progress.""",90565_0.txt
The following resolutions were in-,90565_0.txt
"troduced, but were ordered tabled:",90565_0.txt
""" Whereas, the attention of the country",90565_0.txt
is directed to the lynchings at,90565_0.txt
"Springfield, Mo., a matter abhorrent",90565_0.txt
alike to the citizens of Missouri and,90565_0.txt
the entire southwestern country;,90565_0.txt
"therefore be it,",90565_0.txt
""" Resolved, that this convention view",90565_0.txt
with the efforts of Governor,90565_0.txt
"approval,",90565_0.txt
"Folk to suppress crime in general, and",90565_0.txt
the apprehension and punishment of,90565_0.txt
the perpetrators of the recent violations,90565_0.txt
"of the law at Springfield, which",90565_0.txt
resulted in loss of life and destruction,90565_0.txt
of property.,90565_0.txt
be,90565_0.txt
Resolved that this resolution,90565_0.txt
"wired"" to Governor Folk.""",90565_0.txt
JOHNSTOWN RIOT,90565_1.txt
|,90565_1.txt
THREE MEN KILLED,90565_1.txt
The Affair Followed Upon the Heels,90565_1.txt
of an Easter Celebration.,90565_1.txt
"Johnstown, Pa .. April 16.- Three",90565_1.txt
"men have been shot dead, a boy fatal-",90565_1.txt
"ly wounded and a mining engineer,",90565_1.txt
"Eugene Delaney, seriously injured in",90565_1.txt
"i a riot at Windber, among the striking",90565_1.txt
coal miners tonight. The place is,90565_1.txt
"in a state of terror, Sheriff Begley has",90565_1.txt
been summoned and av appeal has,90565_1.txt
been made to Governor Pennypacker,90565_1.txt
for troops. Several others of the rioters,90565_1.txt
have sustained slight injuries. The,90565_1.txt
dead men and most of the injured are,90565_1.txt
foreigners and their names cannot be,90565_1.txt
obtained. The bodies are lying in the,90565_1.txt
"street tonight where they fell,",90565_1.txt
the,90565_1.txt
strikers refusing to let the undertakers,90565_1.txt
remove them.,90565_1.txt
The foreign element has been celebrating,90565_1.txt
Easter Monday in the mining,90565_1.txt
section and much liquor has been,90565_1.txt
used. The streets had been thronged,90565_1.txt
"all day with a boisterous crowd, but",90565_1.txt
no sign of trouble appeared until tonight,90565_1.txt
. A body of strikers were assembled,90565_1.txt
in front of the Windber jail,90565_1.txt
discussing the mass meeting that had,90565_1.txt
been held during the afternoon and,90565_1.txt
which had been addressed by three,90565_1.txt
Catholic priests. The discussion grew,90565_1.txt
"into an argument, and soon there was",90565_1.txt
a free- for- all fight. Strike deputies,90565_1.txt
made a number of arrests. All of the,90565_1.txt
arrested men were union men and their,90565_1.txt
colleagues set up a cry that they were,90565_1.txt
being discriminated against.,90565_1.txt
The arrested men were marched to,90565_1.txt
"the jail door, but there a mob had",90565_1.txt
formed and an attempt was made to,90565_1.txt
take the men from the officers. Fore-,90565_1.txt
"ed back from the jail door, the mob,",90565_1.txt
"growing more violent every minute,",90565_1.txt
"threatened the deputies, until the officers",90565_1.txt
fired. When the smoke had,90565_1.txt
cleared away and the victims of the,90565_1.txt
"shots were viewed by the crowd, there",90565_1.txt
were cries of anger and soon the,90565_1.txt
"miners, who were armed, returned the",90565_1.txt
shots of the deputies. The firing,90565_1.txt
"ceased almost as soon as it began,",90565_1.txt
"however, and the crowd filed",90565_1.txt
away,90565_1.txt
from the jail. There is much dynamite,90565_1.txt
stored here and it is feared the strikers,90565_1.txt
will resort to the explosive in,90565_1.txt
venge. re-,90565_1.txt
THE GOWARDLY MOB,90565_2.txt
GOING INTO HIDING,90565_2.txt
Four of the Leaders in the,90565_2.txt
Lynching Arrested Springfield,90565_2.txt
A Special Grand Jury Assembles Today for the Indictment,90565_2.txt
of all who Can be Identified as,90565_2.txt
in the Butchery. Participants,90565_2.txt
Springfield. Mo ... April 16.- Four,90565_2.txt
men are now under arrest here charged,90565_2.txt
with being leaders in the mob that,90565_2.txt
broke into the county jail. Saturday,90565_2.txt
night and lynched three negroes. One,90565_2.txt
of the alleged mob leaders is in jail,90565_2.txt
and three have been released on bond.,90565_2.txt
The grand jury will meet tomorrow,90565_2.txt
morning especially to indict those men,90565_2.txt
who were in the mob of lynchers.,90565_2.txt
At noon it became known that twenty,90565_2.txt
- five warrants charging murder in,90565_2.txt
the first degree were in the hands of,90565_2.txt
the sheriff. After the arrests the,90565_2.txt
lynchers became alarmed and left the,90565_2.txt
streets. Before dark the square was,90565_2.txt
deserted and tonight it is absolutely,90565_2.txt
quiet. Around the jail are camped,90565_2.txt
200 soldiers with guards out at every,90565_2.txt
point so that none can get near the,90565_2.txt
jail. No mob that might be raised,90565_2.txt
"here could face that soldiery, and no",90565_2.txt
one expects a mob or any further,90565_2.txt
trouble as long as the militia stay ..,90565_2.txt
It is expected that the grand jury,90565_2.txt
will indict at least fifty and perhaps,90565_2.txt
one hundred men. All men supposed,90565_2.txt
to know the names of any of the mob,90565_2.txt
will be summoned before the grand,90565_2.txt
jury and in this way the prosecutor,90565_2.txt
hopes to get the names of nearly all,90565_2.txt
who took an active part in the assault,90565_2.txt
on the jail. Not a man in the mob,90565_2.txt
wore a mask or made any attempt at,90565_2.txt
concealment. The names of the leaders,90565_2.txt
and of those who led the negroes,90565_2.txt
by the ropes through the streets,90565_2.txt
and,90565_2.txt
who lynched them afterward are,90565_2.txt
known here. well,90565_2.txt
OPINIONS OF VISITORS.,90565_3.txt
Governor,90565_3.txt
Kibbey Believes Governor,90565_3.txt
Folk Will Meet the Emergency.,90565_3.txt
"Louis, April 16.- Expressions",90565_3.txt
were St. sought today from the visiting,90565_3.txt
governors concerning the Springfield,90565_3.txt
lynching. Governor,90565_3.txt
Hagerman of,90565_3.txt
New Mexico said:,90565_3.txt
""" Such a lynching",90565_3.txt
as took place in Springfield. under a,90565_3.txt
statue of liberty with the police helpless,90565_3.txt
could not have occurred in New,90565_3.txt
Mexico. Our mounted police are mea,90565_3.txt
who would take no account of the,90565_3.txt
odds against them in enforcing the,90565_3.txt
law. It would be,90565_3.txt
a lasting disgrace to,90565_3.txt
a sheriff in the territory to have a,90565_3.txt
"prisoner taken from him by a mob, as",90565_3.txt
"it is to have a prisoner escape.""",90565_3.txt
Governor Hoch,90565_3.txt
of Kansas. said:,90565_3.txt
""" Race prejudice is not bounded by",90565_3.txt
"geographical lines. This outbreak, in",90565_3.txt
which the mob did not learn whether,90565_3.txt
"the prisoners were guilty, is another",90565_3.txt
"instance of this hyena- like spirit.""",90565_3.txt
Governor Jos. H.,90565_3.txt
Kibbey of Ari-,90565_3.txt
"zona stated:"" There is no condition",90565_3.txt
under which I favor mob or lynch law.,90565_3.txt
and when a body of citizens or men,90565_3.txt
pretend to take the law into their own,90565_3.txt
"hands and administer justice, the perpetrators",90565_3.txt
of the offense should be,90565_3.txt
punished.,90565_3.txt
""" This statement is general. I do not",90565_3.txt
wish,90565_3.txt
to express an opinion on a,90565_3.txt
"purely local affair, which might be",90565_3.txt
construed into a criticism either of,90565_3.txt
Governor Folk or of the officials,90565_3.txt
at,90565_3.txt
Springfield. I believe that Governor,90565_3.txt
Folk will handle the situation with,90565_3.txt
credit,90565_3.txt
".""",90565_3.txt
WHITE MAN LYNCHED.,90566_0.txt
Shot His Newly Found Friend Dead,90566_0.txt
and Citizens Resented It.,90566_0.txt
"Osceola, Ark., April 13.- May Hearn,",90566_0.txt
"a white man about 26 years old, was",90566_0.txt
taken from the county jail last night,90566_0.txt
by a masked mob and hanged to the,90566_0.txt
limb of a tree just in the rear of the,90566_0.txt
jall. Hearn was in jail for killing,90566_0.txt
"Clyde King at Luxora, Ark., on last",90566_0.txt
Sunday night. King was from Union,90566_0.txt
"City, Tenn .. and was visiting his",90566_0.txt
"brothers, who live at Luxora. He there",90566_0.txt
became acquained with Hearn and a,90566_0.txt
friendship sprang up between them.,90566_0.txt
Sunday night they visited a re-,90566_0.txt
On,90566_0.txt
sort in Luxora and while there Hearn,90566_0.txt
sat down to the piano and began,90566_0.txt
pounding the keys with a heavy,90566_0.txt
revolver,90566_0.txt
", falling to stop after several",90566_0.txt
requests.,90566_0.txt
remonstrated in a,90566_0.txt
King,90566_0.txt
telling him he,90566_0.txt
"friendly way,",90566_0.txt
that,90566_0.txt
wou'd ruin the instrument. Upon this,90566_0.txt
Hearn turned and with an oath fired,90566_0.txt
"his revolver at King, the bullet pier",90566_0.txt
ing the heart. Hearn had had a bad,90566_0.txt
"reputation for several years, having at",90566_0.txt
tempted to shoot four or five different,90566_0.txt
men. At the time of his last crime he,90566_0.txt
was under sentence of three years in,90566_0.txt
penitentiary. He was released un-,90566_0.txt
the der bond pending an appeal.,90566_0.txt
NEGRO RAPIST LYNCHED,90568_0.txt
Man Who Defends Him Is Shot to,90568_0.txt
Death.,90568_0.txt
"Lake Charles, La., Feb. 21.- Thomas",90568_0.txt
"Vital, the negro who criminally assaulted",90568_0.txt
the thirteen- year- old daughter,90568_0.txt
"of Estieve Miller, was taken from his",90568_0.txt
home near Fenton last night by a,90568_0.txt
mob and lynched. Samuel Maddox,90568_0.txt
"who attempted to defend Vital, was",90568_0.txt
shot to death. Vital had been previously,90568_0.txt
shot in leg by the girl's,90568_0.txt
father and was not the yet under arrest.,90568_0.txt
NEGRO SLAYER LYNCHED.,90569_0.txt
"LITTLE ROCK, Ark., July 13.-",90569_0.txt
"John Williams, a negro, was taken",90569_0.txt
from officers and hanged by a mob,90569_0.txt
"near Plummerville, Ark, forty miles",90569_0.txt
"northwest of Little Rock, late last",90569_0.txt
night.,90569_0.txt
"Williams had killed Paul Nister, a",90569_0.txt
"special deputy, when officers at",90569_0.txt
tempted to stop a general fight at a,90569_0.txt
picnic,90569_0.txt
negro.,90569_0.txt
LYNCH LAW ON,90570_0.txt
WANE IN 1912,90570_0.txt
( Continued from Page 1),90570_0.txt
"6; Florida, 5; Alabama, 4; Arkansas,",90570_0.txt
"3; Texas, 3; Mississippi. 3; Tennes",90570_0.txt
"see, 1: Wyoming, 1; West Virginia,",90570_0.txt
"1; Mortana, 1; California. 1; and",90570_0.txt
"North Dakota, 1.",90570_0.txt
In the fifty- two lynchings the vic-,90570_0.txt
tims of all but two were negroes.,90570_0.txt
Three negresses were included in the,90570_0.txt
list. Alleged crimes against women,90570_0.txt
and girls and the murder of white,90570_0.txt
persons account for practically all,90570_0.txt
of the cases.,90570_0.txt
A singular feature is found in the,90570_0.txt
"lynching of the two white men, both",90570_0.txt
of which occurred in the far north.,90570_0.txt
in each case the victim was accused,90570_0.txt
"of murder. In the town of Joppa, a",90570_0.txt
"short distance from Rosebud, Mont ..",90570_0.txt
"Harry Heffner, alleged slayer of Mrs.",90570_0.txt
"William Merrill, was taken from the",90570_0.txt
county jail by a crowd of masked men,90570_0.txt
"and hanged, despite the efforts of the",90570_0.txt
sheriff and his deputy. The second,90570_0.txt
"lynching occurred at Steele, N. D.,",90570_0.txt
"where George Baker, charged with",90570_0.txt
the murder of his wife and father- in-,90570_0.txt
"law, was taken from the jail and",90570_0.txt
hanged by a mob. The lynching was,90570_0.txt
the first recorded in North Dakota,90570_0.txt
in more than a decade.,90570_0.txt
The lynching in Wyoming was one,90570_0.txt
of the most sensational of the year.,90570_0.txt
"Frank Wigfali, a negro, who confessed",90570_0.txt
to having made a criminal attack on,90570_0.txt
"Mrs. Esther Higgins, an aged woman",90570_0.txt
"known as the"" prisoners' friend,"" was",90570_0.txt
lynched by the convicts of the state,90570_0.txt
Penitentiary at Rawlins.,90570_0.txt
In the West Virginia lynching the,90570_0.txt
"victim was Walter Johnston, a negro",90570_0.txt
accused of assaulting a young white,90570_0.txt
girl in Mercer County.,90570_0.txt
California's one lynching was out,90570_0.txt
of the ordinary. It occurred on the,90570_0.txt
"desert, soine thirty miles from the",90570_0.txt
town of Mojave. The victim was an,90570_0.txt
unknown negro accused of having a,90570_0.txt
tacked a six- year- old child. He was,90570_0.txt
hanged by men alleged to be em-,90570_0.txt
pioyed on the Los Angeles aqueduct.,90570_0.txt
The three negresses who fell victim,90570_0.txt
"to mob violence were Ann Boston,",90570_0.txt
who murdered the wife of a planter,90570_0.txt
"at Pine hurst, Cal .; Mary Johnson,",90570_0.txt
"Teached who was lynched in Panoia, county,",90570_0.txt
"Texas, for alleged complicity in the",90570_0.txt
"murder of a white man, and an up-",90570_0.txt
"known negress who, together with",90570_0.txt
"three negroes, was hanged by a mob",90570_0.txt
"in Harris county, Georgia, for the",90570_0.txt
murder of a farmer.,90570_0.txt
"Tyler. Texas, furnished the only",90570_0.txt
instance of the year where the victim,90570_0.txt
was burned at the stake. On May,90570_0.txt
"25 Dan Davis, a negro who had con-",90570_0.txt
fessed to a criminal attack on a young,90570_0.txt
"white woman, was burned at the",90570_0.txt
stake in one of the main streets of,90570_0.txt
Tyler in the presence of a crowd of,90570_0.txt
two thousand persons.,90570_0.txt
The foregoing record does not comprise,90570_0.txt
cases of plain murder or cases,90570_0.txt
where the victim was killed a,90570_0.txt
posse while resisting capture. by,90570_0.txt
Victim of a Mob Shot One of His Assailants,90571_0.txt
Before He Was Lynched.,90571_0.txt
"Columbla, S. C., Feb. 28.- Two days",90571_0.txt
"ago Henry Saxon, a young man, went",90571_0.txt
to Greenville and obtained board at,90571_0.txt
the house of James Green. He was an,90571_0.txt
old acquaintance of Mrs. Green and his,90571_0.txt
conduct in the house aroused the jealousy,90571_0.txt
"of Green, who consulted with his",90571_0.txt
friends at the Mills cotton factory.,90571_0.txt
"They decided to"" regulate"" Saxon, and",90571_0.txt
a mob came to the Green house that,90571_0.txt
"night, overpowered Saxon and' took him",90571_0.txt
"to the woods, the intention being to",90571_0.txt
give him a whipping and run him out,90571_0.txt
of town Later in the night one of,90571_0.txt
"the regulators, Thomas S. Wilson, was",90571_0.txt
brought home shot through the body.,90571_0.txt
"He lived thirty- six hours, but although",90571_0.txt
able to talk would make no statement,90571_0.txt
even to his family. His friends were also,90571_0.txt
reticent.,90571_0.txt
This reticence has been explained by,90571_0.txt
the discovery of the dead body of Sax-,90571_0.txt
on where it had been buried in the,90571_0.txt
woods. The man had been riddled with,90571_0.txt
"bullets. It is supposed that Saxon, unknown",90571_0.txt
"' to the crowd, had a pistol, that",90571_0.txt
"he used it before being whipped, and",90571_0.txt
was himself shot dead. The coroner is,90571_0.txt
making investigations and a number of,90571_0.txt
arrests will made.,90571_0.txt
HAVANA CITY be BUSINESS HELD UP,90571_0.txt
DOUBLE NEGRO LYNCHING.,90571_1.txt
Man Who Protected Girl's Assailant,90571_1.txt
Shot and Guilty Man Hanged.,90571_1.txt
"New Orleans, Feb. 28.- Betal, the ne-",90571_1.txt
gro who committed a criminal assault,90571_1.txt
"on Miss Miller at Fenton, in Calcasieu",90571_1.txt
"parish, was lynched by a mob today.",90571_1.txt
He was attacked yesterday by Esteve,90571_1.txt
"Miller, the father of the girl, who shot",90571_1.txt
him in the thigh. The wounded man,90571_1.txt
took refuge in the house of a,90571_1.txt
negro,90571_1.txt
named Sol Thebodeaux. When the assault,90571_1.txt
on the girl became known a mob,90571_1.txt
formed in the neighborhood and started,90571_1.txt
out to lynch Betal. Sol Thebodeaux attempted,90571_1.txt
to defend his friend and was,90571_1.txt
shot to death by the mob. They broke,90571_1.txt
into the house where Betal was found,90571_1.txt
seriously wounded. He was taken,90571_1.txt
the bed and hanged to the nearest from tree.,90571_1.txt
LYNCH MEXICANS,90572_0.txt
FOR MURDER,90572_0.txt
( Continued HELD from Page One),90572_0.txt
tonight they lie on slabs in the morgue,90572_0.txt
by the side of the body of Patrolman,90572_0.txt
"Jeff Evans, their victim.",90572_0.txt
Disapprove Prison Farm.,90572_0.txt
The news of the lynching spread,90572_0.txt
"rapidly, and despite the heavy rain",90572_0.txt
that was falling a large crowd went to,90572_0.txt
the bridge to view the bodies of the,90572_0.txt
two Mexicans before they were taken,90572_0.txt
down by is said that,90572_0.txt
the coroner It,90572_0.txt
.,90572_0.txt
some one on the bridge made the re-,90572_0.txt
"mark that"" Governor Shoup would not",90572_0.txt
send those two men to the Avondale,90572_0.txt
"prison farm.""",90572_0.txt
This was taken to indicate that a,90572_0.txt
large portion of the mob was made up,90572_0.txt
"of farmers from the Avondale district,",90572_0.txt
"19 miles east of Pueblo, where the",90572_0.txt
prison farm is located. Con-,90572_0.txt
state,90572_0.txt
siderable has been at-,90572_0.txt
controversy,90572_0.txt
tached to the location of this farm at,90572_0.txt
Avondale and efforts have been made,90572_0.txt
by citizens of Pueblo county to have,90572_0.txt
the farm removed. They declare it is,90572_0.txt
a menace to have convicts released,90572_0.txt
there for work on the farm without,90572_0.txt
adequate guards.,90572_0.txt
"Also, the murdered policeman once",90572_0.txt
resided on a farm in the Avondale district,90572_0.txt
and had a large number of friends,90572_0.txt
among the farmers of that region.,90572_0.txt
"On July 23, Governor Shoup commuted",90572_0.txt
the sentence of Clifford,90572_0.txt
"Sproules, sentenced from this county",90572_0.txt
to death for the murder of W. W.,90572_0.txt
"Green, a turnkey at the county jail.",90572_0.txt
This has aroused the sentiment of the,90572_0.txt
citizens of Pueblo county against such,90572_0.txt
commutation of sentences and since,90572_0.txt
there have been ten murders in this,90572_0.txt
city and county since the commutation,90572_0.txt
"of Sproul's sentence, there have been",90572_0.txt
numerous reports that some day the,90572_0.txt
citizens of this county would take the,90572_0.txt
law in their own hands and punish,90572_0.txt
persons guilty of murder.,90572_0.txt
As to the citizenship of the two,90572_0.txt
"Mexicans, little is known here. But it",90572_0.txt
is said that they frequently have made,90572_0.txt
boast that they were citizens of,90572_0.txt
"the Mexico, and soldiers in Villa's army.",90572_0.txt
Will Punish Mob Leaders,90572_1.txt
"COLORADO SPRINGS, Colo., Sept.",90572_1.txt
13.- Whatever power the governor has,90572_1.txt
to apprehend the punish the leaders of,90572_1.txt
the mob which lynched the alleged,90572_1.txt
slayers of Patrolman Evans at Pueblo,90572_1.txt
"tonight will be used to the limit, Governor",90572_1.txt
Shoup said here tonight. The,90572_1.txt
Associated Press story gave him first,90572_1.txt
news of the lynching and he expressed,90572_1.txt
the deepest indignation at the outrage.,90572_1.txt
""" Such action as this cannot but be",90572_1.txt
"deplored"" he said."" I hesitate to say",90572_1.txt
what action I shall take until I can,90572_1.txt
confer with the attorney general to determine,90572_1.txt
"my powers, but you can say",90572_1.txt
that I will use all the powers at my,90572_1.txt
command to run down the mob leaders,90572_1.txt
and to see that they are adequately,90572_1.txt
punished. In times fo unrest such as,90572_1.txt
"these through which we are passing,",90572_1.txt
outbreaks such as this at Pueblo can,90572_1.txt
only serve to undermine public respec,90572_1.txt
for the orderly processes of law and endanger,90572_1.txt
the peace and safety of the,90572_1.txt
nation. They must not be permitted to,90572_1.txt
"pass unpunished.""",90572_1.txt
The governor is preparing for a trip,90572_1.txt
to western Colorado but may be forced,90572_1.txt
to delay his trip to meet this,90572_1.txt
gency. emer-,90572_1.txt
NEGRO LYNCHED BY,90573_0.txt
AQUEDUCT LABORERS,90573_0.txt
Colored Man Said to Have,90573_0.txt
Assaulted 6- Year- Old,90573_0.txt
Child of Homesteader,90573_0.txt
"BAKERSFIELD, Calif., Sept. 20.-",90573_0.txt
The lynching of a negro on the desert,90573_0.txt
