value,filename
"murder of Richardson, condemning mob",89132_0.txt
spirit and promising loyalty to the governor,89132_0.txt
were passed by unanimous vote. Ringing,89132_0.txt
speeches were made by Judge J. A.,89132_0.txt
"Billbro, A. E. Goodhue, W. J. Boykin and",89132_0.txt
others.,89132_0.txt
When the committee presented resolutions,89132_0.txt
"the committee chairman. O. R. Hood,",89132_0.txt
"moved their adoption, and made a short",89132_0.txt
talk along the line of the sentiment they,89132_0.txt
"expressed. The last two paragraphs, however",89132_0.txt
", were not in the original draft, and",89132_0.txt
were submitted as amendments by Judge,89132_0.txt
Billbro and accepted and adopted. It was,89132_0.txt
stated and generally understood that the,89132_0.txt
resolutions as to loyalty to the governor,89132_0.txt
had no reference as to his action in the,89132_0.txt
Johnson case since the bar itself differed,89132_0.txt
"on that point, and more particularly because",89132_0.txt
that was not part of the business,89132_0.txt
"of the meeting, nor did it properly enter",89132_0.txt
"into the proceedings of the meeting, according",89132_0.txt
to expressions of the speakers.,89132_0.txt
Members of Bar Indignant.,89132_0.txt
"Members of the Gadsden bar, especially",89132_0.txt
"those who were heard, were indignant",89132_0.txt
that the county should have been outraged,89132_0.txt
"by the murder of Richardson, and there",89132_0.txt
finally crept in a criticism of officers who,89132_0.txt
surrendered to the mob. Mr. Goodhue was,89132_0.txt
frank and open in the statement that he,89132_0.txt
desired to press an investigation as to,89132_0.txt
"whether the sheriff, police or any officer",89132_0.txt
was remiss in his duty. He said that it,89132_0.txt
should be known what the sheriff did from,89132_0.txt
the time of the assault on the jail up to,89132_0.txt
the next morning at 7 o'clock. It should be,89132_0.txt
"brought out, he said, why the sheriff did",89132_0.txt
"not give the alarm, ring the fire bell or",89132_0.txt
something of the sort. The same applied,89132_0.txt
to policemen who did not give the alarm,89132_0.txt
so that the lynchers might be either prevented,89132_0.txt
from committing the crime or else,89132_0.txt
be detected and identified. Mr. Goodhue,89132_0.txt
said that he wished the sheriff had been,89132_0.txt
"present to note his assertion, that the",89132_0.txt
sheriff and his deputies ought not to speak,89132_0.txt
of the lynching in a light manner and,89132_0.txt
"should feel that they, too, had been outraged",89132_0.txt
.,89132_0.txt
Fed by Agitators.,89132_0.txt
Judge Billbro stated that the mob spirit,89132_0.txt
"existed; that it was fed by agitators, and",89132_0.txt
that everyone who added fuel to the,89132_0.txt
flame was guilty as an accomplice in the,89132_0.txt
lynching of Bunk Richardson. He did not,89132_0.txt
charge or even intimate that an officer,89132_0.txt
"had been derelict in his duty, but he said",89132_0.txt
the law required the sheriff to protect,89132_0.txt
prisoners even up to the point of giving,89132_0.txt
his own life to do so.,89132_0.txt
Boykin Explains Attitude.,89132_0.txt
Mr. Boykin explained and justified his,89132_0.txt
connection with the Johnson se. He,89132_0.txt
said that it had been brought to him,89132_0.txt
that statements had been made that,89132_0.txt
some negro organizations had sent in,89132_0.txt
money and paid him to take the stand,89132_0.txt
he did. This he indignantly denied and,89132_0.txt
explained that he saw Johnson only once,89132_0.txt
and never spoke to him or had any communication,89132_0.txt
with him at any time. The,89132_0.txt
Rev. J. W. Newman' and the Rev. H. C.,89132_0.txt
Kegley were called upon and approved,89132_0.txt
of the sentiment of the meeting as did,89132_0.txt
"Mayor Smith. E. W. Whipps, president",89132_0.txt
"of the Commercial club, was called upon",89132_0.txt
to convene that body at once to take action,89132_0.txt
"on the lynching, and agreed to",89132_0.txt
do so.,89132_0.txt
There can be no question that the people,89132_0.txt
of Gadsden are stirred up over this,89132_0.txt
matter. They are determined to have the,89132_0.txt
outside world understand the true sentiment,89132_0.txt
of the community and it was particularly,89132_0.txt
stated that the unalterable determination,89132_0.txt
of the Gadsden bar to uphold,89132_0.txt
the law should be understood in,89132_0.txt
Etowah county itself. The meeting of the,89132_0.txt
bar association was the initiative movement,89132_0.txt
of the civic and judicial bodies of,89132_0.txt
the city and county in this matter which,89132_0.txt
will be followed by severe denunciations,89132_0.txt
through the whole of the Gadsden district,89132_0.txt
.,89132_0.txt
The resolutions adopted today as,89132_0.txt
follows: are,89132_0.txt
Resolutions Are Supported.,89132_0.txt
""" Whereas, early Sunday morning a mob",89132_0.txt
said to be composed of twenty- five or,89132_0.txt
"thirty persons, took from the jail of this",89132_0.txt
"county a negro, named Bunk Richardson,",89132_0.txt
"and lynched him, and",89132_0.txt
""" Whereas, the matter of whether or not",89132_0.txt
he had committeed or had any connection,89132_0.txt
with the commission of the murder of,89132_0.txt
Mrs. Sarah Jane Smith had been investigated,89132_0.txt
"by the grand jury of the county,",89132_0.txt
which body failed to find evidence to the,89132_0.txt
effect that he had committed the crime.,89132_0.txt
failing to prefer an indictment against,89132_0.txt
"him, and",89132_0.txt
""" Whereas, he was being held in jail to",89132_0.txt
await the action of any future grand,89132_0.txt
"jury on any newly discovered testimony,",89132_0.txt
and,89132_0.txt
""" Whereas, the state of Alabama has a",89132_0.txt
"full, complet and adequate code of laws",89132_0.txt
for speedy and fair trial and an adequate,89132_0.txt
punishment of criminals committing the,89132_0.txt
"crime of murder, and",89132_0.txt
""" Whereas, these laws have been wholly",89132_0.txt
ignored and trampled into the dust by this,89132_0.txt
mob in the lynching of this man without,89132_0.txt
"a trial, and",89132_0.txt
""" Whereas, the lynching of a person by",89132_0.txt
a mob is nothing less than murder in its,89132_0.txt
"violent form, and is destructive of all",89132_0.txt
law and order as well as of the great,89132_0.txt
"teachings and principles of Christianity,",89132_0.txt
"now. therefore, be it",89132_0.txt
""" Resolved, By the Etowah Bar associa-",89132_0.txt
tion. that the lynching of Bunk Rich-,89132_0.txt
ardson is greatly deplored and should be,89132_0.txt
condemned by all law- abiding citizens of,89132_0.txt
the county; that the murder of this man,89132_0.txt
"be, and is, hereby condemned in unmeasured",89132_0.txt
terms; that all law- abiding citizens,89132_0.txt
are urged to co- operate with this,89132_0.txt
bar association in quenching at once,89132_0.txt
this unlawful and awful spirit of taking,89132_0.txt
the life of a human being without a trial,89132_0.txt
under the forms of law; be it further,89132_0.txt
""" Resolved, That we call upon the min-",89132_0.txt
and all Christian people in this,89132_0.txt
county to make use of every opportunity,89132_0.txt
to preach and instill into the minds of the,89132_0.txt
people a law- abiding spirit.,89132_0.txt
"Resolved, That it is the sense of this",89132_0.txt
"bar"" association that our courts, state and",89132_0.txt
municipal. should use all lawful means,89132_0.txt
to determine whether any officer was remiss,89132_0.txt
in duty in trying to avert the lynch-,89132_0.txt
ing of said prisoner.,89132_0.txt
""" Resolved, That we assure our governor",89132_0.txt
of our unwavering loyalty to him in his,89132_0.txt
efforts to perform the high duties of his,89132_0.txt
office accordingly as his conscience may,89132_0.txt
approve and determine.,89132_0.txt
""" O. R. HOOD,",89132_0.txt
""" CATO D. GLOVER,",89132_0.txt
""" W. R. DORTCH,",89132_0.txt
""" H. T. DAVIS.",89132_0.txt
AIKEN.,89132_0.txt
""" JAMES""",89132_0.txt
MOBILE MOB TRIES,89133_0.txt
TO LYNCH NEGRO,89133_0.txt
JAIL YARD IS ENTERED AND VOLLEY,89133_0.txt
IS FIRED BUT MEN FIND,89133_0.txt
THE PRISONER IS NOT IN,89133_0.txt
JAIL.,89133_0.txt
"Mobile, August 29.- Between 10 and 11",89133_0.txt
o'clock tonight a mob of about 500 persons,89133_0.txt
attempted to lynch William Thomp-,89133_0.txt
"son, colored, confessed assailant of",89133_0.txt
two little white girls and one little negro,89133_0.txt
girl. The mob broke into the jail yard,89133_0.txt
through the big wooden gate and filled the,89133_0.txt
"yard, the sheriff's deputies meeting them",89133_0.txt
"at the door armed with Winchesters,",89133_0.txt
"which they discharged, with ink cartridges",89133_0.txt
"over the heads of the mob, no one",89133_0.txt
being hurt.,89133_0.txt
A committee of the mob then admitted,89133_0.txt
to the jail with the assurance being given,89133_0.txt
that the negro was not there. The mob,89133_0.txt
then dispersed.,89133_0.txt
"Will Thompson, the negro whom the",89133_0.txt
"mob sought to lynch tonight, was taken",89133_0.txt
out of jail ten minutes before the mob,89133_0.txt
arrived and put on a train for,89133_0.txt
ham. Birming-,89133_0.txt
"Montgomery, September 17 .--( Special.)-",89134_0.txt
Governor Jelks said this afternoon that,89134_0.txt
neither the citizens nor the officiers of,89134_0.txt
Gadsden had called upon him for aid in,89134_0.txt
the attempt to indict members of the,89134_0.txt
"mob which lynched Bunk Richardson, a",89134_0.txt
"negro, there some months ago. He further",89134_0.txt
said that if aid was required he,89134_0.txt
"would grant it in every way possible,",89134_0.txt
"though of course, he would not go there.",89134_0.txt
That was the business of the courts.,89134_0.txt
It will be remembered that just after,89134_0.txt
the lynching the governor sent George,89134_0.txt
"Bodeker, a detective of Birmingham, to",89134_0.txt
"Gadsden and the latter made a report,",89134_0.txt
which was furnished the officers of the,89134_0.txt
county. The governor said that he understood,89134_0.txt
that the grand jury now in session,89134_0.txt
"is a very strong one, and he hopes",89134_0.txt
"that it will indict the"" murderers"" of",89134_0.txt
Richardson and bring them to justice.,89134_0.txt
"Some believe, the governor points out,",89134_0.txt
that the offenders in this connection are,89134_0.txt
known to the people of Gadsden.,89134_0.txt
This case is one in which the governor,89134_0.txt
The,89134_0.txt
has taken the greatest interest.,89134_0.txt
lynching followed closely after the commutation,89134_0.txt
of one of the alleged assaulters,89134_0.txt
"of Mrs. Jane Smith, a white woman murdered",89134_0.txt
"near Gadsden, and is supposed to",89134_0.txt
have been revenge for such executive,89134_0.txt
clemency. in,89134_0.txt
GOVERNOR JELKS,89134_0.txt
WILL GRANT AID,89134_0.txt
Conviction of the Gads-,89134_0.txt
Desires den Lynchers,89134_0.txt
"Gadsden, September 17 .-( Special.)- In",89134_1.txt
the opening session of the Gadsden city,89134_1.txt
"court this morning, Judge J. H. Disque",89134_1.txt
"the presiding judge, ordered the grand",89134_1.txt
jury to make a rigid investigation of,89134_1.txt
the Bunk Richardson lynching which took,89134_1.txt
place on February 11 of this year. He,89134_1.txt
urged them to use every means in their,89134_1.txt
power to bring the guilty to justice. The,89134_1.txt
first grand jury that investigated the,89134_1.txt
"case, reported that"""" They had exhausted",89134_1.txt
every means in their power to find the,89134_1.txt
"guilty parties, but that they could not",89134_1.txt
find one scintilla of evidence upon which,89134_1.txt
"they could indict."" The same jury were",89134_1.txt
recalled later to investigate homicides,89134_1.txt
but were not ordered to make another investigation,89134_1.txt
of the lynching. The present,89134_1.txt
grand jury is composed of some of the,89134_1.txt
"best citizens of the county, the foreman",89134_1.txt
being Thomas Ewing of the Ewing Hard-,89134_1.txt
"company of this city, and is a gen-",89134_1.txt
ware tleman of the highest integrity.,89134_1.txt
JUDGE J. H. DISQUE,89134_1.txt
CHARGES THE JURY,89134_1.txt
Investigation of Bunk,89134_1.txt
Wants Richardson Lynching,89134_1.txt
The September term of the city court of,89134_1.txt
Gadsden convened this morning at 10,89134_1.txt
o'clock. After the usual formalities Judge,89134_1.txt
"Disque delivered an able and comprehen,",89134_1.txt
"sive charge, as to what duties and obligations",89134_1.txt
devolved upon the grand jury. He,89134_1.txt
first admonished them as to the sacredness,89134_1.txt
of the oath they had taken. Particular,89134_1.txt
"stress was laid upon crime, murder",89134_1.txt
in particular. He said that he believed,89134_1.txt
that the failure to bring the perpetrators,89134_1.txt
of lynching to justice was the,89134_1.txt
"cause of so much crime in this county,",89134_1.txt
as it had the tendency on the part of the,89134_1.txt
individual to take the law in his own,89134_1.txt
hands He said that it was his intention,89134_1.txt
.,89134_1.txt
to instruct each succeeding grand jury,89134_1.txt
to investigate this lynching until the,89134_1.txt
guilty parties are apprehended. He called,89134_1.txt
attention to gambling and asked that,89134_1.txt
this too be thoroughly investigated. Attention,89134_1.txt
was called to the recent primary,89134_1.txt
election and asked that it be reported,89134_1.txt
"upon as it was conducted or should be,",89134_1.txt
on as strict a line as the regular election,89134_1.txt
since the legislature had enacted,89134_1.txt
laws governing it. They were charged as,89134_1.txt
"to perjury, and were warned of the pernicious",89134_1.txt
effects of the practice and the,89134_1.txt
great danger of its effects. The entire,89134_1.txt
charge was replete with sound patriotic,89134_1.txt
sentiment which sought to awaken in,89134_1.txt
jurymen a full conception of the,89134_1.txt
the dignity of their office.,89134_1.txt
Telegraph Pole and Riddles Remains,89135_0.txt
Mob in Arkansas Hangs Negro to,89135_0.txt
Had Been Placed in Argenta,89135_0.txt
Jail Charged With Firing,89135_0.txt
from Ambush,89135_0.txt
MOB WORKS QUIETLY AND,89135_0.txt
OFFICERS COME TOO LATE,89135_0.txt
Lynched Man Was Not Only Charged,89135_0.txt
"With Shooting, but With MakIng",89135_0.txt
Inflammatory Speeches,89135_0.txt
to the Negroes.,89135_0.txt
"Argenta, Ark., October 7- As a sequel",89135_0.txt
to the killing of John Lindsay and wound-,89135_0.txt
Milton Lind-,89135_0.txt
ing of his son Policeman,89135_0.txt
",",89135_0.txt
"say, here last night, presumably by Gar-",89135_0.txt
"rett Column and Charles Column, ne-",89135_0.txt
"groes, H. Blackburn, a negro, was lynched",89135_0.txt
tonight at 10 o'clock at the corner of,89135_0.txt
Sixth and Main streets. The trouble orig-,89135_0.txt
when a white,89135_0.txt
September 12,89135_0.txt
inated on,89135_0.txt
man named R. R. McDonald killed a negro,89135_0.txt
musician named Wiley Shelby.,89135_0.txt
Next day at the inquest held at the,89135_0.txt
"Column's undertaking store, a difficulty",89135_0.txt
"arose, in which Robert Column was killed",89135_0.txt
and Deputy Constable Ed Lindsay and,89135_0.txt
"Garrett Column severely wounded, the",89135_0.txt
latter emerging from the hospital only,89135_0.txt
"yesterday. Policeman Milton Lindsay, a",89135_0.txt
"brother of Ed Lindsay, was also hurt at",89135_0.txt
that time.,89135_0.txt
Fired Upon From Ambush.,89135_0.txt
Last night Policeman Milton Lindsay,89135_0.txt
and his father were walking past the,89135_0.txt
"Column store, when they were fired on",89135_0.txt
from ambush. John Lindsay was killed on,89135_0.txt
the spot. His son was severely wounded,89135_0.txt
but managed to crawl out of range. When,89135_0.txt
the police and citizens attempted to enter,89135_0.txt
the store they were fired on. It is supposed,89135_0.txt
Charles and Garrett Column did the,89135_0.txt
"shooting. Later in the night, thinking the",89135_0.txt
Column brothers were still locked in the,89135_0.txt
"rear rooms of the store, the place was",89135_0.txt
"dynamited, but the negroes had escaped",89135_0.txt
unseen in the darkness in the early part,89135_0.txt
of the trouble. They were still at large.,89135_0.txt
At 1:30 o'clock this mornng Will Hard-,89135_0.txt
"ing, a painter, was halted on the street",89135_0.txt
"by unknown parties, whether black or",89135_0.txt
white he could not tell in the darkness.,89135_0.txt
He was asked if he was black or white.,89135_0.txt
"On replying that he was white, he was",89135_0.txt
"to go back, and while leaving he",89135_0.txt
told was shot in the back.,89135_0.txt
Two thers Fired Upon.,89135_0.txt
"At 2 o'clock James Mahoney, a contractor",89135_0.txt
", and Al Belding, a reporter of the",89135_0.txt
"Little Rock Gazette, while going to see",89135_0.txt
"Harding, discovered that a house was on",89135_0.txt
fire. Mahoney fired his pistol in the air,89135_0.txt
"to give the alarm, and immediately the",89135_0.txt
two men were fired upon from four different,89135_0.txt
quarters with shotguns. Mahoney,89135_0.txt
was painfully wounded in the hand. Beld-,89135_0.txt
ing's clothes were peppered with bird shot,89135_0.txt
but none entered his body. That ended the,89135_0.txt
"developments for the night, and it was",89135_0.txt
hoped and believed no further outbreak,89135_0.txt
would occur.,89135_0.txt
"At noon today, H. Blackburn, 37 years",89135_0.txt
"of age, a negro, who conducts a confectionery",89135_0.txt
"store in Argenta, was arrested on",89135_0.txt
suspicion of being the man who fired on,89135_0.txt
Mahoney and Belding. No trouble was an-,89135_0.txt
"ticpated, the town being quiet all day,",89135_0.txt
but as a precaution Mayor Faucette and,89135_0.txt
Sheriff Kavanaugh swore in fifteen extra,89135_0.txt
policemen and the sheriff sent several,89135_0.txt
extra deputies to assist the police.,89135_0.txt
Lynching Quick and Businesslike.,89135_0.txt
The lynching tonight was quietly put,89135_0.txt
through in a business- like way. Shortly,89135_0.txt
before 10 o'clock four masked men entered,89135_0.txt
the police station from the rear and,89135_0.txt
"one covered the turnkey with a pistol,",89135_0.txt
"while the other got his keys, quickly unlocked",89135_0.txt
Blackburn's cell and took him out,89135_0.txt
the back way. Not a shot was fired and,89135_0.txt
"there was no loud talking, so that Policeman",89135_0.txt
"Pratt, Sheriff Kavanaugh and two.",89135_0.txt
"deputies who were standing on the street,",89135_0.txt
a few blocks away knew nothing of what,89135_0.txt
was going on until they heard several,89135_0.txt
shots fired at Main and Sixth streets. Running,89135_0.txt
there they found Blackburn already,89135_0.txt
"dead, hangled to a telegraph pole, while",89135_0.txt
the crowd around were apparently merely,89135_0.txt
onlookers. Those who had already un-,89135_0.txt
"masked had mingled with the crowd, so",89135_0.txt
that identification was impossible.,89135_0.txt
As Blackburn was being taken from,89135_0.txt
the jail he kept exclaiming:,89135_0.txt
""" Oh, Lordy!""",89135_0.txt
Put Out of Misery by Shots.,89135_0.txt
And he uttered no other word at any,89135_0.txt
time. He kept repeating the words as he,89135_0.txt
"was marched down the street, and while",89135_0.txt
"the rope was being adjusted, and again",89135_0.txt
as he was drawn up. He was strangling,89135_0.txt
to death slowly when he was put out of,89135_0.txt
his misery by several pistol bullets fired,89135_0.txt
from the crowd.,89135_0.txt
When first arrested Blackburn said he,89135_0.txt
only arrived from Lake Village Satur-,89135_0.txt
day night after the shooting. There was,89135_0.txt
"positive evidence, however, that after",89135_0.txt
the Lindsay's were first fired on Black-,89135_0.txt
burn ran out of a negro house adjoining,89135_0.txt
and fired at John Lindsay. Also that,89135_0.txt
later delivered inflammatory speeches,89135_0.txt
to crowds he of negroes at several points.,89135_0.txt
Mobile is Quiet.,89135_1.txt
"Mobile, October 7.- The fears that were",89135_1.txt
entertained yesterday in regard to the,89135_1.txt
negroes retaliating for the lynching of,89135_1.txt
"Thompson and Robinson, charged with",89135_1.txt
"assault, has disappeared, and the city is",89135_1.txt
quiet tonight as if nothing out of the,89135_1.txt
as ordinary had occurred.,89135_1.txt
Negroes Flee From Town.,89135_2.txt
"Kansas City, Mo., October 7.- A specia!",89135_2.txt
to the Journal from Little Rock says:,89135_2.txt
"Blackburn, the negro taken from the",89135_2.txt
jail by a mob at Argenta tonight and,89135_2.txt
"lynched, is not believed to have been the",89135_2.txt
wanted.,89135_2.txt
man,89135_2.txt
The free bridge between this city and,89135_2.txt
Argenta was covered with negroes tonight,89135_2.txt
. Fully 800 deserted their homes in,89135_2.txt
that city and came to Little Rock to spend,89135_2.txt
the night.,89135_2.txt
The leaders stated that they were afraid,89135_2.txt
remain in Argenta after dark for fear,89135_2.txt
to of another outbreak by the whites.,89135_2.txt
AFTER NEGRO MURDERER,89135_3.txt
NORTH CAROLINA POSSE,89135_3.txt
"Charlotte, N. C., October 7.- Supt. R. H.",89135_3.txt
"Eubanks of Lane Bros. Co.& Jones, contractors",89135_3.txt
on the double tracking of the,89135_3.txt
"Southern railway, was shot and instantly",89135_3.txt
"killed by Oscar Gaddy, a negro, at the",89135_3.txt
railway camps near Lexington. The deed,89135_3.txt
was committed without provocation. Eu-,89135_3.txt
banks had gone to the camp to quiet,89135_3.txt
"negroes, who were raising a disturbance the,",89135_3.txt
many of them being under the influence of,89135_3.txt
whisky. Gaddy escaped. A posse of armed,89135_3.txt
"men numbering two hundred, with",89135_3.txt
"blood hounds, are scouring the country",89135_3.txt
"for him, and if caught he will probably",89135_3.txt
be lynched.,89135_3.txt
A similar tragedy occurred in this vicinity,89135_3.txt
recently when Foreman Beacham was,89135_3.txt
"shot and killed by a negro, who is",89135_3.txt
sentence to hang this month. under,89135_3.txt
HIS MAN SAFELY IN JAIL,89135_4.txt
INDIANA SHERIFF GETS,89135_4.txt
"Bloomington, Ind., October 7.- The negro",89135_4.txt
", Edward Jones, who last night shot",89135_4.txt
"and killed Alfred Stephens, a lunch wagon",89135_4.txt
"man, was safely taken to the Jefferson-",89135_4.txt
ville penitentiary early today.,89135_4.txt
"The crowd, which for a time last night,",89135_4.txt
threatened to take Jones from the officers,89135_4.txt
"and lynch him, was again in evidence",89135_4.txt
"about 3 o'clock this morning, and it was",89135_4.txt
by the determined efforts of the sher-,89135_4.txt
only iff and his deputies that the excited men,89135_4.txt
| surrounding the jail were kept from battering,89135_4.txt
"the door down, and entering the",89135_4.txt
place. A committee of three was selected,89135_4.txt
and made a thorough search of the jail,89135_4.txt
and reported to the crowd that Jones was,89135_4.txt
not within.,89135_4.txt
The report of this committee falled to,89135_4.txt
satisfy the demands of the crowd outside,89135_4.txt
and it was only after another committee,89135_4.txt
WASHINGTON,89135_4.txt
Library,89135_4.txt
made the rounds e jail and again,89135_4.txt
reported their sea ithout avail,89135_4.txt
the throng be qu would,89135_4.txt
WHITE VICTIM DIES,89135_5.txt
NEGRO IS IN JAIL,89135_5.txt
CIRCUS IN SOUTH CAROLINA HAS,89135_5.txt
"AROUSED MUCH FEELING, AND",89135_5.txt
MAY NOT BE ALLOWED TO EXHIBIT,89135_5.txt
.,89135_5.txt
"Columbia, S., C., October 7.-J. E. Gail-",89135_5.txt
"lard, one of the white men shot by Henry",89135_5.txt
"Adams, allas Sam Small, at Mining Fri-",89135_5.txt
"day evening, died from his njuries today",89135_5.txt
. Adams was an employe of Colum,89135_5.txt
Bros.' circus and became involved in a,89135_5.txt
difficulty just as the train was departing,89135_5.txt
for Sumter. At Sumter a mob was formed,89135_5.txt
"for the purpose of lynching, the negro,",89135_5.txt
but Sheriff Muldrow evaded the mob by,89135_5.txt
taking the prisoner from the train and,89135_5.txt
driving across the country to a station on,89135_5.txt
"the Seaboard Air Lne, where he boarded",89135_5.txt
the train for Columbia. Adams was placed,89135_5.txt
in the penitentiary this morning for safe,89135_5.txt
keeping.,89135_5.txt
Other members of the circus who were,89135_5.txt
arrested as witnesses are being held at,89135_5.txt
Bishopville.,89135_5.txt
The circus is scheduled to show at Sum-,89135_5.txt
"ter on Wednesday, but fearng trouble, an",89135_5.txt
effort is being made to have the license,89135_5.txt
revoked and prevent the circus from appearing,89135_5.txt
in that city. Threats have been,89135_5.txt
made that would be trouble should,89135_5.txt
the show go there to Sumter.,89135_5.txt
WASHINGTON of,89135_6.txt
MACON AIN QUIET,89135_6.txt
D Congress,89135_6.txt
AFTER CITING DAY,89135_6.txt
NEGRO WHO CAUSED TROUBLE,89135_6.txt
AT STREET FAIR HAS BEEN,89135_6.txt
RUSHED TO ATLANTA JAIL FOR,89135_6.txt
SAFE KEEPING.,89135_6.txt
"Macon, Ga., October 7.- Quiet reigns in",89135_6.txt
"this city tonight, and no further trouble",89135_6.txt
is anticpated. The negro who shot Adams,89135_6.txt
and Solomon last night was sent to At-,89135_6.txt
lanta this afternoon for safe keeping.,89135_6.txt
The miltary is held in readiness in case,89135_6.txt
of emergency.,89135_6.txt
The mob succeeded in breaking into the,89135_6.txt
"jail at a late hour last night, but the",89135_6.txt
negro had been placed in the barracks,89135_6.txt
under heavy miltary guard.,89135_6.txt
Two white men charged with murder escaped,89135_6.txt
"during the excitement, but were",89135_6.txt
captured today. Adams and Solomon are,89135_6.txt
in the hospital. Physicians cannot determine,89135_6.txt
