value,filename
and devote all her time to a series of here today by a mob who was took him,88892_0.txt
to confessed,88892_0.txt
".,",88892_0.txt
Lynched. Negro,88893_0.txt
[ United Press Leased Wire Service],88893_0.txt
"SHAWNEE, Okla., Aug. 6.- After, it",88893_0.txt
"is said, he had confessed to killing",88893_0.txt
two women and attacking many othe,88893_0.txt
"ers, Ed Berry, a negro, was lynche'l",88893_0.txt
here today by a mob who took,88893_0.txt
away from officers. him,88893_0.txt
of one of his crimes.,88893_0.txt
The lynching occurred at the scene,88893_0.txt
LYNCHED BY MOB,88894_0.txt
FIVE NEGROES,88894_0.txt
[ United Press Leased Wire Service.],88894_0.txt
"SYLVESTER, Ga., Jan. 21. Five",88894_0.txt
negroes taken from the Worth county,88894_0.txt
"jail by a mob last night were lynched,",88894_0.txt
the,88894_0.txt
according to reports reaching,88894_0.txt
The ne-,88894_0.txt
sheriff's office here today,88894_0.txt
groes were strung up to a. tree.,88894_0.txt
Sheriff Potts started in pursuit of,88894_0.txt
the mob soon after the negroes were,88894_0.txt
"taken from the jail, but was unable",88894_0.txt
to trail them. The jail entry was,88894_0.txt
carefully planned. A negro bound,88894_0.txt
with ropes was brought to the jail as,88894_0.txt
"a decoy, the mob leaders saying they",88894_0.txt
feared he would be lynched. When,88894_0.txt
"the sheriff admitted the party, he was",88894_0.txt
overpowered and his keys taken. The,88894_0.txt
negroes seized were implicated in the,88894_0.txt
murder of Sheriff Moreland of Lee,88894_0.txt
"county, having been brought here for",88894_0.txt
safe keeping. The mob is to,88894_0.txt
have been from Lee county believed.,88894_0.txt
MOB SPIRIT UNIVERSAL.,88895_0.txt
An Ohio mob started to hang a sheriff for re-,88895_0.txt
disclose the hidden place of confine,88895_0.txt
",",88895_0.txt
fusing to,88895_0.txt
ment of a negro wanted for lynching purposes.,88895_0.txt
No better example could be asked of the great,88895_0.txt
truth that all blood looks equally acceptable to,88895_0.txt
bent murder. If these,88895_0.txt
mob collective,88895_0.txt
a on,88895_0.txt
"estimable citizens of Ohio, the native state of",88895_0.txt
"six presidents, the home of a culture, industry",88895_0.txt
and respectability second only to those of the,88895_0.txt
"original thirteen states, could let loose to the",88895_0.txt
extent of all but murdering an officer of their,88895_0.txt
the,88895_0.txt
own election in duty he was sworn to perform,88895_0.txt
", what is to be said of the spirit of lynching",88895_0.txt
mobs in more primitive of the,88895_0.txt
country? parts,88895_0.txt
The plain truth of the matter is that a crowd,88895_0.txt
can seldom resist the chance to commit an en-,88895_0.txt
joyable murder and acquire merit in its own,88895_0.txt
eyes thereby. The lyncher operating on a,88895_0.txt
southern negro or an Ohio sheriff is in exactly,88895_0.txt
"the same boat, one with the other.",88895_0.txt
The germs,88895_0.txt
of lynching are in Ohio as in Georgia,88895_0.txt
Florida or anywhere else. and,88895_0.txt
The explosive mixture in the human breast,88895_0.txt
Is that of blood lust with moral self- delusion.,88895_0.txt
The self- delusion is rarer in Ohio than in some,88895_0.txt
"places, yet even there a mob of ordinarily re-",88895_0.txt
spectable persons can persuade itself of its duty,88895_0.txt
to slack the red thirst that wells up in its,88895_0.txt
throat. It proves the menace of the,88895_0.txt
"brutal, degrading lynch doctrine. whole",88895_0.txt
Bissell had been rushed here from,88896_0.txt
"Lawrence for safe keeping, when a",88896_0.txt
Topeka mob motored there to,88896_0.txt
him. lynch,88896_0.txt
"Three hundred enraged citizens stormed the jail at midnight, attempting to lynch the",88897_0.txt
"prisoner, but were driven off after a sharp struggle with police.",88897_0.txt
have been unable to learn the motive for the slaying of Paul and Harris. Both,88897_0.txt
"men were Police wealthy, being associated in the organization of the Wyandotte Fruit company.",88897_0.txt
Two Negroes Lynched.,88898_0.txt
[ United Press Leased Wire Service.],88898_0.txt
"NOWATA, Okla., Sept. 30.- Nowata",88898_0.txt
was quiet this morning following the,88898_0.txt
"lynching last night of two negroes,",88898_0.txt
""" Sonny"" Powell and Mark Foreman,",88898_0.txt
who killed Sheriff James Gib-,88898_0.txt
son in a jail Deputy break.,88898_0.txt
expense of mob and lynched last Monday.,88899_0.txt
"nearly$ 63,000 The lynching of Frank an atroci",88899_0.txt
"total cost for ous crime, a shame and is disgrace.",88899_0.txt
What are courts of justice for if,88899_0.txt
they are to be thus violently set,88899_0.txt
aside by passionate mobs? The men,88899_0.txt
"who lynched Frank are murderers,",88899_0.txt
"both, in the eye of the law and of a",88899_0.txt
"healthy public opinion, and they",88899_0.txt
ought to be adequately punished for,88899_0.txt
their dastardly crime. It was a double,88899_0.txt
"crime, assassination and defiance",88899_0.txt
"of the law of the land. The same men,",88899_0.txt
"if subjected to robbery, murderous",88899_0.txt
assault or the invasion,88899_0.txt
of any of,88899_0.txt
their rights as citizens would appeal,88899_0.txt
to the courts for protection and redress,88899_0.txt
- the same machinery of justice,88899_0.txt
which they have flagrantly defiled,88899_0.txt
and condemned by their unlawful,88899_0.txt
in this case. act,88899_0.txt
LYNCHED. DASTARD A,88901_0.txt
"GILMAN, W. T., Jan. 9.- At daylight",88901_0.txt
"Monday morning Alfred Shafford, a Bohemian",88901_0.txt
"miner, crawled under the residence",88901_0.txt
"of George Bodayla, placed a keg of giant",88901_0.txt
"powder there, and fired the fuse. The explosion",88901_0.txt
"blew the house to atoms, killing",88901_0.txt
three persons and seriously wounded three,88901_0.txt
"others. Shafford was arrested, but was",88901_0.txt
taken from officers and lynched.,88901_0.txt
Last spring the Shafford assaulted Bodayla's,88901_0.txt
he was innocent. They were about to,88901_1.txt
"lynch him when officers arrived, rescued",88901_1.txt
"the prisoner, and locked him up. Sheriff",88901_1.txt
Cochrane was telegraphed for. He came,88901_1.txt
from Seattle and was just getting ready to,88901_1.txt
take Shafford away when an armed band,88901_1.txt
"of fifty miners closed in upon him,",88901_1.txt
"captured the prisoner, and strung him up",88901_1.txt
to a tree. He was left dangling there,88901_1.txt
til dead. un-,88901_1.txt
"She Poisoned Nine Persons and, Al-",88902_0.txt
None of Her Victims Will,88902_0.txt
"though Die, She Was Lynched.",88902_0.txt
The Widow of Another Victim of the,88902_1.txt
New Orleans Riot Sues for a Big Sum.,88902_1.txt
"NEW ORLEANS, March 15.- The tenth",88902_1.txt
damage suit by relatives of the Italians,88902_1.txt
"lynched in New Orleans has been filed,",88902_1.txt
"making a total of$ 270,000. The",88902_1.txt
widow of Politz brings the suit.,88902_1.txt
"Politz, it will be remembered,",88902_1.txt
was taken from the parish prison,88902_1.txt
and hanged. This suit differs from the,88902_1.txt
"other nine, as it makes Parkerson,",88902_1.txt
"Dengre, Baldwin, Houston, Railey,",88902_1.txt
"McLean, Couturie, Venables, Mather,",88902_1.txt
Walmsley and thirty other residents of,88902_1.txt
"New Orleans the defendants, and is",88902_1.txt
"also brought for$ 100,000 instead",88902_1.txt
"$ 30,000, as are the claims of the others of.",88902_1.txt
MURDER AND LYNCHING.,88902_2.txt
"SPRINGFIELD, Mo., March 15.- News",88902_2.txt
has just reached this city from For-,88902_2.txt
sythe of the lynching of John Wesley,88902_2.txt
"Bright, who was charged with murdering",88902_2.txt
his wife. Bright was being examined,88902_2.txt
when the mob demanded his,88902_2.txt
surrender. Deputy Sheriff Williams,88902_2.txt
refused to give him up and was shot,88902_2.txt
dead. The mob hanged Bright and escaped,88902_2.txt
. Forsythe is 25 miles from a,88902_2.txt
"railroad, and few particulars can",88902_2.txt
obtained. be,88902_2.txt
"DARLINGTON, Wis., March 15.- The",88902_3.txt
court ruled Saturday morning that the,88902_3.txt
special plea of insanity should be tried,88902_3.txt
before the main issue of not guilty,88902_3.txt
in the Sieboldt lynching,88902_3.txt
case.,88902_3.txt
H. C. then,88902_3.txt
Martin opened the,88902_3.txt
case for the defense. He spoke of,88902_3.txt
the great responsibility that rested,88902_3.txt
"upon the jury, and then went on and",88902_3.txt
told how insanity had been in the,88902_3.txt
Meighan family for generations. Tay-,88902_3.txt
"lor, he said, had for years been subject",88902_3.txt
to epileptic fits which had weakened,88902_3.txt
his mind. Smith had been drinking,88902_3.txt
for months and was in great fear of,88902_3.txt
"Sieboldt. Andrews, he explained,",88902_3.txt
was of a very excitable disposition and,88902_3.txt
had received a blow on the head when,88902_3.txt
a boy from which he had never recovered,88902_3.txt
. He then described the brutal,88902_3.txt
"way in which Meighan was murdered,",88902_3.txt
and the murderous and desperate,88902_3.txt
acter Sieboldt was. char,88902_3.txt
FIVE MEN LYNCHED.,88903_0.txt
"Father, Three Sons and a Companion",88903_0.txt
Hanged by a Mob.,88903_0.txt
"Bieber, Cal., June 1.- Incomplete details",88903_0.txt
have been received here of the,88903_0.txt
"lynching of five men at Lookout, Modoc",88903_0.txt
"county, early yesterday morning. The",88903_0.txt
"lynched men were Calvin Hall, aged 72",88903_0.txt
"years, his three half- breed sons, Frank,",88903_0.txt
"James and Martin, aged 26, 19 and 16",88903_0.txt
"and B. D. Yatis, aged 27.,",88903_0.txt
"As reported here, the men lynched had",88903_0.txt
been suspected of petty stealing for,88903_0.txt
some time. Last Saturday they were,88903_0.txt
"arrested for stealing barb- wire, pieces",88903_0.txt
of harness and some hay forks.,88903_0.txt
search warrant was issued and the har- A,88903_0.txt
As soon as the lynching was discovered,88903_1.txt
word was telegraphed to the district,88903_1.txt
"attorney and sheriff at Alturas,",88903_1.txt
"and they, together with the coroner, are",88903_1.txt
on the way to the scene of the tra-,88903_1.txt
now gedy to hold an inquest.,88903_1.txt
"Indianapolis, June 1.- A hundred or",88903_2.txt
"more factory hands of Brightwood, a",88903_2.txt
"suburb of this city, and farmers from",88903_2.txt
the country around engaged in a hunt,88903_2.txt
for a young man who brutally attacked,88903_2.txt
"7- year- old, and a lynching may",88903_2.txt
follow the capture girl of the culprit.,88903_2.txt
"aged 11, has been confirmed by finding",88904_0.txt
the girl's pocketbook in a vault at the,88904_0.txt
"Limon railroad depot, where Porter admitted",88904_0.txt
he threw it. A dozen citizens of,88904_0.txt
"Limon, where the crime was committed,",88904_0.txt
started for Denver on the morning train,88904_0.txt
with the avowed purpose of acting as an,88904_0.txt
escort for Sheriff Freeman and the pris-,88904_0.txt
oner on the journey to the jail at Hugo.,88904_0.txt
"Five hundred determined men, most of",88904_0.txt
"them ranchmen, have assembled at Li-",88904_0.txt
"mon and Hugo, and they make no",88904_0.txt
of their intention to lynch Porter. secret,88904_0.txt
A crowd of excited men has gathered,88904_0.txt
at the city jail bent upon lynching Porter,88904_0.txt
. It is believed the report that the,88904_0.txt
"prisoner has been removed is false,",88904_0.txt
given out for the purpose of,88904_0.txt
the public. misleading,88904_0.txt
TELEGRAPHIC NEWS:,88904_1.txt
"A Riot at Tampa, Fla",88904_1.txt
Colorado Mob Threatens. Lynching.,88904_1.txt
MOB BY THE,88905_0.txt
NEGRO LYNCHED,88905_0.txt
Trapped in Barn which was Set on,88905_0.txt
Fire by the Posse,88905_0.txt
Was in Pursuit Which.,88905_0.txt
"KINSTON, North Carolina, April 5.",88905_1.txt
-A mob from Greene county broke,88905_1.txt
into the Lenoir county jail here today,88905_1.txt
", dragged out Joseph Black, negro,",88905_1.txt
and lynched him. The mob charged,88905_1.txt
he furnished the shotgun with which,88905_1.txt
"his son, Will Black, seriously wound-",88905_1.txt
one of the men attempting to ar-,88905_1.txt
him for an assault on a six year,88905_1.txt
rest old girl.,88905_1.txt
The Murderer Lynched by an In-,88906_0.txt
furiated Mob.,88906_0.txt
"Wife and Babe of Frazier, the Hiteman",88906_1.txt
"( Ia.) Murderer, Not Dead.",88906_1.txt
"OTTUMWA, Ia., March 25.- Mrs. Fra-",88906_1.txt
zier the wife of Louis Frazier who,88906_1.txt
"Wednesday,",88906_1.txt
",",88906_1.txt
lynched at Hiteman,88906_1.txt
",",88906_1.txt
was,88906_1.txt
was not killed outright by the wounds,88906_1.txt
"inflicted by her husband, as",88906_1.txt
"was reported, but her death",88906_1.txt
is pretty certain. Mrs. Frazier's,88906_1.txt
"3- months- old baby, which was also",88906_1.txt
"a victim of its father's rage, is terribly",88906_1.txt
mutilated. After stabbing the two,88906_1.txt
women Frazier attacked the baby and,88906_1.txt
tried to cut off one of its legs. Before,88906_1.txt
completing this act Frazier fled.,88906_1.txt
"Deputy Sheriff Lewis, with a posse,",88906_1.txt
caught the man rear Albia. A mob of,88906_1.txt
miners took the prisoner from the officers,88906_1.txt
and hanged him to a tree in front,88906_1.txt
of the house where the crime had,88906_1.txt
committed. been,88906_1.txt
Lynched. Negro,88907_0.txt
[ Cnited Press Leased Wire Service.],88907_0.txt
"FARMERSVILLE, La., April 1.-",88907_0.txt
"Allen Turner, a negro, was lynched",88907_0.txt
during night by a mob because,88907_0.txt
"he attacked the J. J. McDongald, a farmer.",88907_0.txt
LYNCHED BY A KANSAS MOB.,88908_0.txt
White Man in a Quarrel.,88908_0.txt
A Young Negro Strung Up for Stabbing a,88908_0.txt
"KANSAS CITY, Mo., April 22.- At 9",88908_0.txt
"o'clock Thursday night at Salina, Kan.,",88908_0.txt
a mob of 500 citizens lynched Dan,88908_0.txt
"Adams, a young negro, for having assaulted",88908_0.txt
Agent Stout of the Union Pacific,88908_0.txt
freight office there with a razor.,88908_0.txt
The negro was found in the depot,88908_0.txt
by Stout early Thursday morning,88908_0.txt
and the agent ordered him out. The,88908_0.txt
negro refused to go and Stout started,88908_0.txt
for him with a shovel. Adams cut the,88908_0.txt
agent five times with a razor. The latter,88908_0.txt
wiH not die. At noon the district,88908_0.txt
court convicted the negro and sentenced,88908_0.txt
him to seven years in the penitentiary.,88908_0.txt
Sheriff Phillips had his man and was,88908_0.txt
on his way to the penitentiary with,88908_0.txt
him when overtaken by the mob. The,88908_0.txt
negro was under a seat in the coach.,88908_0.txt
The mob hauled him out and in ten,88908_0.txt
minutes had him under a telegraph,88908_0.txt
pole. The negro tried to say something,88908_0.txt
", but his utterances were drowned",88908_0.txt
by the yells of the mob. At 9 o'clock,88908_0.txt
he was hauled dressed only,88908_0.txt
up,88908_0.txt
in a shirt and trousers. In ten minutes,88908_0.txt
he was dead and the crowd dispersed.,88908_0.txt
There is great indignation at Salina,88908_0.txt
over the summary method used in the,88908_0.txt
"case of Adams, but the mob contained",88908_0.txt
many so- called good citizens. The negro,88908_0.txt
was 20 years old and this was his first,88908_0.txt
serious,88908_0.txt
crime.,88908_0.txt
"COLUMBUS, Fla., Nov. 14.- This neighborhood",88909_0.txt
is greatly worked up over the,88909_0.txt
recent lynching of the negro Henry,88909_0.txt
"Boggs, who murdered W. J. Duncan",88909_0.txt
"at Lake City Junction last Monday,",88909_0.txt
the horrible mutilation of the colored,88909_0.txt
man's body and the mysterious,88909_0.txt
disappearance of three other negroes.,88909_0.txt
Boggs is said to have been taken away,88909_0.txt
from the officers and stabbed and shot,88909_0.txt
to death by the mob. The story is that,88909_0.txt
as soon as the mol got possession of,88909_0.txt
the man it began the work of death,88909_0.txt
by cutting in vari-,88909_0.txt
into,88909_0.txt
the flesh,88909_0.txt
ous parts of the body. To silence,88909_0.txt
his cries a handkerchief was crowded,88909_0.txt
into his mouth. It is further reported,88909_0.txt
that his eyes were first stitched up and,88909_0.txt
then gouged out. The sockets were,88909_0.txt
eyeless when the body was found the,88909_0.txt
next day. As to the other men-,88909_0.txt
three in number- implicated in the,88909_0.txt
"murder of Duncan, they are said",88909_0.txt
to have escaped from the officers,88909_0.txt
who had them in charge Thursday,88909_0.txt
night. Some say with a meaning smile,88909_0.txt
that the men made their escape by,88909_0.txt
breaking apart the handcuffs which,88909_0.txt
held them together and taking to their,88909_0.txt
heels under fire. It is the general,88909_0.txt
opinion here that they were,88909_0.txt
and tortured. lynched,88909_0.txt
"Tenn. Fayetteville,",88911_0.txt
Brutal Negroes Are Lynched at,88911_0.txt
was too late to,88911_1.txt
Robertson was charged with attempted,88911_1.txt
assault upon a Miss Stewart.,88911_1.txt
He only missed lynching a few weeks,88911_1.txt
ago by the officers who arrested him,88911_1.txt
near Bell Buckle being warned not to,88911_1.txt
bring him to Lewisburg. McGaha was,88911_1.txt
charged assaulting a 13- year- old,88911_1.txt
white girl with.,88911_1.txt
Says Innocent Meg Were Lynched.,88911_2.txt
"San Francisco, Nov. 30- A local paper",88911_2.txt
prints a letter from Arizona signed,88911_2.txt
"John Doe, in which the writer says he",88911_2.txt
committed the murder for which Garland,88911_2.txt
Stemler and Louis Mureno were,88911_2.txt
lynched by a mob at Yreka last August.,88911_2.txt
Two other men were lynched at,88911_2.txt
same time. the,88911_2.txt
Mob Threatens to Lynch Willie John-,88912_0.txt
"son, Who Was Caught in the Act of",88912_0.txt
Crime He Hangs,88912_0.txt
Committing a-,88912_0.txt
Pursuers.,88912_0.txt
Himself With Baling Wire Before His,88912_0.txt
Special to Times- Republican.,88912_0.txt
"Boone, April 23.- Willie Johnson, 26",88912_0.txt
"years old, of Champlin, Minn., a grader",88912_0.txt
for the Newton& Northwestern railroad,88912_0.txt
", was caught in a horse stall in a",88912_0.txt
barn in the act of committing an un-,88912_0.txt
speakable crime at Frazer at 6 o'clock,88912_0.txt
last night. A mob gathered and threatened,88912_0.txt
to lynch him. While he was corralled,88912_0.txt
in the barn he found a baled hay,88912_0.txt
"wire, tied it to a beam and around his",88912_0.txt
neck and hung himself by lifting his,88912_0.txt
feet from the floor. The greatest excitement,88912_0.txt
prevailed and the anger of the,88912_0.txt
crowd was such that if he had not killed,88912_0.txt
himself he would undoubtedly have,88912_0.txt
fared hard at the hands of the infuriated,88912_0.txt
mob. The coroner's jury rendered,88912_0.txt
a verdict of suicide and the remains,88912_0.txt
were shipped his home in Minnesota,88912_0.txt
this morning. to,88912_0.txt
the authorities will take action looking,88913_0.txt
the arrest and punishment of,88913_0.txt
toward those prominent in the lynching of,88913_0.txt
and that men were invited to participate,88913_0.txt
", and given notice when and where",88913_0.txt
assemble. It was this fact that gave,88913_0.txt
"publicity to to the lynching, for the news",88913_0.txt
off according to arrangements. It is a,88913_0.txt
fact that public sentiment so generally,88913_0.txt
approves the lynching that it would be,88913_0.txt
hard to secure conviction of the lynchers,88913_0.txt
", even if arrests are made, which",88913_0.txt
seems doubtful. During the day thousands,88913_0.txt
of persons went to the scene of,88913_0.txt
the lynching many of them intent on,88913_0.txt
"securing ghastly, relics. In this, how-",88913_0.txt
lynching were talked about in advance which she used at school for sharpening,88913_0.txt
pencils. There was every evidence,88913_0.txt
and that that,88913_0.txt
"Wilmington, Del., June 23.- All is",88913_1.txt
"quiet in this community today, following",88913_1.txt
the horrible lynching of George,88913_1.txt
"White, Helen Bishop's confessed slayer,",88913_1.txt
early this mining. Of a mob of nearly,88913_1.txt
"5,000, identity of only one was known.",88913_1.txt
"That person is little Peter Smith, aged",88913_1.txt
"12, who fell sericisly wounded when",88913_1.txt
the workhouse guards fired a volley into,88913_1.txt
the ranks of the attacking mob.,88913_1.txt
Public sentiment appears to approve,88913_1.txt
of the lynching here of White and it,88913_1.txt
WANTED TO LYNCH,88913_3.txt
Southern Iowa Farmer Stabs Young Man,88913_3.txt
Changed Tele- Latter Because the,88913_3.txt
phone Call- He May Die Neighbors-,88913_3.txt
Threaten to Lynch.,88913_3.txt
Special to Times- Republican.,88913_3.txt
"Corning, June 23.-C. W. Richards,",88913_3.txt
"lives miles south of here,",88913_3.txt
who,88913_3.txt
ten,88913_3.txt
stabbed a young man in the back because,88913_3.txt
he changed his telephone ring in,88913_3.txt
some way not to Mr. Richards' liking.,88913_3.txt
They arrested Richards and took him,88913_3.txt
to Bedford. Some of the neighbors,88913_3.txt
"wanted to lynch Richards last night,",88913_3.txt
but some of the older ones prevailed on,88913_3.txt
the crowd to let him go to jail. The,88913_3.txt
boy was badly cut across the face and,88913_3.txt
"neck and across his breast, probably",88913_3.txt
not fatally but very badly. Richards,88913_3.txt
"had only a, jack knife.",88913_3.txt
"Greenville, Miss. John Dennis, a",88914_0.txt
"negro, was lynched by a mob of 200",88914_0.txt
men. negro attempted an assault,88914_0.txt
upon a The well known young lady.,88914_0.txt
"Jailor Is Overpowered, the Prisoners",88915_0.txt
Secured and Taken Mile From,88915_0.txt
Town Where They Are a Lynched-,88915_0.txt
"Atlanta, Ga., June 26.- Bulletin",88915_0.txt
Meager reports received here from Al-,88915_0.txt
"bany, Ga., state three negroes have",88915_0.txt
"been lynched at Newton, Ga.,",88915_0.txt
miles south of Albany. twenty,88915_0.txt
ARKANSAS MOB HANGS NEGRO.,88915_1.txt
Colored Man Who Attacked White,88915_1.txt
Landlord is Lynched.,88915_1.txt
"Brinkley, Ark., June 26.- Clarendon,",88915_1.txt
"a town sixteen miles south of this city,",88915_1.txt
was the scene of a lynching yesterday.,88915_1.txt
Jack,88915_1.txt
"Harris, a negro, was hanged",88915_1.txt
to the rafters of the porch to the Amer-,88915_1.txt
ican Cotton company's office by about,88915_1.txt
fifteen masked men. No disturbance,88915_1.txt
was created. Last Sunday night,88915_1.txt
the,88915_1.txt
"negro viciously assaulted his landlord,",88915_1.txt
"John Coburn, a white planter, living",88915_1.txt
"eight miles east of Clarendon, break-",88915_1.txt
jing one of his arms and inflicting numerous,88915_1.txt
other wounds about his body with,88915_1.txt
a beam of wood having a spike driven,88915_1.txt
thru it. Coburn's wife appeared with a,88915_1.txt
gun and Harris fled. Coburn had rebuked,88915_1.txt
the negro for using a mule without,88915_1.txt
permission. Harris was captured,88915_1.txt
the next day and taken to Clarendon.,88915_1.txt
Sheriff Milwee hid Harris outside the,88915_1.txt
jail. When the demand was made on,88915_1.txt
him for the keys he took the mob thru,88915_1.txt
"the jail, but Harris was found in",88915_1.txt
jail and hanged. the,88915_1.txt
"Wilmington, Del., June 26.- After the",88915_2.txt
hearing before Magistrate Hollis today,88915_2.txt
"Arthur Cornell, arrested on the",88915_2.txt
charge of murder in connection with,88915_2.txt
"the White lynching, was dismissed,",88915_2.txt
there being no evidence against him.,88915_2.txt
"Leander Moore and Joseph Shockley,",88915_2.txt
negroes arrested for shooting Policemen,88915_2.txt
McDermott and Green during the,88915_2.txt
"disturbance last night, were adjudged",88915_2.txt
guilty of inciting riot. Moore was giv-,88915_2.txt
a year in jail and Shockley was,88915_2.txt
en fined$ 50.,88915_2.txt
"William Hamilton, of Asotin County,",88916_0.txt
Who Outraged and Killed an Eleven,88916_0.txt
"Year Old Girl, Lynched by Mob",88916_0.txt
"1,000 Angry Citizens Crime and of",88916_0.txt
"Asotin, Wash., Aug. 5.- Despite the",88916_0.txt
"efforts of the little victim's father,",88916_0.txt
"Sheriff Richards of Asotin county, who",88916_0.txt
had sworn in twenty- five deputies to,88916_0.txt
"guard the brute, William Hamilton, a",88916_0.txt
"well- known farmer, self- confessed out-",88916_0.txt
rager and brutal murderer of Mabel,88916_0.txt
"Richards, aged 11, was forcibly taken",88916_0.txt
from the jail here shortly after midnight,88916_0.txt
and lynched by a mob of over a,88916_0.txt
"thousand men, which had been congregating",88916_0.txt
all day from all parts of,88916_0.txt
county. the,88916_0.txt
Special to Times- Republican.,88917_0.txt
"Muscatine, March 30.- The",88917_0.txt
"negro,",88917_0.txt
"Frank Brown, who shot Harry Holz-",88917_0.txt
hauer here Saturday night and who,88917_0.txt
fired upon the officers who pursued,88917_0.txt
"him, is in jail here awaiting the pre-",88917_0.txt
liminary hearing. Excitement Sunday,88917_0.txt
morning was intense and there were,88917_0.txt
many threats of lynching. Gangs of,88917_0.txt
"toughs from South Muscatine, the",88917_0.txt
"lower districts of the city, were gather-",88917_0.txt
"ed around the jail, and in order to protect",88917_0.txt
the the sheriff had the,88917_0.txt
jail carefully prisoner guarded. A policeman,88917_0.txt
The negro was taken down the street,88917_1.txt
in the center of a squad of policeman,88917_1.txt
who were repeatedly forced to beat,88917_1.txt
"back the mob, who wanted to",88917_1.txt
him. lynch,88917_1.txt
The mob was frenzied and excited,88917_1.txt
"men yelled"" Lynch the black",88917_1.txt
"telephone pole."""" Let",88917_1.txt
String him to a,88917_1.txt
""" us have him.""",88917_1.txt
